id,text,label
513,Nyaman. Nang jelas sambal tysonnya oke! Makan pakai menu apa haja banaik amun makan di sini!,positive
530,"Silakan kunjangi toko buhan kami gasan nang samalam bacari handphone advan, xiaomi redmi 4a wan nokia 150",neutral
917,Mahasiswan wayahini kababanyakan mengeluh tagal kurang bakarya,negative
586,"Menunya simpel, pastanya banyak pilihan rasa, wadahnya nyaman, minuman jua banyak pilihan, ada makana penutupnya jua. Tambah ada jadwal live musik harusannya supaya makin bengkeng pang.",positive
783,Tagihan internet ulun kada masuk diakal 250% talarang kakak! Parlu panjalasan,negative
457,Sarik banar. Pasan wan bayar tiket pasawat digawinya jam satangah 1 susubuhan gasan panarbangan jam 6 baisuka. E tiket kada dikirim. Sakalinya dihubungi via email kalu tiket nang sudah dibayar sudah habis jam jam baisukan. Kalu tiketnya habis kanapa masih kawa dibooking.,negative
520,"Miris banar bin ironis, kalakuan kada bakualitas! Kada layak jadi wakil rakyat 270 juta populasi panduduk mulai sabang sampai merauke!",negative
17,"Gasan makanan baragam lamun minyak talalu banyak, gurame basanga kada nyaman karena kada disanga karing. Jus nang ditawari kada tapi banyak banyu wan kurang sigar. ",negative
501,"Mudahan setia tarus mangawani rakyat Indonesia mulai sabang - merauke, mulai kota sampai kapalusuk kampung",neutral
27,Toyota manduduki paringkat pemulaan sabagai merek mubil nang paling baharaga.,neutral
45,Wajar sasama maling harus saling manjagai. jadi nang dimasalahakan tu sual cara wan lain intinya kalu angguta diwan tatangkap tangan narima tapalan.,negative
236,"Rasanya sadang. Sambalnya jua nyaman. Apalagi disurungkan 3 macam kaitu. Lawan banyak pilihan sabujurnya handak makan apadisini. Handak gurami, handak kakap, bawal, kerang, cumi, hundang. Macam macam pang. Asal jangan mamasan iwak buntal aja. Kadada disini.",positive
610,Wahini ulun sudah talalu muar online shop ulahan asing itu.,negative
94,"Mulai zaman kuliah sampai wahini masih katuju ja makan di kuis butcher. Nyaman, tajangkau, wadahnya jua nyaman.",positive
372,"Kulir makan oreo, katuju maulah gigi hirang",negative
902,"Menu katujuan ulun ngitu sup daging wan minumannya es cingcau hirang. Rasanya nyaman, disuruhakan banar ",positive
152,Pamandangan surabaya wayah malam luarbiasa makanannya nyaman nyaman tagal haraganya luarbiasa jua jarak katapi jauh tagal pamandanggannya luarbiasa wan hawanya rami,positive
790,"Manjauhi karamian, menhub mamadahai masyarakat kada usah babulik ka jakarta baimbaian pas 1 januari",neutral
32,risturan lawan pamandangan nang mambari kapingin biar harus dilalui lawan kundisi nang cukup dalam. Tagal tabayar haja lawan wadah wan rasa nang oke,positive
302,Steak nang sebujurnya steak especially chiken cordon bulenya nang maolah karindangan jua makan nang dikalubuti pamandangan bandung nang liwar top. Pas banar datangnya malam lawan laki-bini kayapa haja wan kaluarga jua tatap rami. Jalan manuju kasana dasar babiluk-biluk parlu usaha wan tugul.,positive
357,Ngini salah sabuting wadah nang makanannya nyaman wan pamandangannya sajuk di mata. Gasan bakumpul wan kaluarga atawa kakawanan dasar bujuran wadah nang cucuk.,positive
736,Mambari murar. Senin pagi wan macet banar wan banjir,negative
953,Kadida nang talalu istimiwa dari risturan nang manyurungakan menu makanan khas sunda ngini. Rasa babarapa makanan nang ulun pasan sama haja wan rasa rumah makan sunda lainnya. Kada bataha manimbulakan rasa nikmat nang kuat wan maulah ulun takasan sacara mandalam. Babaya ayam goreng sambal penyet pasanan ulun nang rasanya saikit mamaraki nyaman.,negative
763,"Iklan youtube kanapa kada kawa diskip gerang, mancaur banar",negative
36,Palayanan pt kami sangat mamuasakan,positive
24,"Hanyar sakali datang ka eatalia, ulun datang wan kawan wan saikung anak. Kada mamusingakan pas mamilih makanan gasan anak gegara intang sini manyurungi menu wan porsi kakanakan. Kami mamasan pizza wan roti bewarna hirang. Gasan sabarataan menu nang ulun pasan kada mangaciwakan.",positive
243,Manangkan hadiah bengkeng cukup maumpati baadu poto di alfamart,neutral
969,Amun ka Bukittinggi jangan kada ingat singgah ka Pasar Atas. Banyak pilihan makanan nyaman. Jangan kada ingat mambawa kamera gasan bafoto-foto,positive
362,"Ini pang tahayul nang maulah tahun baru jadi setibar baacaraan wan ulahan, kadada kadalaman makna.",negative
53,India lagi maulah superbike listrik nang laju banar,neutral
57,Sudah lawas ulun handak tulak bajalanan ka luar negeri,neutral
230,"Tenderloin steak di suis butcher nyaman banar - juicy wan saus kuisnya pas di ilat, salain itu haraganya gin pas di kantung. Makanya itu, basiap haja maantri mun pian datang di panghujung minggu wan hara atan jam makan.",positive
413,Kawanku jua banyak nang bagawi di bukalapak.,neutral
65,"Paling kada umpat lalu, ulun handak manukar tiket buhan kami senen - yogyakarta makai promo nang bulan mei.",neutral
903,Mun jar ulun kada usah tulak ka sana pas wayah makan gegara pina ngalih gasan mancari wadah dudukannya,neutral
161,Liwar bapasan bukalapak makai gosend samalam sampai wayah ini baluman ja jua sampai kayapa kah jua nih. Ada parlu lakas wan barangnya,negative
899,kamarnya bau roko. Seprainya kada diganti gasan tamu hanyar wan masih ada bakas abu rokonya,negative
589,Si A bapandir tong kosong nyaring bunyinya bapandir kada babobot,negative
636,"Sambalnya kada akan ada di wadah lain. Rasa acannya liwar lain, masin manisnya pas. Ruangannya dasar kelas warung tapi jangan takajut waktu bayar haraganya kelas ristu tapi sasuai lawan kualitas makanannya.",positive
710,"Mun jar ulun steaknya mayan nyaman, tagal pang tebaik pesan nang paling gonol haja, ngitu labih hapuk dari nang lain. Amun ka sini, kawa manyebarakan foto di media sosial wan dapat es krim gratis. Es krimnya nyaman kam. Amun segi makanan oke, dari palayanan jua baik.",positive
250,Dijaga lah makannya gus dasar lagi musimnya wayah ngitu. Bujur ja pang memusang tu malah maulah garing,negative
719,"Lawas-lawas ka sini unda kawa hipertensi mahadapi pasien bpjs ngini, bayar kada saapa tagal handak palayanan eksekutif wan bamamay, naik kereta haja gin mun handak nang eksekutif.",negative
