id,lang,source,target
755,bugis,Restoran di sini selalu penuh karena letaknya yang strategis di pintu masuk mal. Rasa bubur cukup enak. Proses penyajian dari order sampai penghidangan juga cukup cepat.,iyye rerstorang e tori penno nasaba makanja onroanna okko tange' tamana mal e. rasa buburuna malunra' sah. proses nareangta pole order lettu nareangki aga masija' meto
788,bugis,Habisnya aku lagi galau kak maka dari itu bikin story kayak begitu,agaje' masumpe'ka makkokkoe kak nappai makkabuaka story makkoro
616,bugis,"Untuk yang sedang ke cirebon dan cari tempat yang enak parkirnya dan makanannya butuh cepat, lebih baik ke sini karena parkiran luas dan suasana nyaman","Narekko okko ki cirebon na sappaki onroang makanja' parikiranna na masija' anre-anrena, lebbi ko laoki okkoe nasaba maloang parkiranna na makanja appeneddingenna"
396,bugis,Mm sedih deh kalau ke sini selalu menunggu: Mienya pedas banget. Hehe bangkunya juga tambahkan dong biar tidak menunggu,Mm massing nyawae sedding ko tollao okko e tori mattajeng: Mie na mapesse ladde'. Hehe kaderana aga tambai laloi kasi' bare' de tomattajeng
259,bugis,"Memang faktanya kami punya banyak tanah di sini, mau apa lo?! maka dari itu kerja biar bisa banyak duit kayak kami-kami, jangan cuma bisanya menghujat saja","engka memeng buttinna ko mega tana ku okko e, meloko maga? nampai to makkada ajjamako nara wedding mega dui'mu pada idi' maneng, aja'na kapau-pau sala bawang mullei"
850,bugis,Restoran The Valley ini pemandangan ke kota nya nomor 1. Menikmati suasana malam hari dengan lampu kedap-kedip indah sekali.,Restorang The Valley e we pattirona lao okko kotae nomoro' 1. Pirasai anyamangenna wenni e pake lampu tuo-mate mabello ladde'.
289,bugis,"Kalau ke semarang wajib makan mie kocok ini, menurut saya paling enak. Walaupun tempatnya dipinggiran ruko, dan untuk makannya mesti berusaha untuk dapatkan bangku, tapi layak banget kalau dibandingkan rasanya. Kikilnya banyak, kuahnya gurih banget dan mienya lebar dan tipis. Harganya juga terjangkau. Teh terbaik mie kocok di semarang.","ko lao ki semarang anre laloi iyye mie kocok e, ko iyya iyena peneng malunra'. okko tomi ha wiring ruko onroanna, nappa ko to melo manre sittajeng-tajeppi mala kadera, tapi coco' ladde meto ko purani ipirasai. mega kikilna, malunra' wae'na, maloppo na mabiccu mie na. masempo topa ellinna. teng paling makanja mie kocok okko semarang"
0,bugis,Maling yang sebenarnya sudah di pastikan bernama lulung,Iya ro panga tongeng e manessani makkada asenna Lulung
647,bugis,"Memang ya sepertinya aku tidak ditakdirkan nikmatin indomie goreng, padahal cuma merebus minya lho. Bisa-bisanya terlalu lembek. ","memeng sedding pada ko tennia totoku manre indomie goreng, padahal lae nasumi mie na. manengka maka lemma'"
643,bugis,Nike mengeluarkan produk sepatu terbarunya,Nike mappassu i produk sapatu kaminang baru e
532,bugis,"Waktu saya ke restoran itu, pelayannya mendatangi saya dan bertanya untuk berapa orang.",Wettukku lao ri restorang e iyaero. pajjamana naoloi ka' nappa nakkutanangngi makkada siaga ki' tau.
217,bugis,Roti bakar duti ini sudah ada sejak dulu di sini. Rotinya biasa saja sih. Hanya menu pilihannya buanyak banget. Apa saja ada. Sampe kadang bingung mau pilih yang isi apa. Ada jual bubur juga. Oke jugalah.,tunu roti duti e engka memanni riolo okkoe. biasa mo je rotinna. Iyamiro nasaba mega ladde rupanna. Engka maneng. Maderri aga malasa uluki aga melo lai pitte. Engka to laibalu' peca aga'. Makanja' metto.
901,bugis,"Kuota jadi habis terkuras buat melihat foto-foto yang cuma bikin saya iri, makanan enak-enak yang bikin ngiler","Kuota e mancaji cappu i tappake nasaba laipake mita foto-foto iya mappasiri atie bawang, anre-anre na malunra' mappamitti' elo."
596,bugis,"Saya suka sekali makan di restoran ini, menu masakannya beragam, rasanya enak, harganya tidak terlalu mahal. ","Iya' upoji ladde' manre okko restorang e we, menu anre-anre na maddupa dupang, rasana malunra', ellinna de' to namaka soli."
952,bugis,Kurang pas apabila berkunjung ke bandung tanpa mencicipi batagor. Batagor burangrang adalah salah satu yang rasanya enak dan sausnya pun gurih.,De nasikenna ladde' narekko jokka ki okko bandung tapi de ipirasai batagor e. Batagor burangrang iyanaritu sala siddinna makanja' e rasana sibawa paggamina makessing.
112,bugis,"Yang makan ramai, antre, menu masakan, masakan standar seperti di rumah. Rasa biasa saja. Harga tidak sesuai kualitas rasa.","iya manrewe maroa, antri nasu-nasunna, nasu-nasu biasa pada ri bolae. rasana ma biasa mi. ellinna de' na sikenna sibawa rasana"
912,bugis,"Saya bisa bilang ini adalah resto yang cocok untuk keluarga. Sambil istri saya belanja oleh-oleh, saya bisa menikmati makan siang di resto ini. Anak anak saya bisa bermain di tempat bermain dengan tiket yang murah. ","Weddingngi makkada ka' iyana resto sikanangeng e sibawa sumpuloloe. Mattangangngi beneku mabbalanca oleh-oleh, iya' wakkatai manre tangesso okkoe resto e. Anana' ku wedding i maccule ri anroang maculewe pake tike' masempo."
635,bugis,"Tempatnya ramai sekali, makanan bervariasi. Desain dan lingkungan nyaman. Udara sejuk, banyak tempat bermain anak.","onroanna maroa ladde', maega rupanna anre-anrena. modele'na na kamponna manyameng. angingna makessing, maega onroang acculeang anana'"
386,bugis,"Baik kak, berkenan menunggu untuk kendala pada provider telkomsel akan direspon oleh rekan kami.","Makanja' deng, meloki mattajeng nasaba' masala okkoe provider telkomsel melo i laijampangi okko anggota ta' maneng."
38,bugis,Kasihan personil ungu sekarang sepi job gara-gara ditinggal pasha,"Kurru sumange' na pacculena Ungu, makurangngi jama jamanna nasaba' laisalai okko Pasha."
471,bugis,"Kalau ada pulsa segudang, akan mengaktifkan wifi buat semua orang biar bisa internetan","Narekko engka pulsaku sigudang', Sitinajai upatuoi wifi e bare' nullei maneng tawwe pakei ma' internet"
176,bugis,Menkeu menyampaikan bahwa lemahnya rupiah lebih berpengaruh pada defisit transaksi berjalan,Menkeu mappalettu' makkada mallemmana rupiah e mallebbi i pengaruhna lao ri defisit transaksi appajokkanna.
392,bugis,"Pagi pagi di tol cipali sudah macet parah, bikin jengkel saja ini","Maele mopi okko tol cipali sillaca' laca' ladde' ni, mappasara nyawa siseng"
934,bugis,"Perihal pergantian rekening untuk pembayaran autodebet BPJS, Bapak Luqman bisa datang ke kantor cabang Bank Mandiri pengajuan autodebet tersebut ya. Untuk dapat dilakukan tutup rekening terlebih dahulu.","Appaselleanna rekening iya ipakewe makkamaja autodebet BPJS, Bapak Luqman wedding lao okko kantoro' cabang Bank Mandiri pangoloangngi iyaro autodebet e. Bare' kedoi laoki jolo tutu' i rekening e."
785,bugis,Mobil yang sehari-hari dipakai jeje adalah merk toyota dan berwarna krem.,oto esso-esso e napake jeje iyaro merek toyota warna krem
245,bugis,"Suasana sawah dan pegunungan, ada wine cellarnya. Tapi makanannya mahal, mestinya kualitas bisa lebih baik karena banyak restoran serupa di bandung sekarang sudah menjamur","marasa galung na bulu, engka wine cellarna. masoli ellianna, na wedding ni makanja kualitasna nasaba megani restorang pada iyye okko bandung"
469,bugis,Paling kesal kalau ada orang mengobrol di jalan sambil motoran apalagi kalau jalannya sempit,makereng-kereng ladde'ka  ko engka pammotoro maccarita okko lalengnge apalagi ko macipi' lalengnge
679,bugis,"Pelayanan kurang aktif dan tidak ramah serta kurang dapat menjelaskan menu makanan yang ada, sehingga tamu merasa tidak diacuhkan dan didiamkan saja.","pajjama kurang kedo na de'na mabessa nappa de'na macca paui aga-aga menunna, jadi tamu e merasani de' lae jampangi na lae mekkorimi bawang"
597,bugis,"Restoran sangat bagus, pemandangan menghadap ke kota Bandar Lampung, sehingga sangat indah pada malam hari. Suasana sangat tenang, dekorasi ruangan sangat cantik. Saya sangat suka tempat ini.","Restorang makae kanja', pattirona mangolo lao okko kota Bandar Lampung, naekkiya maka bello yako wenni wi. Appeneddingenna mappatennang, bello bello kamara' na maka gello. Iya' upoji ladde' i iye anroangnge."
650,bugis,Calon pelamar cpns hanya dapat mendaftar di 1 instansi dan 1 formasi jabatan,calon pelamarna cpns 1 mi instansi wedding na daftari na 1 tomi formasi jabatan
58,bugis,"Makanan lumayan, saya order spring roll agak oily, harga hidangan utama cukup mahal. Bangunan unik tapi lokasi tidak terlalu bagus sehingga tempatnya selalu terlihat sepi. Saat order sebaiknya menyampaikannya lebih jelas, sebab yang terjadi pada kami, kami order 2 tapi menerima 3 item. Pelayan sangat ramah, tapi sikap kasirnya sedikit aneh. Mungkin saya tidak akan kembali lagi.","Anre-anre na makanja sa, iya' massuroang spring roll iya mabokae, ellinna anrewe masoli cedde'. Bangunanna silleangeng sibawa laingnge tapi anroanna de na makanja iyanaro nassabari de namaroa taue pole laiyita. Wettunna tamassuroang makanja pa yako laipaupi manessa, nasaba' iya e pole rialeta' maneng, iya' maneng massuroang 2 tapi iya pole e 3 rupa. Pajjamana mabessa., tapi paggaukeng na kassere' e makalang-laeng. Nulle kapang iya de na ulisu pemeng."
191,bugis,"Ikan gurame bakar dan cah kangkung yang disajikan di red s dipo yang saya beli pada saat makan siang pada bulan november 2012, rasanya lumayan oke, hanya saja cabe pada sambalnya dan sayurannya seperti: Timun, tomat dan kangkungnya juga jeruk pada es jeruknya terasa kurang segar.","Bale gurame tunu sibawa kaju lare' iya napatale' e okko red s dipo iya welli e wettunna manre tangesso ri uleng novembere' 2012, rasana makasa kessing, iya miro bawang ladang okkoe peco' peco' na sibawa kajunna padae: bonte', lambace, sibawa lare' na makkotoparo lemo okkoe ese' lemo na pada ko de na namabaru."
246,bugis,Karya bakti bca finance posisi relationship officer membuka lowongan untuk penempatan pekanbaru,karya bakti bca finance posisi relationship officer ma'bukka lowongang i okko onroang barunna ri pekanbaru
470,bugis,Makan bakso sambil ngobrol sama teman teman. Tempatnya asik buat makan. Harganya tidak terlalu mahal.,manre basso na to maccarita sibawa sibatta. makanja' onroanna lai pake manre. detto pa na masoli ellinna
450,bugis,"Di tengah proses hukum, warga tamansari bandung hadapi tekanan penggusuran","tengngana proses hukum e, tau tamansari bandung lai dondoro' si salai bolana"
930,bugis,Hari ini mau belanja di toko itu supaya bisa dapatkan peralatan masak keren plus kesempatan liburan ke Belanda.,Iye essoe  maeloka mabbalanca okko iyaro tokoe bare' wulle runtu' parewa mannasu makanja' e sibawa akkattang pakansi lao Belanda.
420,bugis,"Jangankan 1 jam, ngeplay stories yang cuma beberapa detik saja loadingnya lama sekali, indosat luar biasa.","aja'na 1 jang, laiputara' lagi carita'e siami detik maka etta' loadinna, tennia pato je' indosat"
416,bugis,Tidak bosan dan terkesima. Setiap datang ke congo kafe. Tempatnya tenang. Nyaman. Coba deh datang malam hari. Lebih romantis. Kalau bawa pasangan,De' nappa bosang na mappacekka topa. Tungke' tungke' lao okko congo cafe. Mappatennang onroanna. manyameng. cobaki lao wenni. romantis pi. ko bawaki balitta.
863,bugis,Harganya sangat terjangkau dan menu makanannya cukup kekinian. Tempat makannya didekor dengan baik dan unik.,ellinna mappasidapi mo na menu anre-anre na mabaru sa. anroang manre na laimodele' kanja' na mabello
946,bugis,Tempatnya kurang bersih. Untuk pergi ke sana agak susah karena rawan macet. Jadi berpikir dua kali kalau mau kembali lagi.,Anroanna kurang mapaccing. Ko tallao okkoro mawatang cedde' nasaba' marepe' taue sillaca' okko laleng e. Mancajiwi mappikkiri bekka dua ki ko maelo ki lisu pemeng.
136,bugis,"Tim saya akan mengadakan makan malam tema di burgundy. Daripada tersesat, saya dan sekretaris saya mencoba mengecek tempatnya dahulu sehari sebelumnya. Sekalian juga tes makanan. Perjalanannya jauh sekali dan naik turun bukit. Diperparah ketika kami ke sana itu hari minggu sore sehingga macet. Sesampainya di sana sih pemandangannya oke. Tapi layout restorannya biasa saja.","Tim ku maelo mangacara manre wenni iyaro pakewe tema okko burgundy. bere' de ta teddeng, iya' sibawa sekretarisku uparessa onroanna jolo siesso polena. ucoba toni pakkanreanna. mabela ladde' lalengna menre na nonno bulu. lebbi pasi nasaba' wettutta lao okkoro natujui esso aha' areweng jaji sillaca' laca' tau we. lettu ta okkoro laiyita pattirona makessing. tapi ko laiyita anroanna sitongenna mabiasa mi"
63,bugis,"Saya gunaka bb tipe 9210, saya mendapat info sejak kemarin, dikenakan biaya gprs.","Pake ka BB tipe 9210, runtu' ka iwenni pappaseng, laipakennai pakkamaja GPRS."
85,bugis,"Handphone saya lenovo, kecemplung di comberan pas 2 minggu baru beli, jatuh di aspal pas ngebut naik motor sampai isinya ke mana-mana, telepon genggam saya masih bertahan, mantap memang lenovo.","Handphone ku mere' lenovo, taddene' i okko benrang-benrang e 2 minggu punara lauwelli, taddene' toi okko bata loppoe wettukku malessi mammotoro' na tabberre berreangngi ise'na, na makessing mopi lai pake, makessing metto lenovo."
824,bugis,Batagornya besar-besar dan dagingnya terasa banget. Mantap deh. Bumbunya rasanya enak. Cocok kalau dijadikan menu untuk makanan ringan sore hari.,Batagor na maloppo loppo sibawa juku na marasa ladde'. Makanja' sa. Paggamina makanja' rasana. Sikanangeng narekko laipancaji wi anre-anre maringeng ri wettu areweng i.
323,bugis,Sangat melelahkan malam ini.,Maka ladde' tekko e iye wenni e
260,bugis,Saya sudah kirim email complaint karena telepon tidak masuk terus.,purana' kiring email macai nasaba tori de'na tama telepong e
7,bugis,Porsinya banyak kepiting kisaran 100 ribu / porsi. Udang bakarnya enak. Enak bumbunya penuh rempah. Harga dan rasanya bersaing dengan perahu seafood jalan sumatera.,Maega ise'na bukkang na ellinna 100 sebbu / penne. Tunu uranna malunra'. Malunra' topa paggamina. Ellinna sibawa rasana sissaingeng ngi sibawa Perahu Seafood iya engkae okko jalan sumatera
225,bugis,Rizal ramli beberkan cara stabilkan harga beras,rizal ramli mappalettu' pekko carana pasi kette'i ellianna werre' e
75,bugis,Saya sebagai warga jakarta malu kang sama oknum yang tidak bertanggung jawab yang mau sweeping bobotoh,Iya' na mancaji tau jakarta masiri-siri sappo mitai iyaro tau meloe paleppang maneng i bobotoh e.
812,bugis,Bali adalah salah satu pulau yang menjadi tujuan destinasi para turis.,Bali mancajiwi bara siddi pulau iya mancaji e anroang pakansi na toris e.
476,bugis,"Perjalanan kali ini dalam rangka urusan mencari tempat yang rekomendasi untuk klien kami. Jarak tempuh dari bandung kota cukup jauh memang, tetapi hal tersebut bisa terbayar dengan pemandangan yang yang cantik di waktu malam dan makan malam dengan makanan dan pelayanan okay.","jokka makkokkoe to lao sappa onroang sicoco' okko pelangganta. mabela memeng pole bandung kota, tapi lai waja moi na anre wenninna malunra nappa makanja pajjamana"
724,bugis,"Lokasinya memang sedikit tersembunyi di sudut sebuah perumahan. Konsep tempatnya bagus, seperti rumah di pedesaan eropa dengan lantai dan dinding kayu. Selain di dalam, pengunjung bisa menikmati makanannya di kursi-kursi di area taman yang unik menggunakan drum bekas.","Anroanna makkacubbu sa memeng cedde' okko sunna perumahang e. Pangatoro' onroanna makanja, pada bola okko kampong e ri eropa iya pakewe ta'ba' sibawa paddenring aju. Weddingki okko ilaleng, tau polewe wedding to pirasai anre-anre na okko kadera-kadera ri dare' e pake derong bekas."
880,bugis,Kami menjual kabel hdmi premium 1 meter beli 2 gratis 1 di lapak Rich Com Store.,Mabbalu' ki' kabale' hdmi premium 1 metere' melli 2 gratis 1 okko anroang Rich Com Store.
526,bugis,Tidak mau tahu. Balikin pulsa saya. Ini namanya perampokan. Paket nelp kalian juga perampokan. Baru ini saya komplain.,de umelo missengngi. palisuangnga pulsaku. minnau asenna iyye.pake' telepongmu aga minnau.nappanna iye keberatangnga e.
680,bugis,Daun memiliki berbagai jenis bentuk.,daung e punna mega rupanna modele
55,bugis,"Saya dan keluarga mencoba bersantap di karamba resto karena sopir mobil sewa kami merekomendasikannya. Kami memang tiba di tempat agak malam sekitar pakai. 21 meskipun restoran belum tutup atau bersiap-siap akan tutup, namun beberapa menu telah habis. Bahkan ibu dan suami saya memesan nasi timbel yang sayur asemnya sudah habis dan diganti sup sayur oleh pihak resto. Tidak banyak pilihan yang bisa kami pilih. Kurang rekomendasi.","Iya' sibawa sumpuloloku ipirasai manre ri karamba resto nasaba' sopiri' oto isewae mappajulluang i. Idi' maneng lettu ri angroangnge ro mawenni memenni macawe tette'. 21 namo iyaro restorang e depa na tattutu' yare' ga sadiani tattutu', iya mi ro nasaba mammulane cappu anrewe. Makkotoparo Indo' sibawa lakkaeng ku' massuroang nanre timbel iyae kaju lawinna cappuni jaji laisellei mancaji so' kaju okko pajjamana resto e. De na mega appileang iya weddingnge laipile. De na maega appileang."
234,bugis,"Berubah status jadi universitas, bsi gelar seminar motivasi","berubah statusni mancaji universitas, makkabuai bsi seminar motivasi"
133,bugis,"Rumah makan zaman dahulu namun rasa tetap sama enaknya, ayam dan nasi kreceknya enak sekali, kadang saya sengaja beli untuk bungkus ke rumah","Bola manre polewe wettu riolo tapi tette' mi rasana pada lunra'na, manu' sibawa nanre kerecek na malunra' ladde', maderri iya' wattungka melli mabbukku na laibawa lisu lao bolae."
765,bugis,"Agak kesal juga kalau tiap hari lewat sana melulu. Sempit, dua arah, macet sudah jadi makanan sehari-hari","Makereng-kereng tokki tu ko esso-esso lalo okkoro. Macike', dua arah, sillaca'-laca' manjawi anre esso-esso."
546,bugis,Adikku diterima di teknik lingkungan ITB,Anrikku laitarimai ri teknik lingkungan ITB
265,bugis,"Tolong cepat tindaklanjuti pengaduan saya, sebelum korban meretas gopay jadi bertambah.","tapasijaki lalo i kesi jampangi caritaku, daripada mega matu korbang lainna gopay e"
798,bugis,Menu utama andalan mereka adalah ayam betutu yang dapat dipilih variasi rasanya mulai dari tidak pedas hingga sangat pedas. Selain ayam juga ada bebek betutu dengan variasi rasa yang sama.,Menu utama andalanna okkoro iyanaritu manu betutu iya wedding e ta mappitte rupa-rupang rasana mappammula iya de' na mapesse lettu' mapesse ladde' e. Saliwenna manu' engka to iti' betutu iya pada-padae rupang rasana.
67,bugis,Tidak pernah bisa bicara kata-kata kasar ke pasangan walau tujuannya bercanda / memang lagi marah banget karena saking respeknya saya ke dia,Denengka makossara' pau-paukku lao ri pasangekku namo atakabborokeng mi yare' ga macai tongengnga. Lau pakaraja ladde' i kasi' alena.
722,bugis,Kemarin mereka mendaftar beasiswa djarum,wenni' alena maneng mendaftara i okko beasiswa djarum
232,bugis,Kak adit aku pesan indominya satu,kak adit millauka siddi indomie nah
35,bugis,"Oh iya diketerangan kan note 3 pro, kok yang dikirim note 3 ya, kecewa juragan","Oh iya okko keterangang e makkada note 3 pro, manengka note 3 mi engka pale, mangimpurui punggawae."
659,bugis,"Pria tabrak warga dengan mobil di prancis, 2 terluka","oroane malleppo masyaraka' pake oto okko prancis, 2 tau mapeddi"
25,bugis,"Saya penasaran pingin makan di sini. Ketika pesan, suara mas-masnya kecil sekali ampun deh tidak jelas bicara apa blubup blubup begitu haha. Saya memesan mi ayam 2baso ekstra, pacar saya memesan bakso urat soun. Tidak lama datang pesanan pacar saya dan ternyata tidak sesuai ekspektasi.","Iya' macinnaka' maelo manre okkoe. Wattunna tamassuroang, saddanna daeng-daeng e maka biccu cauka' de na manessa aga napau blubup blubup makkoaro haha. Iya' massuroang mi manu' 2basso pattambah, canrikku massuroang basso ure' soun. De na metta engka pole assuroangengna canrikku na depale' na sikenna agae naelori."
757,bugis,Teman saya bekerja di gojek,sibawakku majjama okko gojek
703,bugis,"Ya, saya sudah hubungi via halo bca. Namun terputus terus dan pulsa saya kepotong banyak kalau telepon berulang-ulang!","iyye', purana lae hubungi pake halo bca. tapi tori pettu-pettu na pulsaku ta'polo ni mega ko lai telepong terru i"
957,bugis,"Suasana sejuk, hijau, menyegarkan dan sangat cocok untuk refreshing saat kabur dari rutinitas. Untuk makanan yang mahal menurut saya bukan masalah karena lokasi yang bagus lebih penting.","Appeneddingenna macekke', makudara', manyameng sibawa sikanangeng laiyonri refreshing yako ta cili pole jamang e. Iya ko anre-anre na masoli detto namarigaga nasaba' anroang iya makanja' e kaminang penting ko iya'."
330,bugis,Bosan dengan dunia ini yang penuh dengan kemunafikan,Cauka' mitai lino e iya pennoe amunapikeng
609,bugis,Orang sekarang kebanyakan sulit menghargai orang lain,Taue makkokkoe maegangngi mawatang pakarajai rupa tau laingnge
332,bugis,Tempat ini mengimingi makan steak dan daging dengan harga murah. Namun kenyataannya tidak murah jika dibandingkan dengan kualitas dagingnya yang tidak enak. Dagingnya keras dan rasanya hambar.,Iye anroangnge napakkacinnaki manre steak sibawa juku iyae masempoe ellinna. Iyamiro nasaba yako laiyitai de na masempo yako laipasibaliwi sibawa akanjakenna jukuna iya de namalunra'. Juku na makeddo sibawa rasana makemme. 
869,bugis,Pagi sudah marah-marah karena pelayanan di bank cabang sanur yang tidak professional dan mengecewakan! Tidak salah banyak penilaian customer jelek.,Maele macai-cai nasaba' pangadarenna bank e cabang sanur iya de e na profesional sibawa mappasara nyawa! De nasala naseng maega costumer e maka ja.
119,bugis,Pergi untuk makan siang bersama 6 keluarga yang terdiri dari orang dewasa dan anak anak. Kami mendapatkan saung yang jauh di atas. Kebayang dong jalan ke atas yang sangat melelahkan. Tempatnya memang bagus tapi lokasi saung yang sangat jauh dan melelahkan menuju ke atas. Saran saya kalau mau ke situ jangan pas makan siang karena pasti penuh. Harga makanan lumayan misil. Tapi pemandangannya bagus sekali.,"jokka lao manre tangesso sibawa 6 sumpulolo iyanaritu tau maloppo na anana'. idi' maneng runtu' bola-bola iya mabelae yase'. tabbajang nitu yako jokka ki lao yase' maga tekkona. anroanna makanja; memeng iyami ro nasaba anroanna bola-bolae maka bela na mappatekko yako jokka ki lao yase'. ko iya', yako meloki lao okkoro aja'na wettu manre tangesso nasaba' manessa ni penno. ellinna anre-anre we maka misil. tapi pattiroanna makessing ladde'"
634,bugis,Steiknya lumayanlah enak. Warung ini cocok buat pelajar atau mahasiswa hehehe karena harganya terjangkau. Untuk makanannya oke kok.,steiknya malunra' sah. iyye warung e sicoco' passikolae are'ga mahasiswa hehehe nasaba masempo ellinna. ko anre-anrena makanja' sah
307,bugis,"Menurut saya makan di sini porsinya banyak dan harganya murah, terus makannya cepat datangnya lagi dan tempatnya juga bersih dan luas","Yako iyya' manre okkoe ise'na maka ega sibawa ellinna masempo, nappa anre anre na masija engka sibawa anroanna mapaccing na maloang"
264,bugis,"Orang indonesia itu butuh pemimpin visioner bukan penghibur,",ero tau indonesia e perellui pemimping lao yolo pikiranna tennia pa kellong e
565,bugis,"Tong dji menyajikan aneka makan dan minuman, tidak hanya teh. Yang direkomendasikan: Teh poci gula batunya dan nasi goreng",tong dji mappassadia maddupa dupang anre-anre sibawa inung-inungeng. tennia bawang teng. iya kaminang yajjulluangnge: teng poci golla batu na sibawa wette nanre
338,bugis,"Saya bukanlah penggemar berat kambing karena tidak tahan dengan baunya, tapi makan di tempat ini, saya seperti tidak sedang makan kambing! Dagingnya empuk, enak dan tidak berbau. Suasana restonya pun enak dan nyaman","Iya' tennia ka' tau poji ladde' i bembe' e nasaba de utahang mimmau i baunna, tapi manre ri okko anroangnge, pada siseng ko de wanre bembe'! Juku na malemma', malunra' sibawa de nabbau. Appeneddingenna resto e maka kanja' na mappenyameng"
156,bugis,"Saya mau tutup kartu kredit dari beberapa bulan lalu, nih.","Iya' maelo ka' mattutu' kartu kredi' wettunna mopa siaganna uleng labe' e, "
71,bugis,Yang benar-benar real tidak ada settingan,"Attongeng tongengeng ladde, de gaga atakabborokeng."
425,bugis,Duh indosat mengecewakan. Aku mau daftar baru kok malah kena tarif per kb? Pulsa berkurang drastis,aih indosat e je' mappa ja nyawa. nappaka melo mendaftara' na pakenna na' tarif per kb? nattap kurang ladde' bawang pulsaku
775,bugis,Aku memesan jaket gunung eiger,Iya' massuroangnga' jake' bulu eiger
431,bugis,"Pelayanan sih memang cepat tapi masakannya asal asalan saja, asal jadi asal matang saja, pesan udang saos tiram, sama saja dengan masakan kepiting saos padang, tang untuk kepiting tidak diberikan jika tidak diminta.","Appatalakenna maka sa sija' tapi nasu-nasunna assala jaji mi bawang, assala jaji assala manasu bawang, massuroang urang saos tiram, pada siseng sibawa nasu bukkang saos padang, tang laipakewe okko bukkang e de nawerengngi narekko de ta millau. "
576,bugis,"Restoran dengan konsep tempat makan yang sangat asri, apalagi kalau malam suasananya sangat indah dengan lampu lampunya, makanannya pun enak rasanya. Cocok untuk tempat kumpul keluarga.","Restorang pakewe konse' anroang manre makae paccing, lebbipi narekko wenni i appeneddingenna maka bello nasaba' lampu lampu na, anre-anre na aga maka lunra' rasana. Sikenangeng laiyonri sikkumpulu' sibawa sumpuloloe."
759,bugis,Pertama coba karena ulasan beberapa orang tapi ternyata rasanya biasa saja. Sepiring 30 ribu. Sulit cari tempat duduk.,bunge' ucobana nasaba pau-paunna tauwe tapi biasami pale rasana. sipenne 30 sebbu. masussa runtu onroang tudang
359,bugis,"Tadi katanya suruh tunggu saja sampai sms diterima, sudah seharian tidak ada juga!","Nangnge' makkadai attajenni lettu sms e tama, siessoni na deggaga mopi!"
473,bugis,Saatnya membuat karya visual 360 derajat dengan samsung! Ikuti langkah mudah di video ini.,Wettunna ni makkibbua karya visual 360 deraja' sibawa samsung! Acciori bawang ni passuruang magampang e okko iyyewe vidio e.
242,bugis,"Katanya detil aroma chamomile, tapi kok baunya tidak enak begini sih","makkada tau we detil aroma chamomile, tapi manengka meja baunna makke he"
