id,lang,source,target
54,bugis,"Saya datang ke maxi s resto bersama keluarga, ternyata di sana ada pesta pernikahan pesta ulang tahun sehingga tempat jadi penuh sekali. Pelayanannya jadi tidak baik. Seharusnya kalau tempat memang penuh, pihak resto memberitahukan kepada tamu sebelum tamu memarkirkan kendaraan saat itu hujan deras, jadi jarak tempat parkir ke resto lumayan jauh. Kalau perlu ditutup sementara selama pesta berlangsung.","Jokka ka lao maxi s resto sibawa sumpuloloe, na iyaro wettue makkasamang i pale engka to botting sibawa acara ulang tahung na iyaro passabari penno anroangnge. Pangadarenna mancaji maka ja. Sitongenna iya ko anroangnge penno iyaro pajjamana restorang e napalettukeng memenni okko taue ri wettu melona mopa tau parkir i kendaraanna, bosi loppo to pasi, na maka bela iyaro restorangnge sibawa anroang mapparkir e. Ya ko perellui tutu' bawanni pale ko engka mopa acara."
660,bugis,Telkom hackathon merupakan sebuah program besutan telkom indonesia yang bertujuan untuk mewadahi para generasi muda yang memiliki keahlian di bidang teknologi informasi maupun pemrograman untuk mengembangkan perusahaan rintisan yang mereka miliki.,telkom hackathon iyaro program pole telkom indonesia tujuanna taroi ana' muda punna e addisengeng okko bidang teknologi informasi are'ga pemrograman nancaji napaloangngi perusahaang nakkabbua e
704,bugis,Minumannya saya tidak ada yang suka. Ayam gorengnya biasa saja. Ada saus keju tapi saya tidak suka saus keju di sini. Tidak enak.,Inung-inungeng e iya degga mana upoji. Manu' wette na mabiasami. Engka saus keju tapi iya' de upojiwi saus keju okko e we. De' na malunra'.
805,bugis,"Resto keluarga yang sangat direkomendasikan, pemandangan sekeliling resto yang sangat bagus, pondok-pondok yang nyaman, makanan yang disajikan juga lumayan enak, apalagi jika malam hari ini pemandangan resto sangat bagus","Resto sikennae sumpuloloe maka yajjulluang, pattiroanna aggoliling na resto iye makae kanja', bola-bola makae nyameng, anre-anre iye napassadia e malunra sa, lebbipa yako wenniwi pattirona resto e maka kanja'."
444,bugis,Saya mampir ke restoran ini untuk makan malam karena kebetulan lewat dalam perjalanan menuju hotel saya menginap dan karena sudah kelaperan dan saya dan teman akhirnya memilih untuk mampir di restoran ini. Rasa makanannya biasa saja bahkan kami diharuskan membayar terlebih dahulu meskipun kami belum selesai makan hanya karena jam sudah mendekati waktu tutup.,leppangnga okko e restorang e manre wenni nasaba takkalaku liwengngi lao hotele onroakku mabbeni na maliwasenna sibawa sibakku jadi lai pile ni leppang okko e. biasa ladde'mi rasana nappa na suru memenni majai namo depa na cappu anreta nasaba meloni gere wettu'na lae tutu' warung e
699,bugis,"Kesan pertama menginap di sini, check in tidak bisa jam 2 siang karena yang menginap sebelumnya terlambat check out, tidak ada apa pun yang ditawarkan pihak staf saat kami harus selama satu jam menunggu kamar dibersihkan. Kemudian kami juga diberitahukan bahwa restoran tutup jam 5 sore sehingga jika ingin memesan makanan untuk makan malam harus sebelum jam 5 sore. Cukup menyebalkan.","Appeneddingekku bunge' ku mabenniku okkoe, check in de' na wedding tette 2 esso nasaba purae mabbenni lalo e terlamba'i lao check out, de'gaga najjulluangngi' pajjamana wettutta mattajeng siddi jang tajengi lae paccingi kamarae. nappa napodangngi aga makkada tattutu' ni restorang e tette 5 areweng jaji ko meloki massuroang pakkanreang lae pake manre wenni yolona tette' 5 areweng lae yassuroang memenni. Mappakereng-kereng sa."
227,bugis,"Menikmati kota bandung tanpa kuliner, kurang seru, kafe halaman, menyajikan makanan indonesia, gado gadonya enak, pisang goreng kejunya juga enak serta secangkir kopi sambil menunggu teman datang sangatlah menarik","lae rasa-rasai bandung tapi de' lai coba manre. de' na manyameng, kafe halaman, nappasediangngi anre-anre indonesia e, malunra' gado-gadona, sanggara loka pake kejunna makanja to na kopina sibangngi tajeng sibatta maka kanja'"
612,bugis,"Setuju makin naik fase wajar kalau tiket naik. Tapi, harga dasar di saat fase penyisihan sudah kemahalan. Coba bandingkan harga menonton di malaysia, thailand.","situju pene' menre' pole biasanna ko menre' tike' e. tapi, elli tongenna wettu penyisihang masoli memenni. cobani laipasicoco' ellinna menontong okko malaysia, thailand"
6,bugis,"Saya dan isteri tergoda untuk mengunjungi restoran ini saat kami sekeluarga berkunjung ke pontianak minggu lalu, karena berdasarkan penilaian trip advisor abang kepiting merupakan restoran terpopuler di pontianak. Malam sekitar jam 7 saya dan isteri sudah sampai dan mendapati suasana restoran yang tidak terlalu ramai terisi sekitar 4 meja saja, karena kami hanya berdua ingin berbincang.","Iya sibawa beneku macinna ladde jokka lao okko restorang e wettunna jokka ka massumpulolo ri pontianak minggu labe' e, nasaba makkadai trip advisor e iyana abang kepiting restorang kaminang napoji taue okko pontianak. Tette' 7 wenni na ulettu na uduppai iye restorang e de pa namaroa ladde nappai 4 mejang tallise', nasaba iya sippaddua maeloma maccarita rita."
562,bugis,"Saya tiba di rumah makan ini pada saat menjelang jam makan siang. Awal saya tiba rumah makan ini hanya ada beberapa pengunjung yang sedang bersantap. Namun, ketika tiba jam makan siang rumah makan ini penuh dengan para warga kota makassar. Banyaknya warga kota makassar yang tiba untuk makan siang menggambarkan bahwa tempat ini merupakan rumah makan favorit di kota makassar.",Iya' lettu' okko bola anre e we riwettu maloni tette' manre tengesso. Bunge' lettu' ku okko bola anre e we engkami siga pangelli mattangang manre. Naekkiya wettunna tamani tette' manre tengesso bola anre e we penno napennoi tau pole kota makassar. Maeganna tau kota makkasar iya takkappoe manre tengesso napitangngi makkasa iyae anroangnge mancaji bola anre kaminang napoji e taue okko kota makassar.
378,bugis,Tiket waterboom PIK jakarta dikabarkan naik,Tike' waterboom PIK jakarta naseng tau e menre'
381,bugis,Lokasi agak jauh dari kota bandung dan sekarang ada 2 gerbang pembayaran untuk bisa ke the peak dengan total 5000 rupiah. Ini seperti pemaksaan untuk pungutan liar karena anda tidak akan bisa ke the peak tanpa melewati kedua gerbang ini.,Anroanna mabela cedde' pole kota bandung sibawa makkokkoe engka 2 gerbang pakkamaja iya nullewe lao the peak iyae totala' na 5000 roppiah. Iye pada ko laipassa ki okko appulungeng maliara e nasaba' didi' de tulleo lao okko yhe peak narekko de lai laloi dua e gerbang e we.
211,bugis,"Data lengkap, jangan percaya kpk ini bohong. Kasus ini di audit 10 tahun lalu dan sudah lengkap. Karena habis itu ada audit aliran dana dengan tujuan khusus. Kalau mau kan minta audit lagi. Sudahlah. Kasus century itu skandal melindungi elit tertentu.","Datana lengka', aja' mateppe' okko KPK ma' bellei iye we. Kasus e iye lae parissa 10 taung labe'e na lengka' ni. nasaba purana ero engka papparessa appalaona dui e pake akkalaongan khususu'. Ko melo millau ki' apparessang paimeng. Pajaini. kasus century e iyaro paggaukeng nasampoi mi tau sogi mattentue."
418,bugis,"Sangat dianjurkan, masakan enak banget benar-benar! Kita duduk di tempat saung yang di bagian atas pas jam-jam matahari terbenam, makan malam ditemani sunset deh! Dan itu baguus banget.","coba laloi, malunra' ladde pakkanreanna! tudangki okko ladda'ladda' e okko yase' wettunna turunni esso e, manre wenni mita turung esso. maka canti'"
438,bugis,"Rcti terlalu banyak iklan tidak jelas, sangat menggangu","Rcti mega ladde' iklan de' lai pahang i, ma'ganggu ladde'"
78,bugis,"Baik, selain wisata wahana saya juga suka wisata kuliner. Sejak saya di bandung kuliner yang paling saya buru adalah siomay dan batagor. Mungkin kalau batagor saya sudah akrab dengan batagor kingsley yang rasanya melegenda. Untuk urusan siomay, rasanya tidak salah kalau traveler memanjakan perutnya di saung siomay ini. Seperti judulnya. Teksturnya lembut, bumbunya juga pas kena banget.","Makanja, saliwenna sisata wahana iya aga upoji wisata anre-anre e. Sipungekku okko bandung anre-anre iya kaminang lausappa e iyanaritu siomay sibawa batagor. Nulle ko batagor mareppe ladde' ka' sibawa batagfor kingsley iyaro rasana malunra' e. Ko tosi siomay, rasana de nasala ko pajjokkae naliseri wettanna okko iyawe saung siomay e. Pada siseng asenna. Tadangenna malengngi, paggamina to aga sikkenna ladde'."
830,bugis,"Penyajian cukup cepat, pelayanan baik dan pastinya masakan enak. Untuk harga relatif sesuai dengan rasa masakannya.","Pattalakenna masija' sa, pangadarenna makanja' sibawa mattentuni nasu-nasunna malunra'. Narekko ellinna sikennasa sibawa rasana nasu-nasu e."
854,bugis,"Mau marah sama indosat, sudah dua hari sinyal begini banget","Melo ka' macai okko indosat, dua essoni labe' sinyal e turi makkoe."
150,bugis,"Sudah indosat bangkrut saja, di tmpt ku saja sinyal tb2 kdg hilang muncul hilang muncul, padahal daerah kota semarang","Pakkoaniro indosat  bangkerro' bawanno, ri anroangku iyaro sinyal e maderri tappa teddeng' mubba' teddeng, na okko apo daerah kota semarang"
437,bugis,Transaksi beli pulsa PLN pra bayar melalui mandiri mobile menjadi tidak efisien karena harus telepon 14000 untuk dapat tidak tokennya / tidak otomatis.,melli pulsa PLN pake mandiri mobile mappareppa-reppa nasaba lai telepongipi 14000 millau tokenna / de'na langsung
334,bugis,"Tidak mesti di ruang tertutup buat pertemuan, pertemuan di resto ini juga asik. Jangan lupa memesan nasi goreng dendeng sama teh tarik.","De na mattentu makkada okko anroang tattutu' e yako meloki tudang sipulung, tudang sipulung ri iyae resto e makessing mato. Aja tallupai massuroang wette nanre dendeng sibawa teng tarik."
867,bugis,Samsung galaxy s sudah diluncurkan semalam. Saya kecewa desainnya standar banget. Harapan saya cuma terwujud 70%. Percuma terbawa sampai mimpi.,Samsung galaxy s laipassuni nangnge' wenni e. Iya masara nyawa okko modele' na mabiasa mi. Eloku engkami sikenna 70 %. Tama bawammi nippi e.
665,bugis,Sayang restorannya kotor. Lihat kecoa kecil di dekat piring-piring sayur bersih yang dipakai untuk menyajikan makanan. Dan ada kecoa kecil juga di tempat duduknya. Berharap kebersihan tempat diperbaiki.,macarepa restoranna kesi'. mita bulepe' biccu' sideppena penne-penne kaju mapaccing melo e lae pake mappatale' pakkanreang. nappa enga bulepe' biccu' aga okko onroang tudangna. marampeka na pakanjaki paccinna onroanna
689,bugis,Iya harganya 120 ribu. Saya juga sudah cek tokopedia.,iyye ellinna 120 sebbu. purana cek i tokopedia
213,bugis,"Senang rasanya dapat mengakhiri perjalanan kita di bandung dengan kunjungan terakhir kita berhenti di the valley pada tanggal 2 november. Hari itu adalah acara dalam menrayakan hari perpisahan bersama teman kita yang baru akan pindah ke kantor baru. Menunya sangat bervariatif tetapi ribs langsung menjadi pilihan saya. Menurut saya, harganya sebanding dengan rasa makanan. Top.","masennang sedding nyawa e pappurai jokkata okko bandung na ipajai okko the valley tanggala 2 november e. ero esso e mangacara appasaranna sibatta melo elette kantoro baru. mega rupa-rupanna pakkanreanna tapi tappa ribs willau iyya'. ko iya', ellinna sibawa rasana si kenangeng i. makanja'"
139,bugis,"Kapal km fungka permata v terbakar, sedikitnya 13 tewas","Kappala km fungka permata v tattunu, bara cedde'na 13 mate"
84,bugis,"Somasi yang dilayangkan rohayani, seorang pecandu rokok, kepada pt gudang garam, tbk dan pt djarum belakangan memunculkan isu lain.","Agaga iyae nallaporokeng rohani, siddie tau pappelo' tedde', lao okko pt gudang garam, tbk sibawa pt djarum maddiimonri mappamubba curita laeng."
702,bugis,Pakai kartu kredit bca tidak untung malah rugi besar,"Pake kartu kredi' bca deggaga saro na, pole mi arogiang loppo e"
424,bugis,"Restoran ini bukan sekadar tempat makan biasa, tapi juga bisa dijadikan tempat wisata. Lokasinya sangat dingin, tempatnya juga bagus, nyaman, dengan pemandangan yang eye catching. Menu yang disediakan juga beragam dengan rasa yang enak. Tidak perlu menunggu lama dalam penyajian makanannya. Harga juga relatif terjangkau. Untuk tempat berfoto juga bagus.","iyye restorange tenni onroang manre biasa, tapi wedding to lae pake onroang jokka-jokka. maka cekke lokasinna. makanja' topa onroanna, manyameng, makanja' tona lai ita mata. pakkanreanna mega to rupa-rupanna na malunra'. detto to mattajeng metta lai yereanni anreta. masempo meto ellinna. makanja aga lai pake mappoto-poto "
498,bugis,"Lokasi mudah dijangkau, penataan restoran average, menu makanan lumayan variatif dan rasa masakannya enak, harga terjangkau","magampang lae lettuki onroanna, biasami modelena restoranna, mega meto rupanna pakkanreanna na malunra' rasana, masempo topa"
777,bugis,"Ya serba salah memang, macet mengeluh, tidak macet heran.","ya tori sala memeng, macet mannomeng-nomeng, de' si na mace' maseleng si"
948,bugis,"Rumah makan ini terletak di jalan abdurahman saleh, tempatnya nyaman dan bersih, menu masakannya banyak pilihannya. Rasanya cukup enak dan harganya juga sepadan dengan rasa masakannya.","Iye rumah makan e mattujui okko jalan abdurahman saleh, anroanna manyameng sibawa mapaccing, menu anre-anre na maega rupanna. Rasana maka lunra' sibawa ellinna sikenangeng mo sibawa rasana anre-anre na."
808,bugis,Kadang mikir gimana ya rasanya jadi perempuan di gym. Banyak mas mas dan om om melihat. Pasti risih dan tidak nyaman.,Maderri ka mappikkiri pekkogi rasanna mancaji makkunrai okko anroang gym e. Maega burane sibawa om om mitaki. Manessani tamasiri na degga to nyameng.
846,bugis,"Kami datang makan ke restoran itu, mengajak keluarga kakak saya. Mereka semua sangat menyukai kualitas masakan di sini. Kami pesan udang goreng telor asin dan rasanya sangat enak dan melebihi kualitas resto di hotel bintang lima. Sangat direkomendasikan.","Engka manengngi' lao okko iyaro restorang e, laiyolli i sumpulolona daeng ku. Alena maneng napojiwi akanjakenna anrewe okkoe. Massuroang manengng' urang wette tello kannasa na rasana malunra' ladde' sibawa nacauri wi akanjakenna resto okkoe hotele' bintang lima. Laiyajjulluang ladde'."
363,bugis,Pelayanan solaria sungguh tidak memuaskan hampir di seluruh cabang yang ada di Jakarta. Tidak rekomendasi banget.,Pangaderanna solaria de tongeng na makessing melo iya maneng cabangna okko Jakarta. De na wedding laiyajjulluang ladde'
544,bugis,Temanku melamar pekerjaan di tokopedia,Sibawakku massappa jamang okko tokopedia
153,bugis,Bukan cuma bisnis keluarga. Tetapi menjaga kepentingan negara dan masyarakat tanpa membenturkannya dengan kepentingan global.,Tennia bawang bisnis sumpulolo. Iya topa ro nasaba laipiarai elona negara e sibawa masyaraka' e na de' to i pasiamba' i sibawa elorenna linoe.
752,bugis,"Terletak di daerah perbukitan sehingga udara dan pemandangannya sangat nyaman, di samping itu terdapat berbagai pilihan menu makanan nusantara, steak maupun pasta juga ada.","okko bulu e onroangna nampai udarana sibawa pakkitana maka kessing, dappa maega rupanna pakkanreang nusantara, steak yare'ga pasta engka meto"
662,bugis,"Baik, terima kasih atas jawaban yang begitu lengkap dan jelas ya","iye, tarima kasi' jawabanta makae lengka' na makessing"
255,bugis,"Ayam gorengnya enak, terong gorengnya juga. Sayang mau coba jengkol gorengnya sudah habis. Oh ya jus kefonfongnya juga segar.",malunra' wette manu'na. wette bo'dong na aga. melo apoka kesi' coba wette jengkolna tap cappu i. oh engka pale jus kadondong maka to kanja'
780,bugis,"Senin pagi memang selalu tidak bersahabat, mulai dari pakai jilbab berantakan, jalanan macet, transjakarta arah senayan ramainya astaghfirullah, absen telat lewat jam 8, ga ikut doa pagi.","Esso sining ele tori de' mena sedding tas sianggota, mammula mappake jilba'e maroca', lalengnge sillaca', transjakarta mattuju senayan roana astagfirullah, absen matengnge' liwe' tette' 8, de'na to maccio mabbacang doang ele."
896,bugis,"Cemburu itu rasanya tidak enak. Cemburu itu makan hati. Cemburu itu sakit, kalau tidak diungkapkan","Mangimpuru iyaro rasana de namakanja'. Mangimpuru manre mi ati. Mangimpuru mapeddi mi, yako de i palettu' i."
90,bugis,"Keunggulan holycow dibanding resto steak lain adalah wagyunya yang mantap. Favorit saya adalah wagyu sirloin steak yang dinikmati dengan mushroom sauce. Rasanya mantap. Dagingnya tebal dan dinikmati dengan butiran jagung rebus, sayur bayam dan masih potatto. Enak dan mantap.","Akanjakenna holycow yarekko i pasibetai sibawa resto steak laingnge iyanaritu wagyuna maka kanja'. Iya kaminang upojie iyana ritu wagyu sirloin steak ipasianta'e mushroom sauce. Rasana mappasianta'. Jukuna mompe' na ipasianta' sibawa rang barelle, Kaju sumpunna sibawa ronnyo' lame-lamena. Malunra' na mappasianta'."
999,bugis,"Hai ditha, kami informasikan bahwa pembayaran kamu telah masuk ke akun rekening kami namun pemesanan tidak berhasil.","Hai ditha, meloki' podangngi makkada pakkamajata' tama ni okko akun rekening e tapi passuroangetta' depa nattuju."
127,bugis,"Cuma kalau besok mau mencari, dia ada di rak yang dekat cream krim wardah bersebrangan sama rak lotion citra, sister.","Iyami narekko baja maelo massappa, engkai okko ra' e sideppena cream krim wardah sibali anroang sibawa ra' lotion citra, padakkunrai."
340,bugis,"Resto dengan konsep saung2 yang terletak di dalam komplek perumahan. Makanan yang disajikan beragam mulai dari sundanese, makanan barat, dll. udara cukup dingin di malam hari atau ketika hujan jadi disarankan membawa jaket. Jalan antar saung menggunakan batu-batu sehingga kadang-kadang licin ketika hujan","Resto iye pakewe konse' bola-bola iye engkae okko ilaleng koplek abbolang e. Anre-anre napassadia e maddupa dupang mappammula pole sundanese, anre-anre bara', dll. Anging e makamo cekke' ri wettu wenni wi yaregga narekko bosiwi jaji laipatujuki makkada bawaki' jake'. Laleng pattengngana bola bolae pakei batu-batu jaji maderri malengngo yako bosiwi."
207,bugis,"Tempatnya nyaman banget, makanannya enak, kopinya enak. Pas buat nongkrong bareng teman-teman atau makan malam.","onroanna maka nyameng, malunra' topa pakkanreanna, kopina aga manyameng. sicoco' tudang-tudang sibawa sibawatta are'ga anre wenni"
258,bugis,"Kalau kuota saya besok tidak balik, saya mau marah-marah ke indosat","ko de'na lisu kuotaku baja, meloka macai lao indosat"
701,bugis,"Tempatnya nyaman, makanan lumayan enak. Buat yang mau ngobrol lama-lama cocok sekali ada banyak tempat lesehan nyaman banget plus udara yang sejuk.","manyameng onroanna, malunra meto pakkanreanna. ko meloki maccarita metta coco' ladde' mega onroang lego-lego manyameng nappa makanja topa anginna"
727,bugis,Rasa makanan cukup enak. Lokasi cukup strategis dekat eskalator turun dan naik mal. Secara keseluruhan baik mantap.,Rasana anre-anre we okkoe malunra' sa. Anroanna makessing na macawe' pole eskalator nonno sibawa menre' mal e. Makanja' maneng sa na mappakkoe.
496,bugis,"Hai, ya, silakan kamu dapat mencoba lakukan pembayaran pdam di bukalapak.","hai, ya, cobani makkamaja pdam okko bukalapak"
197,bugis,"Enkaolshop, terpercaya, barangnya bagus bagus","Enkaolshop, mappateppe', aga aganna makessing."
301,bugis,"Aslinya ini basa berada di jalan karapitan setahu saya, sekarang memenag sudah tersebar di beberapa tempat di bandung. Makanannya juga tidak hanya bakso, tetapi ada beberapa makanan tambahan yang lain. Untuk rasa juga tidak terlalu spesial. Untuk harga dengan ukuran harga bakso di bandung cukup mahal. Ditambah pelayannannya yang kurang bagus di ciwalk.","Aslinna iye basa engkai okko laleng karapitan siperingerrang ku, makkokkoe memenang purani tallappo ri siaga eganna anroang okko bandung. Anre-anre na aga tennia bawang basso, tapi engka siaga anre-anre tambahang laeng. Yako rasa detto aga namaka spesial. Narekko ellinna yako tamabbicara elli basso okko bandung masoli sa. Laitambai pangadarenna iya makurang kanja' e okko ciwalk."
274,bugis,"Seharusnya masih berhak mendapatkan cahsback 5 j uta dengan cara berlangganan paket iplan 500k selama 24 bulan kak. Dan bisa juga cicilan 0% menggunakan cc bca, bni, mandiri, cimb niaga.","Sitongenna wedding mopa cebe'na runtu' sessung 5 juta ko mallangganang i pake' iplan 500k ettana 24 uleng daeng. Wedding to aga cicilang 0% pake cc bca, bni, mandiri, cimb niaga."
871,bugis,Tidak menyesal juga makan di solaria tempatnya bersih dan cocok buat keluarga juga. Makanan cepat keluar setelah dipesan.,De lau cau manre okko solaria anroanna mapaccing sibawa sikenna lao okko sumpu loloe aga. Anre-anre na masija' pole ko yassuroangngi.
507,bugis,Copot dari keanggotaan polisi saja. Daripada jadi perusak nama baik korp.,Passu bawanni pole anggota na polisi e. Polepadanna mancaji pakkasolang aseng kanja' na korp e.
845,bugis,Menyesal tadi ke toko itu. Malah beli hal-hal yang tidak akan terpakai. Cuma karena lapar mata jadi beli:,Massesse' kale ka nangnge lao okkoro toko e. Manengka melli ka aga-aga iya de na tappake. Nasaba' maliwaseng mi matae na yelliwi.
905,bugis,"Makan di pinggir jalan, makanannya tidak enak, pelayanan tidak bagus, harga mahal.","Manre ri wiring laleng e, anre-anrena de na malunra', appangadarenna de na makanja', ellinna masoli."
111,bugis,Untuk mengajukan kerjasama / sponsorship ibu elsa dpt menghubungi: Pt. Bank mandiri persero tbk corporate secretary,Yako tamelo mappangolo assiddiang jamang / sponsorship indo' elsa wedding i tapodang: Pt. Bank mandiri persero tbk corporate secretary
595,bugis,Produksi lagi dong indomi goreng sate. Dicari-cari sudah tidak ada. Rasanya enak beda dngan rasa sate merk lain,Takkibbua si pemeng indomi goreng sate. Lai sappa-sappa i na deggaga na. Rasana malunra' sisala sibawa rasa sate mere' laingnge
19,bugis,Pagi pagi ingin marah dengan sinyal telkomsel.,Maele mopa na meloni macai mitai sinyal telkomsel e.
670,bugis,"Antriannya lama, makanannya juga lama dan rasa makanannya biasa saja dan mahal","antrianna metta, pakkanreanna aga metta na rasa pakkanreanna biasami na masoli"
284,bugis,"Parah banget xl deh sekarang sepertinya, harus ganti provider lain cuma mahal doang kualitas jelek","ja ladde' pa xl makkokko e, wettunnami masselle kartu laing tapi masoli na meja meto kualitasna"
252,bugis,"Kereta mutiara timur malam, sby - bnywangi eksekutif tetapi kursi jorok dan kotor sekali. Tidak sesuai dengan harga yang sangat mahal, sangat mengecewakan","kereta mutiara timur malam, sby-banyuwangi makanja' tapi kaderana maronto' na macarepa ladde'. De'na sikenangeng  ellianna maka soli, mappaja nyawami"
117,bugis,"Saya memilih tempat makan di saung dengan pemandangan sawah memesan nasi timbel komplit, surabi oncom dan colenak pesanan datang tidak harus menunggu lama. Hanya saja saya kecewa dengan serabinya. Di luar ekspektasi saya. Tidak enak.","iya' mappitte anroang manre ri bola-bola mappattiro galung e massuroang nanre timbel lengka', surabeng oncom sibawa colenak iyae wassuroang detto napattajeng mettaki'. iyamiro masara ati ka' sibawa surabeng na. saliwenna pangelorekku. de' na malunra"
684,bugis,Payah sekali pelayanan pos indonesia saat ini,meja' ladde; pelayananna pos indonesia makkokkoe
554,bugis,"Ini indihome saya gangguan lagi ini. Saya lagi ada kerjaan tiba-tiba terputus, merah kedip-kedip, baru seminggu baik wifinya, sudah gangguan lagi. Indihome telkom sekarang banyak gangguan ya, bayar selalu mahal, mengecewakan sekali.","Iyae indihome ku tagganggu si paemeng. Iaya mattangang engka jamakku na tappa tappettu, macella' makkapede-pede, nappai siminggu makanja' wifi e, pole si taggangngu. Indiehome telkom makkokkoe maega taggangngu dih, makkamaja soli, mapppasara nyawa ladde'."
337,bugis,"Menurut saya bebek garang ini punya varian menu bebek yang cukup banyak. Saya suka perpaduan antara bebek dan sambalnya, rasanya pas. Untuk harga berkisar 20 - 30 ribu dan menurut saya cukup sepadan dengan rasa dari makanan di sini.","Yako iya' iti' garang e we mappunna wi dupa-dupang menu iya makae mo ega. Iya upojiwi appasijemmuna iti'e sibawa sambala' na, rasana sikanangeng. Yako ellinna macawe' i 20-30 sebbu sibawa yako iyya' sikennasa sibawa rasana iya anre-anre we okkoe."
837,bugis,"Cocok buat pertemuan, acara pernikahan, pemotretan. Suasananya tenang, santai, adem.","Sicoco' yonri tudang sipulung, acara botting, mappoto. Appeneddingenna matennang, masagena, macekke'."
967,bugis,Setiap kali ke sini saya ingin berlama-lama dan tidak mau pulang cepat. Pelayanan yang ramah dan tempat yang nyaman.,Tungke'-tungke' laoka' okkoe tuli meloka metta sibawa de umelo lisu masija'. Pangadarenna maka bessa sibawa anroanna manyameng.
577,bugis,Restoran ini menyajikan masakan bali yang sarat modifikasi sehingga terkesan disesuaikan dengan lidah konsumen yang nota bene bukan orang bali. Tiga photo yang saya lampirkan itu adalah makanan yang kami pesan.,Restorang e we mappassadia nasu-nasu bali iya maegae laipasellei modele' na mancajiwi laipasikenangeng sibawa lillana pangelli e iya manessae makkada tennia tau bali. Tellu poto iya laupaccioe iyanaritu anre-anre yassuroangnge.
578,bugis,"Kalau di banyak tempat steak membutuhkan waktu lama sebelum penyajiannya, di tempat ini menurut saya cenderung cepat dan sesuai dengan lidah maupun dengan dompet saya. Saya pernah menunggu teman sampai 2 jam di sini, tapi tidak berasa karena makanannya membuat saya lupa waktu. Hehe","Yako okko maegae anroang steak parellui wettu metta melona mappassadia, ri anroangng e we yako iya' pada ko masija' i sibawa sikenangeng sibawa lilla yaregga sibawa dompe' e. Iya' pura mattajeng sibawang lettu' 2 jang okkoe, tapi ne ipirasai nasaba' anre-anre na pancajika takkalupa lao okko wettue. Hehe"
692,bugis,Kalau mau beli obat pergi saja ke kimia farma yang berada di ujung jalan itu,ko meloki melli pabbura lao bawanni okko kimia farma okko cappa'na lalengnge
380,bugis,Pelajaran matematika anak sd sekarang sulit sulit,Agguruang matematika na ana' sd makkokkoe mawatang watang
