id,text,label
458,"Inganan parmanganan hambing natinutung na hurekomendasihon tingki ro ho tu kota on. Hambing natinutung na tabo, marmiak ditabba dao sian goarna uapni hambing na bau dohot labbok. Sup ihurna pe dang talu tabona, ingananna pe tabo hian, cocok tu nanaeng pasudahon tikki rap dohot keluarga manang dongan. ",positive
4,"Naeng binoto pandohan ni jolma, husus mangida tingki tu kode ni si Sale. Parjolo girgir. Mangalewati macet. Toho nai. Alai sogo roha di dalan i. Nga na dao, dalan na pe roa gabe mambahen mago hiras. Akka bangunan unik, adong musik lift. Godang di jolma di ruangan diolati do. Sipanganon na unik jala kreatif. Alai dang sae dope pamalumhon sogo ni roha alani pardalanan nai.",negative
985,Minggu nattuari di hutakku sanga adong jaringa 4G.,neutral
706,"Molo tu son ikkon nibahen ma butuha niba dang marisi alana molo dison boi marsipanganon salomoniroha. Tombus ma akka sipanganon na dison,  tudos muse tu argana. Ahu iddahan goreng ma na hu lomoi, sodap hian.",positive
460,Laho manukkun kredit mandiri finance dison pe boe do.,neutral
331,"Saonari rumah makan i marloteng 2. Seang hian uju lao au tusi ac na mate gabe mohop panghilalaan. Jala na mambahen sungkun-sungkun rohangku, danghea dilean strukna tu au
",negative
377,"Hami ro tu ruma makan on di bodari na. Wow, tung mansai uli jala denggan do ingananon boi pasonanghon roha. lilin, dalan na marnakkok, hundul dilage di tonga-tonga ni soara ni aek sampuran na tung mansai jonok mambahen lam tabo hian na mangan i.
",positive
652,"Inganan on patupahon akka sipanganon, alai na hu dai ikkon do batagor na, inganan na pe ias.",positive
513,Tabo. Jala toho sambal tysonna tabo! Mangan dohot manang aha pe boi/pas. Ikkon boi tu nasiak jala borat ni daging lam timbo molo mangan dison!,positive
530,"Ro ma hamu tu toko nami hamu akka namangalului hp Advan, Xiomi Redmi 4a dohot Nokia 150",neutral
917,Parsikkola zaman nuaeng on pagodanghu manarita alai hurang mambahen sipatupaon.,negative
586,"Menuna simpel, pastana godang ragam ni daina, inganan na sonang, siinumon pe godang sipilliton, adong muse sipanganon penutup. Tamba musek tingkini live musik gabe mambaen lam kece.",positive
783,dang niantusan pambayaron ni internet hu 250% ung arga kak! patorangjo.,negative
457,Manarita hian. Di pangido dohot nigarar tiket pesawat dibahen jam tonga sada manogot laho tu parhabangna di jam  6 . E-tiket dang dikirim. Toppu di hubungi sian email molo tikket na naung digarar nunga habis jam-jam manogot. Molo tiketna nunga habis boasa dope boi di booking.,negative
520,"Mansai melengleng ate-ate, pangalaho dang suman! Dang tutu boi jadi wakil rakyat 270 juta jolma sian sabang sahat tu merauke!",negative
17,"Molo sipanganonna marragam ale miakna pagodanghu, gurame goreng dang tabo ala dang koring digoreng. Jus na diparade magodanghu aekna jal hurang purnas.",negative
501,"Sai tongtong ma nian torus mandongani halak Indonesia sian Sabang sahat tu Merakue, sian kota sahat tu huta-huta.",neutral
27,Toyota na gabe merek ni motor na paling mararga.,neutral
45,Toema sarupa akka panakko ikkon do marsijagaan. Jei na dipersoalhon i ma soal prosedur jala dang substansi i ma anggota dewan natartangkup tangann manjalo sogokan.,negative
236,"Daina tarhilala, sabbal na pe tabo. Dohot muse diparade 3 massam punsa songoni. Muse godang muse sipilliton tahe sitohona naeng mangallang aha dison. Naeng gurame, naeng kakap, bawal, korang, cumi-cumi, udang. Marragam ma tahe. Ale unang pangido ikkan kembung sajo. Dangadong dison. ",positive
610,Saonari nga mansai sogo rohakku tu online shop nadibahen ni halak asing i.,negative
94,"Sian zaman kuliah sahat tu saonari tong dope lomo roha mangan di kuis butcer. Tabo, mura, inganan na pe tabo.",positive
372,"Ndang lomo rohanghu mangallang oreo, alana mambahen ngingi marbirong",negative
902,"Sipanganon nalomo rohangku ima sup jagal dohot siinumonna es cingcau hitam. Daina tabo, rekomendasi hian.",positive
152,ndang tarhatahon be hinauli ni Surabaya molo borngin angka siallangon pe tung mansai tabo nang pe argana sumalim jarak na ndang apala dao alai anggo hinaulina sumalim pasonanghon roha.,positive
790,"padao haponjotan, menhub mangajak masarakat asa dang mulak tu jakarta rampak-rampak di 1 januari.",neutral
32,Parmanganan naadong panatapan na uli nang pe ikkon didalani dohot dalan na pattik. Alai targar do dohot inganan dohot dai na oke.,positive
302,"Sasitongna steak especially chiken cordon bulena do na mambahen iba masihol tuson dohot ma muse panatapan ni bandung na tung mansai uli hian. Tarlumobi molo borngin ro tuson dohot na hinaholongan manang sisolhot pe tong do pasonanghon roha. Dalan laho tu ingananon nuaeng gok tekongan jala tung mansai loja si tutu.
",positive
357,"On ma sada inganan na sipanganonna tabo jala na uli idaon lambok di simalolong, molo inganan marpungu do dohot si solhot nang ale-ale tung mansai denggan situtu.",positive
736,"ah sogo roha, senin manogot nga maccet dohot banjir.",negative
953,Dangadong na pa istemwahu sian parmanganan na paradehon ragam ni sipanganon has sian sunda on. Daini piga-piga sipanganon na hu pangido sarupa do dohot daini parmanganan sunda na asing. Dang boi manubuhon dai na tabo na gogo jala mambahen adong siingoton na bagas. Holan manuk na digoreng sambal penyet nahupangido daina naeng-naeng tabo. ,negative
763,iklan youtube boasa dang boi di lewhon. manggugai hian.,negative
36,Panghobasion ni PT nami mansai tabo hian.,positive
24,"Parjolo hian ro tu Eatalia, ahu ro rap dohot dongan jala sahalak dakdanak. Dang guntur tingki maillit sipangonon laho tu dakdanak alana dison adong sipanganon tu tohap ni dakdanak. Hami manuhor pizza dohot roti na marwarna birong. Molo sian sude sipanganon nahutuhor dang mangarsahi.",positive
243,Monanghon sibasabasa na bagak holan mandohoti parlumbaan foto tu bawa di alfamart.,neutral
969,Molo tu Bukittinggi unang lupa maradi di  Pasar Atas. Godang sipilliton sipanganon na tabo. Unang lupa mamboan kamera laho margombar.,positive
362,on ma barita ni baritahon na mambahen taon baru gabe ulaon na biasa jala artifisial. Songon na so marlapatan.,negative
53,India saonari mambahen superbike listrik nagasak hian.,neutral
57,Nunga leleng ahu naeng lao mardalani tu luar negeri.,neutral
230,"Tenderloin steak di suis butcher mansai tabo - maraek, dohot saos kuisna toho hian di simangkudap. Asing ni i argana pe toho tu kattong. Alani i, pinarade ma laho mamette molo ho mangebati di ujungni minggu dohot di jam mangan muse.",positive
413,Donganhu pe godang do na karejo di bukalapak.,neutral
65,"Paling otik punten, ahu naeng manuhor tiket nami Senen-Yogyakarta pangke promo na bulan Mei.",neutral
903,Didokhon unang laho tusan tikki jam mangan alana agak maol do mangalului inganan hundul.,neutral
161,Tung so marmusmus do mamesan bukalapak pangke gosend sian nantoari sahat tunaeng on ndang marnasahat boha do on. Hape porlu hian barang i.,negative
899,Bilut na i bau sigaret. Sipre dang hea di ganti tu na baru ro dohot adong dope sirabun ni sigaretna.,negative
589,Si A pangkataionna tong kosong nyaring bunyina makkatai dang marlapatan.,negative
636,"Sambalna dang nahaluluan di inganan na asing. Dai ni terasi na mansai sudung, accim, tonggi na pe pas. Dibagasan na hera lapo do alai unang tarsonggot molo laho manggarar alana sarupa dohot restoran alai domasa dohot kualitas ni sipanganon na.",positive
710,"Pandapothu lumayan do hu lala steak nai, alai ung denggan molo tapangido na ung balga ma,  molo i mansai lambok sian na asing.  Molo tuson,  boi  mambaen gombar tu sosial media jala  dapot es gratis ma.  Es na tabo dah. Molo sipanganon mantap.  akka parhobas na pe burju.",positive
250,radotu sipanganon on dah gus na lagi musim na do songoni sonari. ido tahe ngolngol ido na gab e mambahen gabe sahit.,negative
719,"Lam leleng dison boi do iba hipertensi pasien ni bpjs,  gararanna dang sadia  alai nadipangido rohana ingkon na mantap hian ma parhobasanna jala marbete bete,  mar hureta ma molo olo na mantap hian.",negative
