id,text,label
252,"kareta mutiara timur borngin, sby - bnywangi esksekutif alai hundulanna kotor jala kotor hian. dang suman dohot arga na na arga hian, sial hian.",negative
117,"Hupillit ma inganan parmanganan di sopo-sopo na boi mamereng / mamandang tu saba i hupangido ma indahan timbel komplit, surabi oncom dohot colenak pintor ro do ndang sadia leleng iba paimahon. Alai dang tagam rohangku tung so mardae do serabi na i.Di ruar ni ha hupikkiri do bah. Dang tabo.",negative
684,Maol hian panghobasion ni pos Indonesia saonari on.,negative
554,"On Indihomehu adong muse segana. Au lagi karejo hape tompu putus. Marrara manghidop hidop, hape saminggu dope denggan nungnga adong musek nasega. Indihome telkom saonari godang segana, bayarna torus arga mambahen jut roha.",negative
337,"Molo ahu mandok bebek garang on tung mansai godang do ragam na, lomo rohakku parsadaan ni bebek dohot sambal nai, dai na i pe pas,argana antara 20-30 ribu jala pandapothu dos do tu dae ni sipanganon dison.
",positive
837,"Pas tu parpunguan, acara parbogason, pamotreton. Suasanana tenang, santai, adem.",positive
967,Ganup ro tuson naeng hupaleleng-leleng jala dang naeng hatop mulak. Panghobasionna na lambok dohot inganan na menak.,positive
577,Restoran on patupahon loppaan ni bali na dimodifikasi gabe songon na dipacokcok ma tu dila ni panuhor na so halak bali. Tolu poto na hulampirhon i ma sipanganon na hupesan hami.,neutral
578,"Molo di akka inganan ni steak ikkon leleng asa dipatupa, di inganan on pandapothu songon na hatop jala pas tu dila dohot dompethu. Au hea do paimahon dongan sahat tu 2 jom dison, alai dang pola terasa alani sipanganonna mambahen dang huingot tingki. Hehe",positive
692,Molo naeng manuhor ubat lao ma tu kimia farma na adong di ujung ni dalan i.,neutral
380,Parsiajaran matematika dakdanak SD nuaeng tung mansai maol situtu.,negative
755,restoran on torus gok ala ingananna na suman ura dapot di pintu masuk ni mal. daini bubur lumayan tabo. sian manuhor sahat tu laho paradehon lumayan hatop.,positive
788,alana au lagi galau kak makana sian i hubahen story songoni.,negative
616,"Tu angka na lagitu Cirebon jala mangalului inganan na tabo parkiran na jala sipanganon na ikkon hatop, tumagon ma ro tu son alana parkiran na bidang jala suasana na sonang.",positive
396,"mm holsoan do roha molo ro tuson alana sai ingkon do paimahon: Mie na pe nasiakan.hehe bangku na i ditambai manian antong asa unang paimahon.
",negative
259,"men]mang hasintongan na hami mampuna godang tano dison, naeng boha ho? alani i karejo asa boi godang hepeng songon hami-hami, unang holan boi mangaleai.",negative
850,Parmanganan the valley on panatapanna tu kota na nomor 1. Menikmati suasana di tikki borngin dohot lappu harlap-horlip tung mansai uli.,positive
289,"Molo tu semarang ikkon mangallang mie aor on, pandokhu on nauttabo. Nang pe ingananna di topini ruko, dohot laho mangan  ikkon margogo laho mandapot karosi, alai suman hian molo di tudoshon tu daina. Hulinghuling na godang, huana holpu hian dohot mi na mamak dohot laslas. Argana pe tardungdung. Tes dumenggan mi aor di semarang.",positive
0,Panakko nasasintongna nungnga dipatangkas margoar Lulung,negative
647,"Alai memang hera na so diturpukhon do au mandai indomi goreng, hape holan dirondam do mi na. Boi ma gabe madamor hu.",negative
643,Nike pakaluarhon produk sepatu na imbaru na.,neutral
532,"Ditingki au laho tu restoran i, parhobas nai ro mandapothon au jala disukkun laho tu piga halak",neutral
217,roti bakkar duti on nungga adong sian najolo dison. roti biasa do nian. holan angka menu sipilliton godang hian. aha pe adong. sipata gabe bingung aning mamillit na aha isina. adongg manggadis bubur muse. oke muse mai.,positive
901,"Kuota gabe habis tarkuras laho mamereng foto-foto na holan mambahen ahu iri, sipanganon na tabo-tabo mambahen ro ijur.",negative
596,"Mansai lomo do rohangku mangan di restoran on, loppaanna marragam,, daina pe tabo, argana dang pola arga.",positive
952,Hurang pas molo mardalani tu Bandung molo dang di dai batagor. Batagor burangrang ima sada na daina tabo jala sausna pe gurih.,positive
112,"Tung mansai gok do namangan jala rade paimahon, Hape lompa-lompana songon na di jabu I do daena, daena pe somal hian.  Dungi argana pe ndang dos tu daena.",negative
912,"Ahu boi mandokhon on ma parmanganan na pas tu keluarga. Huhut parnijabu manuhor akka ole-ole, ahu boi mangallang mangan arian di parmanganan on. Ianakhonku pe boi marmeam di inganan parmeaman jala tiket na  mura ",positive
635,"Inganan na i rame hian, sipanganon marragam. Desain dohot humaliang na sonang. Alogo lambok, godang inganan parmeaman ni dakdanak.",positive
386,"Denggan kak, molo sabar do paimahon masalah ni provider telkomsel na ingkon do alusan ni dongan nami.",neutral
38,Asi roha personil ungu saonari lungun karejo na ala ditadinghon si Pasha.,negative
471,"Molo adong pulsa sagudang, laho pangoluhon wifi tu sude jolma asa boe internetan.",positive
176,menkeu mandok hinagale ni rupiah lumobi alani defisit transaksi namasa.,neutral
392,"Manogot dope di tol cipali nunga massethian, pajuthon roha do antong on",negative
934,"Taringot tu namangganti rekening tu panggararon autodebet BPJS, Amang Luqman boe ro tu kantor cabang Bank Mandiri mangidohon autodebet i da. Asa boe di ulahon tutup rekening jo jumolo.",neutral
785,mobil na biasana dipangke jeje ima merek toyota na marwarna krem.,neutral
245,"Suasana hauma dohot dolok-dolok, adong wine cellarna. Alai siallangonna arga, ikkon boe lobi ubbagak alana godang parmanganon nasarupa di bandung nuaeng nungga godang hian.",negative
469,Na sialan molo adong jolma mangahatahatai di dalan huhut markareta apala di dalan na soppit. ,negative
679,"Panghobasionna hurang hatop jala dang diboto martutur jala hurang boi patoranghon ragam ni sipanganon na adong, alani i akka tondong songon na dipasombu dihilala jala dipasip.",negative
597,"Restoran mansai uli, panatapanna menjoloi tu kota Bandar Lampung, gabe mansai bagak tingki si borngin. Suasana na pe sonang, dekorasi ni ruanganna mansai bagak. Mansai lomo rohakku tu inganan on.",positive
650,Na mangalamar calon cpns boi mandaftar holan di 1 instansi jala di 1 formasi jabatan,neutral
58,"Sipanganon lumayan, ahu manuhor spring roll agak marmiyak, argani hidangan utama na lumayan arga. Bangunan unik alai inganan i dang pola bagak gabe hera na lungun torus inganan i. Tingki manuhor ikkon ma jelas didokhon, alana namasa tu hami, hami tuhor 2 alai mandapot 3 item. Parhobas na lambok hian, alai pangalaho ni kasir na songon na asing. Olo ra dang ro be au.",negative
191,"dengke gurame na tinutung dohot sayur kangkung na dipatupa di red s dipo na hutuhor di tingki mangan arian / tonga ari di bulan November 2012, tung tabo daena, holan ido sabe na di sambal nai dohot sayurna songon: ancimun, tomat, dohot kangkung nang joruk na dies joruk nai hurang segar.",positive
246,Karya bakti bca finance jabbarni ralationship officer mabbuka parkarejoan laho di bahen tu pekanbaru.,neutral
470,Mangallang bakso huhut manghatahatai dohot akka dongan. Inganan na tabo laho mangan. Arga na pe dang pola paargahu.,positive
450,"Ditonga ni proses hukum, warga Taman Sari Bandung mangadopi tekanan ni panggusuron.",negative
930,Sadarion naeng belanja di tokko i asa boe dapotan paralatan mangalompa na jago dohot dapotan kesempatan mardalani tu Belanda.,positive
420,"Unang pola 1 jam, ngplay stories na holan piga-piga detik pe loadingna leleng hian, indosat na sumalim.",negative
416,"Dang bosan jala longang. Asal ro tu Congo kafe. Ingananna sonang, tabo. Coba ma ro si borngin. Lamu romantis. Molo mamboan hallet.",positive
863,Argana mansai terjangkau jala sipanganon sipilliton songon  si nuaeng. Parmanganan na pe dipatupa dohot denggan jala unik.,positive
946,Ingananna hurang ias. Naeng laho tusan agak maol alana songon na jot-jot maccet. Alani i marpikkir dua hali molo naeng ro muse.,negative
136,"Tim hu naeng rap mangan borngin di burgundy, asa unang lilu sadari andorang so ulaon i parjolo ma au dohot sekretarishu lao tusi, laos mandae sipanganon na disi, tung mansai daoodo pardalanan laho tusi pola do manangkohi dolok dohot mamolus rura, naunsogo muse pas ari minggu hami na laoi gabe hona mansset. uli do nian inganan i huida dung sahat au tusi, alai anggo layout ni ruma makan na biasa sajo do.",negative
63,"Ahu mamangke bb tipe 9210, ahu mandapot barita sian nattuari, hona biaya gprs/",neutral
85,"Hpku lenovo, madabu tu buttak tingki 2 minggu baru dituhor, madabu di dalan tingki mambalap mamboan kareta sampe isina tudia-dia, telepon gengamhu bertahan dope, mantap do memang lenovo.",positive
824,Batagorna balga-balga dohot jagalna tardai hian. Mantap ma. Dai ni parmasakna pe tabo. Pas molo naeng bahenon sipaanganon alang-allangon di tikki botari. ,positive
323,Tung mansai loja situtu do borngin on,negative
260,au nungga hu kirim email complaint alani telepon dang gira masuk,neutral
7,Tohapna godang gurappang na hira-hira 100 ribu/tohap. Udang tutung na tabo. Tabo bumbu na gok parmasak. Argana dohot dai na maradu tu perahu seafood jalan Sumatera.,positive
225,Rizal ramli paboahon dalan manghothon arga ni boras.,neutral
75,Ahu nagabe warga Jakarta maila bang tu oknum naso marlang alus na olo sweeping bobotoh.,negative
812,Bali ima sada pulo na gabe tujuan mardalani ni akka turis.,neutral
476,"Pardalanan saonari on laho urusan mangalului inganan na naeng rekomendasihonon tu klien nami. Daona sian Bandung kota agak dao do memang, alai nang pe songoni boe do targarar i dibahen panatapan na tung mansai uli ditikki borngin sohot mangan borngin dohot sipanganonna dohot panghobasionna ok.",positive
724,"Inganan na saotik buni di suhi ni parjabuan.  Rangrangan ni ingananna bagak, songon jabu diparhutaan eropa dohot lante jala dinding hau.  Asing na dibagas, halak naro boi marsipanganon di karosi  porlak mamakke drum na bekas.",positive
880,Hami manggadis kabel hdmi premium 1 meter manuhor  2 pere 1 di sosar ni Rich Com Store.,neutral
526,Dang perduli. Paulak pulsaki. On goarna namanakko. Paket telpon muna pe namanakko. On dope au marungut-ungut.,negative
680,Godang do ragam ni bulung bulung,neutral
55,"Ahu rap dohot keluarga mancoba mangan di Karamba restoran ala nadirekomendasihon ni supir mobil sewa nami. Hami memang sahat di inganan i nga songon na borngin hira-hira pukul 21 alai nang pe parmanganan dang tutup dope manang lao tutup, alai piga-piga sipanganon nunga habis. Bahkan inong dohot amantaku manuhor indahan timbel  na sayur asemna nunga habis gabe diganti sup sayur sian parmanganan on . Dang godang sipilliton naboi hupillit hami. Hurang rekomendasi.",negative
234,"Maruba pangkat gabe Universitas, BSI mambahen seminar pangapoion.",neutral
133,"Ruma makan na songon najolo alai dae na tong sarupa tabona, jagal manuk dohot indahan krecek nai tabo hian, sipata sangaja do hubungkus lao boanon tu jabu",positive
765,"au jut rohang ku molo tiap ari lewat sian sadu torus. sompit, dua ara, maccet gabe ima idaon siganup ari",negative
546,Anggiku dijalo di teknik lingkungan ITB.,neutral
265,"Urupi hatop torushon pangaduanku, addorang jolma menggetes gopay na gabe gumodang.",neutral
798,menu na utama si andakhonon ni halakon ima manuk betutu na boi di pillit marragam daina mulai sian naso siak sahat tu na siak hian. asing ni i manuk pe adong bibi betutu dohot dai na tong marragam.,neutral
67,Dang hea boi marhata hata-hata na kasar tu hallet nang pe na laho margait/ molo lagi muruk hian alani sangaphu tu ibana.,positive
722,Nattuari halaki mandaftar beasiswa djarum,neutral
232,ito adit au manuhor indomi i sada,neutral
35,"Oh ido disuratna kan note 3 pro, boasa na dikirim note 3 atah, marsak iba.",negative
659,"Baoa manumpur warga pakke mobil di Prancis, 2 halak tararit.",neutral
25,"Au sai naeng mangan dison. Tingki lao manuhor, suara ni ni itoan i gelleng hian ampun ma dang jelas mangkatai aha blubup songoni haha. Ahu lao manuhor mi ayam 2 baso ekstra, hallethu manuhor bakso urat soun. Dang leleng nga ro na nituhor ni hallethu hape dang songon na niparbaga.",negative
757,dongan hu karejo di gojek,neutral
703,"Ido, ahu nungga hu baritahon sian halo bca. Alai ponggol -ponggol do torus jala pulsa niba godang habis molo maos martelepon.",negative
957,"Suasana na lambok, rata, pasegarhon jala mansai pas laho refreshing ditikki mandao sian angka ulaon siganup ari. Tu sipanganonna na arga pandapothu dang masala alana inganan na bagak narumingkot.",positive
330,Ngolngolan do diportibi namangilas on na gok sipalessem.,negative
609,Jolma saonari godangan maol pasangaphonjolma na asing.,negative
332,"Inganan on nuaeng patupahon stik dohot jagal na mura argana, alai dang na mura sasintongna molo dibandinghon tu bagak ni jagal na, na so tabo alana karas jala so mardai do jagal i",negative
869,Manogot nungga muruk-muruk alani panghobasion ni bank cabang Sanur naso profesional dohot mengecewahon! Dang sala godang pelanggan namenilai roa.,negative
119,"Dinalao mangan di tonga ari rap dohot 6 keluarga adong namagodang dohot angka dakdanak. Sopo na dapot nami tungmansai dao di ginjang. Boi do hupanghilalahon tung mansai loja do sahat tu si.Memang tung mansai uli do nian inganan i, alai unangma pas mangan tonga ari ro tusi ala tung mansai godang do jolma ro tusi. Arga do nian sipanganon disi alai tung mansai uli do inganan i.",positive
634,Steak na i lumayan ma tabo na. Warung on cokcok do tu parsiajar manang mahasiswa hehehe alana argana dang pola arga. Molo sipanganon na oke do.,positive
307,"Anggo pandapot hu sipanganon dison tung mansai suk-suk jala mura argana, jala muse hatop do ro nang inganan on pe ias jala tardas
",positive
264,Halak indonesia i porlu pangomgomi na malo dang pangapuli.,neutral
565,"Tong Dji ragam ni sipanganon dohot siinimon, dang holan teh. Nadisarnhon: Teh poci gula batuna dohot nasi goreng.",positive
338,"Anggo ahu dang apala hu halomohon anggo jagal hambing alani angir na, alai mangan dison saehira na so mangallang jagal hambing do iba. Jagal nai hapur, tabo jala dang angir. Jala ruma makan on pe denggan jala pasonanghon roha
",positive
156,"naeng tutuponhu na ma kartu kredit sian piga-piga bulan na lewat, boh.",neutral
71,Natutu toho dangadong na dibahen bahen.,neutral
425,Agoh indosat mangecewahon. Ahu naeng mandaftar nabaru boasa gabe mambayar per kb? Pulsa moru toppu.,negative
775,au manuhor baju panas eiger,neutral
431,"Panghobasionna hatop do alai loppaanna dang marmusmus, asal adong asak masak, nipangido udang saus tiram, sarupa dohot pangaploppaan ni kepiting saus padang, tang tu kepiting dang pola dilehon molo dang nijalo.",negative
576,"Restoran dohot konsep inganan parmanganon namansai asri, apalagi molo borngin suasanana mansai bagak dohot lampu lampuna, sipanganonna pe tabo daina. Cokcok ma gabe inganan marpungu dohot keluarga.",positive
759,parjolo sahalai hu suba ala ulasan ni piga - piga halak alai na sitohona samal hian  do. sapiring 30 ribu. maol mangalului inganan laho hundul.,negative
359,"Nagkiningan didok paima ma sahat tu na ro sms, hape nga sadari manipat laos so adong tong!",negative
473,Tikkina mambahen sipatupaon visual 360 derajat dohot samsung ! dohoti langka_langka a mura sian vidio on.,neutral
242,"Didokkon detil bauni chamomile, alai boasa bauna dang tabo songonon.",negative
92,Ahu mansai sombu tu spesifikasi ni laptop Asus.,positive
104,Mansai las do roha acara Wekkend rap dohot keluarga di inganan na cukup fasilitasna jala argana pe ndang apala timbo. Lam tamba las ni roha ala adong porlak stroberi jala boi mamutik sandiri.,positive
849,Molo boe nian diparrohahon admin. Jaringan di cileungsi bogor mansai roa hian. Hape gararanna arga.,negative
615,"Sipanganon na tabo: ayam goreng, tumis goreng, sup ikan, tempe goreng, sambal. Panghobasionna na pe denggan.",positive
848,"Parjolo sahali ro tu inganan on, nga dipangido hian jala dapot nomor 3. Pinangido inganan di toru asa unang pola nakkok tangga ala adong na dugul-dugulna tagan hansit. Paimahon naeng 40 menit dangadong hapastian. Hu sundati. Nakkaning dangolo au mangalehon punten 1 alana olo ra lagi rame dohot pangidoanku na husus, gabe maol. Agah itoan i gabe sulpak.",negative
131,Godang do na mambahen songgot roha marnida hasil ni quick count pilkada serentak 2018 na lewat.,neutral
605,Panatapan na cokcok laho rap marsonang di bot ni ari dohot siborngin. Sipanganon na pe lumayan marragam jala tabo.,positive
286,"Au dohot dongan ni pardijabu tagan pasudaahon waktu di  palembang. Au mangalului inganan parmanganan las pajuppang bakmi jogyaa. Dung masuk tarsonggot ma alani au ikkon mangalului inganan hundul, dohot mangalului inganan na langa au tarlaoshon saleleng 35 menit. Sae mangido dohot sipilliton mi godok. Au muse mamette na sajom laos on do mambahen mago sir ni mangan hu pe disukkun tu pangaloppa.",negative
897,"Podomanna rotak, bantalna bau sude... mambahen daging gabe gatal songon na godang binatangna, gabe dang boe iba modom renges.",negative
907,Pardalanan borngin on mansai malojahu,negative
564,"Au ro tuson rap dohot dongan laho mangan siang. Dalan lao tu inganan ni kafe on mansai sompit jala pantik, sampe adong do piga-piga nasega. Hami mamesan akka ragam ni sipanganon. Dung nipaima songonna leleng, tingki ro sipanganon dai dohot tampilanna mambaen jut roha. Hape dainape mambaen jut roha. ",negative
441,Songon goarna creative space kafe gabe godang karya seni na boi dinikmati di bagasan dohot piga-piga patung di toru. Molo di ginjang adong kafe dohot desain na bagak dohot  pas molo ro di bot ni ari. Inganan na adong di inganan na timbo mambahen inganan on adong panatapan na bagak.,positive
481,Selamat siang jolma napogos. Sai anggiat hamu hatop mate manang lam pogos dohot maporus.,negative
360,Gojek naeng mambungka hobason di piga-piga negara asia tenggara,neutral
20,Porsea do masyarakat ni Indonesia tu karangan ni bapak polisi na sangap on? Didokhon nga pajumpa dohot nampuna kareta? Ba punten hamu ma mangkarang di toru on. Dapot punten sadia?,negative
475,Manang didia di Bandung on maccet. Jatinangor pe songon tol brexit. Boe patialaon di bagasan ni motor ala palelenghu paimahon.,negative
144,"Uju sahat hami nunga masuk tu daftar tunggu, nangpe gok kursi naso marisi ala piga-piga dang tarpangke. Angka parkaejo i tong do burju-burju nang pe adong sian na ro i namarungut-ungut ala leleng paimahon hape adong do hundulan na so marisi, manjalo sipanganon di pudi ni ruma makan i, jala tung tabodo daena hupangan hami, onma na paduahalihon hami ro tuson jala pajumpang dohot partiga-tiga ballon.",positive
186,"kwetiauw goreng dohot teh tarik gabe sipanganon lomo ni rohangku dison, nata pe adong piga-piga na mangido mi yamin, boi do tong subaon muna indahan gorengna i",neutral
524,Dibulanon saldo di rekeninghu nol.,neutral
542,Hotel Ibis manamarhon wahid hasyim mansai jut rohana tu panghobasionna.Apalagi maslaa reservasi ! Posa hian ma!,negative
238,judas hian bah parkarejo ni indosat na di graha indosat.,negative
914,Au dang hea manolsoli manghaholongi ho.,positive
387,"Angka sipanganan di son tabo do puang, untabo do sian angka sipanganon nasongonon na di balik papan. Alai argana ummarga do attong. Hhe/paling saotik ma di arga 100 ribuan lobi. Alai sabas do pangkilalaan ala tabo do sipanganon i. Hua ni tomyam nai. Mm, tabo hian.",positive
840,"Nang pe porsi na balga, alai sian daina, somal hian. Argana dang dos tu porsi na tahe. Pangaradeanna pe dang pola songonna ture, lak songoni ma.",negative
709,On ma pangebation  nami na parjolo tu ruma makkan cabang na jumolo. Andorang so jotjot hami manuhor sian cabang na asing. Ala dirimpu hami ung denggan jala ung godang sipanganon. Alai tarsonggot ma iba ala panghobasion na so lambok. Hami naeng hundul di sofa na di duru disuru parhobas boru-boru. Alai parhobas baua dang dipaloas ala malas ibana paiashon.,negative
906,Badan pamarenta nasada on ikkon dibubarhon alana saleleng on karejo na dang adong lapatanna apala otik.,negative
883,Bakpao on nungnga tarbarita sian najolo alai sahat tu saonari godang dope dihalomohon ala daina na has.,positive
267,Parhobas dohot nampunasa na hundul di kasir dang marhatai dohot dang boe mangalehon panailian tu godangni sipillititon na ikkon hami pangido. Daina somal. Parkirna maol.,negative
114,"Ditingki mangalului parmanganan na godang mansamna au, di patudu dongan ma inganan on, nga mura argana dae na pe tung mansai tabo. Holan I do antar ngolngolan iba saotik paimahon na pinangidoi.",positive
927,"Dang na adong be na mamillit muse, dipikkir ho masarakat nuaeng boe dope oto-otoan?",negative
878,Kecewahian alani liga champion dang disiarhon di channel manang dia nang pe channel lokal manang channel olahragana. Harusna hamu manjujung hak siar i alana panuhor nungnga manggarar arga.,negative
734,mahasiswa unang sipanggaron dohot politik. marsiajar ma nian.,negative
43,Adong do godang porlak kota di Malang.,neutral
566,Dapot ni warga 2.910 keping ktp-el di ramba bolak. ,neutral
743,"au las rohakku tu aplikasi gojek, ala mangurupi di godang ni sikarejoan ",positive
829,"Hea hu instal traveloka, alai ala dang tarpakke ujungna gabe hu uninstal muse.",neutral
199,"tung mansai bagak do inganan i laho inganan margambar, jala lambok muse do panghilalaan di inganan i, alai unang ho mangan disi, nga dang tabo argana sumalin, bursik ma i.",negative
410,"Seangna, hp xiaomi manang aha pe dang boi molo holan manuhor 16 gb alana software bawaanna i balga hian.",negative
204,"nion adong udang dipudi ni batu, asa gabe anakhon na i di pinlit gabe panggomgomi.",negative
893,"Lomo hian tu sipanganon na ima kantang natinutung. Molo argaa, somal ni steak ma. Daina dosma tu argana. Pandapothu inganan on menak do dohot adong taman di tonga-tongana. Parmanganan on ikkon ro ahu muse molo tu bandung muse.",positive
809,"Kafe rindang dohot suasana songon na dihuta dohot tombak na raphon binanga tagelleng na mansai uli tu daina agak tabo dohot argana dang pola paargahu, nirekomendasihon do tu sude on",positive
826,Utok-utomu natana holan sabalgani pukkul.,negative
639,Gabe ngolngolan. Sude film nga ditondur jala saonari mate gaya.,negative
681,Ama na marmise na jorbut i mamolus sian zebra cross,neutral
26,"Godang komen di Tripadvisor mambahen ahu sukkun-sukkun, modalhu butuha na so marisi asa mangallang lontong padang hasolomanhu hape tutu mambahen marsak, ujungna ahu mangido dibungkus ma roha laho mangan pe gabe moru. Tumagon dope mangan lontong padang na di ITB, molo daina dao  dope.",negative
167,tung mansai maol do selfie/margambar holan ala ni si samsung galaxy. Alai porlu do usaha dohot tongtong marende.,neutral
395,"Sipanganon tabo, ingananna uli jala pasonangkon roha nang haupe godang, dohot muse suara ni aek di binanga i tamba sonang situtu panghilalaan, panghobasionna pe hatop ndang pala leleng paimaon. Adong muse inganan salat na denggan jala uli. Ragam ni sipanganonna pe tabo jala aragana pe naboi gararon do.",positive
671,"Dang hea ngolngolan! Sian taon 1996 au parjolo sahali mananda ayam goreng Suharti, au mandokhon on ma manuk na paling tabo na hea hupangan. Resep sihabuian jala parmasak kremes na manambai dai na sian ayam goreng na  tabo hian toho sian  Indonesia on.",positive
239,"Promona margabus manang songon dia da. De pareso inna adong promo 77 ribu dapot kuota 30 gb di orui 40% sian arga parjolo, tikki huisi pulsa godangnna 80 ribu dang di daftarhon manang aha pe nungga godang di orui 5 ribu. Boasa boe songoni ateh? Sial ma.",negative
922,Dalan na asing laho paias-iashon di Jakarta. Ahu nungnga hu suba. Sahat tu nuaeng parbueni ulaonna naumbagak sian akka na asing.,positive
428,"Inantaku manhuhor piga-piga situhoron di lapo nasarupa, dohot borat na dang sahat sakilo, mamakke panongosan sian gosend, hona ongkos tongos 2x, hurang ajar!",negative
732,Boasa au manjaha sungkun-sungkun ni angka salon katua umum on sude mandosdos. Dang binoto songon dia.,negative
713,"Ditogihon dongan ditikki kuliah, ninna tabo hian sate na on... alai dung ni dai  hurang masuk tu na dirohakkon... hehe holan pandapot hu.",negative
876,"Loja di pardalanan na agak dao sian kota targarar dohot suasana dohot taboni sipanganon, disempurnahon muse dohot panghobasion na lambok dohot hatop sian parhobasna. Unang lupa mamillit desert parbue ni stroberi na segar dipatupa dohot susuk coklat, ho ikkon hatagian.",positive
637,"Parkiranna situtuna bidang, alai alani godang ni jolma na ro, hami ikkon parkir di topi ni dalan. Alai parkarejo namangamanhon mambantu hian lao patuduhonsa. Hera na so pola bidang, na sa bidang ni jabu na sedang ma, alai molo di bagasan adong ruangan na mansai bidang. Adong karosi dohot sofa marragam-ragam, hampir dang adaong na sarupa, alai hera na sonang hian ma lao marpungu.",positive
270,"Sipanganon dison agak tabo, alai argana agak tibbo pandapothu. Hami mambuat undungundung dilambungni hauma, tikki siallangonna ro agak godang lanok. Hea sial satokkin alani dipangido alusi pangidoan, alana baru dope ra.",negative
882,"Inganan parmanganan on satohona songon na menarik alana marragam sipanganon ni Indonesia diparade di inganan on. Ale seang, olo ra ala ma menarikhu, gabe godangni jolma na ro pagodanghu lobi sian kapasitas ni inganan na adong, gabe songon na sosak.",negative
461,"Dangadong matena mandiori kafe di bandung on. Tarmasuk ma inganan on, bagak ingananna hian ma tahe, kopi lattena pe tongon tu dilahu. Arga ? Dos ma.",positive
451,"Pengalaman na songon na seru, mangan dang maralas piring, alai holan maralashon bulung, lam tabo. Sipanganon ni Sunda na mansai marragam jala agak tabo. Tipsna, unang tarboan emosi dohot mogap mangido dohot mamillit sude sipanganon na di parade alana mogap molo mamereng sipanganon namarmasssam songon i. Pillit saporluna.",positive
366,"Panatapan na tung mansai uli do sian kafe on. Ai tarida ma hau tusam dohot hinauli ni hutan raya bandung. Dungi muse angka sipanganon dohot siinumon na boi tardok mura hian do, agoi amang!
",positive
433,"Tingki parjolo buka lumayan. Alai lam tu son kualitasna moru. Mina hurang daina, nang songoni huana.",negative
