id,text,label
319,"Delish, venue's clean and comfortable, and the food served is also diverse. Besides that, the place is located in the city, making it a resting spot for shoppers and office workers. The price is costly, for sure, but it is equal to the taste.",positive
72,"You can just try looking it up in Bukalapak. If you really need to, you can use Redmi 4a",neutral
449,"The food was okay, but there was this one server who was kinda dirty, making it a little less comfortable. Please serve the food quicker so the customers won't get hungry. There are many things to improve.",negative
448,"It was just 4 p.m. on Thursday. My friends and I were about to have a coffee break. I forgot what drink we ordered that time, but all I remembered was that when we picked Menu A, the server said that they run out. Then we chose Menu B, it was also out. Eventually we had to pick another menu. Pretty annoying.",negative
789,"The meat here tastes better, but the spice there is more flavourful, with similar price to boot",positive
300,"""...romantic spot...""",positive
908,"Curious to come here because we had been seeing their ads on the street every time we passed the toll. When we got there, the place turned out to be quite average. We were there late at night, plus it was raining so it was rather muddy",negative
712,"This resto is quite large, the atmosphere is fun, and customers can enjoy the view of Bandung city. The menu has Western and Indonesian food. The price is worth the quality and service.",positive
77,Bogor will be led by Bima Arya once again,neutral
283,"On January I've gone to Galeri Indosat to register my card. The staff with a bag said that my card was already registered, right. But the other day I couldn't call or send messages because I was blocked and not yet registered. What am I supposed to do, then? Thanks for the absolutely 'excellent' service.",negative
118,"I tried to dine in Suis Butcher Steak House in Setiabudhi, I also tried the Suis Butcher on Riau Street. I liked the atmosphere in Setiabudi's Suis Butcher more since it is not too crowded, and it is a good place to chat. For the food, I like its tenderloin, salad, french fries, and tiramisu. The price is worth the taste, and is also equal to the quite prompt service.",positive
478,"The wifi here always has an error, the food and drinks are a bit expensive, the fried lumpiah is way too salty, the milk tea is only slighty okay, and the order takes forever",negative
594,"I wanted go to a hotel in Mong Kok, Hongkong, but turns out there was no hotel! Last June, I've booked and paid for 2 rooms. But the hotel was nowhere to be found.",negative
540,"Rather than having a fuss about flash sale stuff, let's just play online poker.",neutral
925,"Roti Unyil, a patisserie serving all kinds of breads / cakes in tiny sizes, very famous in Bogor and Bandung",neutral
506,"I wanna help by giving the info connections, but my internet quota is limited",neutral
663,"I am of the same opinion, this show should be removed, lots of useless shows nowadays. The people in the show also act like uneducated people.",negative
505,"The absolute must-try nostalgic restaurant, perfect place for family, with huge parking space. Almost all the food are great, especially the steak, saslick, and ice cream ",positive
187,"Get your family, colleague, friends, lover, lover's friends, or even your ex, for this vocal award.",neutral
184,"The place is interesting, with a very industrial concept. A shame that almost all of the menu is non-halal.",neutral
534,"For Jogja people, it's kind of a pain to come there twice. Once is enough. You gotta pay to enter. The food's expensive.",negative
327,Lots of my family have worked as civil servants.,neutral
14,"We had dinner in that restaurant and the service was decent. The dining room was big, there are tables inside and on the veranda. You could take the food directly from the serving table inside the resto. There was also an option for freshly cooked food that's fried upon ordering and most of the menus are traditional dishes. The waiting time was not too long. The presentation was also unique because they used leaves instead of plates.",positive
961,That courier was late for about a day on the delivery. Please be more responsive.,negative
916,"When you wanna enjoy a variety of food, the first choice has to be Hanamasa. The location's pretty great. Lots of food you can choose from, ranging from snacks, barbeques, boiled food, all the way to desserts. Not bad at all!",positive
574,"Get a free Rp 25.000,- credit voucher for two lucky winners every day just by retweeting bniquotes.",neutral
888,"Eating at a fancy resto, the price is obviously high, but the taste is horrible. So frustrating",negative
157,That's what Shazam is for: so you can find out about the magical songs played by the Gocar drivers.,neutral
382,"Dining in Reds Dipo was so good, it was the first time I ever really enjoyed eating fish. They were fresh, delicious, and not fishy at all. At any rate, the pomfret was amazing. And the robusta milk coffee was marvellous. Basically, I was addicted, okay? Reds Dipo has become my favorite place. It's just that good, man",positive
769,"My goodness, why are both Telkomsel and Indihome so darn problematic? Expensive for nothing!",negative
521,I came here just for a little fun while vacationing with my family. I only had drinks and snacks. The drinks here costed way less than the ones in Jakarta.,positive
202,"My Indihome bill this October is quite different from September. It's more expensive. Why is that? You promised since the first installation that there would be no additional fees or flat fees. How can the price go up and down? Consistency, please.",negative
149,"I really regret eating the salted egg Indomie. I ate it this morning at 8, and my mouth can still feel the aftertaste to this very moment. And it's really bad, dear Allah.",negative
99,"This is a unique meatball. There's a lot of fillings to choose from. There's cheese, spicy minced meat, or just urat. I choose spicy minced meat and my God did it live up to its name. The price is right, and the place is clean.",positive
929,This person do be blockin' the road like no tomorrow.,negative
269,BNI strengthens their branding with BNI City Station,neutral
778,"The sensation of eating on a sheet of banana leaves, with the delicious grilled calamari and the tasty fried tempe, along with the mouth-watering sambal. Absolutely amazing",positive
762,"Mie Mewek is located in Pajajaran Street. Near the BEC area, the gadget store centre. Here we can enjoy its signature spicy cuisine. Mie nangis (the crying noodles) will really make the customers cry, because it's so spicy and yet so addicting that you can't stop eating it. The noodles are thick and chewy. Really good. ",positive
272,He's having the Indomilk milk in the fridge,neutral
354,Frustated as all hell for selling Yakult all that time and still not getting any profit.,negative
105,Ramayana has once again opened its branch in Samarinda,neutral
109,"This place is popular among university students. Cuz aside from the tastiness, the price is pretty cheap, too, in my opinion. It's just tops.",positive
833,The variety of art pieces displayed on the ground floor and second floor really grabs your attention. There's also more artworks you can observe outdoors. The eye-refreshing view as well as the breezy weather really make this place a favourite for many people.,positive
951,"I don't like the current coach, the strategy he came up with can't be used to beat our opponents.",negative
229,"This is just a place to eat while you're waiting for your family when they're shopping, not for those who actually want good food. There's a ton of other places in Jakarta that have way better food for way less money. ",negative
492,"After you finished shipping your items, make sure to recheck the address in the receipt before leaving JNE Pondok Timur counter",neutral
212,"Everyone's punching and kicking each other, turns out they all have a hidden agenda! What a joke!",negative
388,"Mad not cuz of you, but cuz PSSM defeated Persis. Feels bad, can't sleep well, can't eat well. All because of PSSM.",negative
954,"Topped up my credits via BCA ATM at 17:48 and I still haven't received it yet. Can you check it, please? Thank you.",neutral
37,My Monday morning was filled with interviews. Before I could walk there I needed to call a Gojek driver while it was still raining.,neutral
561,"The perfect place if you're looking for a satisfying meal on a tight budget, there's quite a lot of variety here, from Indonesian traditional cuisine all the way to modern dishes.",positive
980,"I see lots of Indosat users whose credits got cut, a pity, really.",negative
807,"A very natural place, with varied menu and spot-on flavours. I especially love their bandrek jagung, the sweet corn is served while still warm. There's also an assortment of traditional snacks that you don't see that much anymore.",positive
982,This man's speaking nonsense! Someone got kidnapped but he's more concerned about the kidnapper. Where's the logic in that?,negative
66,"The place is huge. Opens 24 hours a day. Perfect for snacking. The sofa is really comfy. A shame that there's a lot of uni students doing their assignments, so the place is almost always packed at night, hehe",positive
479,"Unlucky of me to join the group to go to Bali, very boring.",negative
172,"Although it took us many turns to get to this place, it was eventually paid off with quiet mood, calm atmosphere and the cool highland breeze. I just so happen to like dining outside during weekdays because there won't be too many people inside but the downside was the lack of ambience music. The food was pretty good and my family also quite enjoyed it. ",positive
519,Perfect for dining with family. Enjoying the delicious meal while chatting and unwinding after a long day of activities is truly the best.,positive
715,"I'll never get tired of coming to this resto, especially on Saturday nights. Our family really likes this place because it has live music. The atmosphere is still fun even after all these years. The menu is also still consistent and mouth-watering, from the European menu to the traditional Indonesian menu. The portion is also huge.",positive
641,"Everytime I see the face of this person, I feel an inner God-level rage.",negative
348,Indian culinary I personally think is not that delicious. Too many spices.,negative
22,"Our family came to this place because it was late and no other restos were open. Turns out, even at 10 p.m. the place was still packed, with no parking space or even empty seats available inside the resto. The staff looked so tired and sour while serving. For God's sake. In the end we just took our food to the hotel.",negative
620,"Oh, yes, I also want the automatic receipt printing feature to be fixed.",neutral
126,In the begining of this year Djarum Foundation Cultural Service event will be held in collaboration with Garin Workshop. ,neutral
83,"By buying Morinaga Chil Kid and Chil School for Rp 500.000, mommies can get Rp 50.000 worth of GoPay vouchers",neutral
966,"Right now tourists who love diving are very disappointed with Ambon Bay's conditions, which looks beautiful on the surface but is actually really dirty.",negative
493,"Recommended for Indonesian style lunch, there are so many choice of foods you just have to pick. Mostly fried, such as empal, fried chicken, fried tofu, etc. Utensils used are old-school, such as metal plate, metal glass, reminding us of eating in the past. The service is quick. Awesome.",positive
466,"The place is cozy, pretty windy but also refreshing. Good concept for the place, very cool VIP room. Absolutely instagrammable. Perfect for hanging out with friends, family, or significant other. The food is not bad either, and the price is also affordable. The cashier lady at that time was so friendly.",positive
672,"Seems like this old fart won't ever change his ways even after all this time, huh? Worst, most rotten person ever.",negative
581,"No Sunlight no Mama Lemon, just use Garnier Men Turbo Oil Control to wash your hands after cooking aka I can't get this slippery oil off my hands.",neutral
379,"Batagor Kingsley is very delicious and well-like by Jakartan people and families. Every time I go to Bandung, my family and friends always beg me for Batagor Kingsley",positive
858,"The best coffee here are the avocado coffee and banana coffee. The avocado doesn't ruin the coffee flavour at all, perfect for my taste as a mixed coffee lover. The food they serve is also pretty tasty, my favorite being their french fries for an affordable price",positive
311,"He/She was caught making Jumbo-sized Indomie Goreng, even though just one of those won't be fulfilling.",neutral
261,"I was invited to this restaurant by my business partner. When I tried the noodles, it tasted absolutely amazing. Unfortunately, at the time, mine was too salty. I couldn't really enjoy the amazing noodles because of that. For the atmosphere, it was just decent. However, it's really expensive, 2 bowls of noodles cost us Rp 95.000",negative
582,This driver won't pick up my items since this noon. Please follow-up my complaint,negative
414,What a tiring morning I just want to rest,negative
155,"Your field ain't in politics, dumbass!",negative
351,"Curious to try tht rather famous chicken. That afternoon was empty, and I ordered a grilled chicken. Turns out the grilled chicken was spicy. My children couldn't eat them. They server shouldve asked us first whether we wanted spicy or not since there was 2 options. I then ordered 2 more non-spicy grilled chickens. My Goodness! It was as if the chicken was only fried and smeared with soy sauce. We had lost our appetite by then, ",negative
857,"At first I was a bit worried about the service's speed but it was pretty good and punctual. I forgot the name, but I remember ordering a mixed juice of some kind, which was nice. And the food was also okay. Oh yeah, they served free ice cream. You can try talking to the servers about it. Love it.",positive
248,"Since coming to Bandung, only now do I get the chance to eat here. We ate in The Valley Suki. Our tummy's satisfied, food tastes really good, the waiters are friendly, and there's a nice view if you're by the window. Yes, with only Rp 190.000,- / person (tax included), you can eat anything you want. It works like Hanamasa but the place is way more fun.",positive
280,"Don't know where to have a nice and affordable place to grab a bite? Just come right here. Me and my partner are really enjoying it. Most of the customers are young people, making us feel just as young again.",positive
11,"The place / location is pretty easy to spot. The building and its interior are interesting, especially the small garden inside that has an urn with water flowing out of it constantly. Makes the mood more romantic and pleasant. The menu offered had a lot of variety and as far as taste goes, it's quite good.",positive
739,"The sushi menu isn't large enough, you might wanna add a small portion, like 2 pieces each. There should also be complementaries such as wasabi and chilli powder. To be honest, not that special.",negative
881,"My first time eating in this place. No concept of a cafe or a resto, just a humble eatery serving traditional meals.",neutral
54,"I went to Maxi S resto with my family, turns out that there was a wedding party and birthday party so the place was jam-packed. What a poor service, then. If the place was that crowded, the resto staff should've told the customers before they park their cars while it's raining heavily outside, as the distance between the parking lot and the resto was quite far. Better yet, they should've closed the resto temporarily while the party was going on.",positive
660,Telkom Hackaton is a training programme by Telkom Indonesia that aims to facilitate the younger generation who has experties in the Information Technology field and programming to develop their own startups.,neutral
704,I liked none of the drinks. The chicken was so-so. There was cheese sauce but I didn't like theirs. Not good,negative
805,"A highly recommended family resto, it has beautiful views surrounding it, comfortable huts, and great food. The night view of this resto is especially breathtaking.",positive
444,"I went to this restaurant for dinner because I just happened to pass it on my way to the hotel I was staying in and me and my friends were hungry so we decided to eat here. The taste was so-so, but we had to pay first even though we weren't finished yet just because it was near the closing time.",negative
699,"Our first impression of staying here, checking in at 2 in the afternoon was not possible because the previous guest checked out late. We were offered nothing from the staff as we waited for an hour while they cleaned our room. Then we were told that the restaurant would close at 5 p.m. so if we wanted to order food for dinner it had to be before 5. Kinda annoying.",negative
227,"You can't enjoy Bandung without its food. Kafe Halaman offers you traditional Indonesian food. The gado-gado is tasty, the fried banana with cheese is also good, and a nice cup of coffee while waiting for your friends to come is always enticing ",positive
612,"Agree that with a higher phase, the cost to tickets should get higher. But, the base price during the elimination phase is already too high. Try comparing it with the cost of watching it in Malaysia or Thailand.",negative
6,"Me and my wife were tempted to visit this restaurant when our family was visiting Pontianak last week, because our trip advisor said that Abang Kepiting was the most popular resto in Pontianak. Around 7 at night, me and my wife had arrived and the place wasn't that crowded, with only around 4 tables filled, since the two of us just wanna chat.",neutral
562,"I arrived in this restaurant near lunchtime. At first there were only a few customers eating here. However, as soon as lunchtime came, the restaurant was flooded by the people of Makassar city. The number of Makassarese people coming here to have lunch just goes to show that this is the number one restaurant in Makassar city.",positive
378,The PIK Waterboom Jakarta tickets are rising in price.,neutral
381,The location's pretty far from the city of Bandung and now there are two toll gates to go through in order to go to The Peak witha total cost of 5000 rupiah. This is basically like extortion since you wouldn't be able to go to The Peak without going through these two gates.,negative
211,"Here's the full data, don't believe the KPK, it's all lies. This case was audited 10 years ago and nothing was missing. Because after that, there was an audit about fund allocation for special needs. If they wanted to, they could have had another audit. Just forget about it. The Century case was just a scandal to protect certain elites.",negative
418,"Very recommended, the food is absolutely delicious! We sat on in the upper gazebo when the sun is setting, dinner with sunset! And it's so pretty.",positive
438,"Rcti has too many useless advertisements, very annoying",negative
78,"Okay, aside from checking out theme parks, I also like culinary travels. Since coming to Bandung, the food I've been craving for are siomay and batagor. For batagor I'm already familiar with the legendary taste of Batagor Kingsley. But when it comes to siomay, I think travelers would love to treat their bellies in Saung Siomay. The title says it all, the texture is soft, and the sauce just hits the spot.",positive
830,"The orders come out quickly, the servers are kind and of course the food is delicious. The price is just about right considering the taste.",positive
854,"I'm about to explode at Indosat, it has been two days and their signal is still horrible",negative
150,"Indosat should just go bankrupt, even in my place the signal can sometimes go off and on and off and on, even though I'm in the region of Semarang",negative
437,Buying PLN prepaid credits through Mandiri Mobile becomes inefficient because I have to call 14000 to get the token / not automatic,negative
334,"Meetings aren't always held in a closed room, this resto can also be a fun meeting place. Don't forget to order the fried rice with jerky and the Teh Tarik",positive
867,Samsung Galaxy S has been released last night. I was disappointed with the boring design. Only 70% of my dream came true. No use dreaming about it all the time,negative
665,Shame that the restaurant was dirty. Saw a tiny cockroach near the clean vegetable plates used to serve food. And there was another small cockroach on the seats. Hope they can improve the cleanliness of this place.,negative
689,"Yes, the cost is 120 thousand. I've also checked it on Tokopedia.",neutral
213,"Glad that we could end our trip in Bandung with a visit to The Valley on November 2nd. That day we were holding a farewell party for our friend who was gonna move to a new office. The menu had a lot to choose from, but I immediately went for the ribs. For me, the taste was well worth the price. Top notch.",positive
139,"The Fungka Permata V motor vessel went up in flames, killing at least 13 people. ",neutral
84,"The cease-and-desist order issued by Rohayani, a tobacco addict, against PT Gudang Garam Tbk. and PT Djarum recently brought up other issues.",neutral
702,"Instead of getting money using BCA credit card, I lose big time.",negative
424,"This restaurant is not just a place to eat, but also a tourist attraction. The location is very cold, the place is good, cozy, and has an eye-catching scenery. The available menu also varies and tastes good. No need to wait long for the food. The price is also relatively affordable. Great place to take pictures, too.",positive
498,"The location is easily accessible, the restaurant layout is average, the menu is quite varied and the food is delicious, the price is affordable",positive
777,"Well we just can't win. When there's traffic people whine, and when there's none they ponder",neutral
948,"Thie diner is located on Abdurahman Saleh Street, it's pretty comfortable and clean, lots of options for the dishes. Tastes pretty good and worth the price.",positive
808,I sometimes think about how it feels to be a woman in a gym. Lots of guys and middle-aged men are staring. Must be very uncomfortable,negative
846,"We went to eat at that resto, inviting my brother's family. They all absolutely loved the food quality here. We ordered salted egg fried shrimp and the taste was better than a resto in a five-star hotel. Highly recommended",positive
363,"Hasil terjemahan di sheet translation sudah benar, namun di sini tidak lengkap",negative
544,My friend applies for a position in Tokopedia,neutral
153,Not just family business. But also keeping the country's interests without clashing with global interests.,neutral
752,"Located in the hills, which makes the air and views really comfortable. Aside from that, the Nusantara cuisine menu has a lot of variety, there're also steaks and pastas. ",positive
662,"Great, thanks for the detailed and clear answer.",positive
255,"The fried chicken was good, and so was the fried eggplant. A shame that the fried jengkol was all out because I'd like to try some. Oh yeah, the kefongfong juice was also fresh",positive
780,"Monday mornings are never friendly, from my messy jilbab, heavy traffic, the ungodly crowded Transjakarta to Senayan, clocking in work way past 8, not attending morning prayers",negative
896,"Jealousy doesn't feel good at all. Jealousy eats away at your heart. Jealousy is pain, if not expressed",negative
90,"What makes Holycow better than the other steak restos is their amazing wagyu dishes. My favorite has to be the wagyu sirloin steak coupled with mushroom sauce. It's so good. The thick meat goes along perfectly with boiled corn kernels, spinach, and mash potatoes. Absolutely delicious.",positive
999,"Hello Ditha, we are here to infom you that we have received your payment in our account. However, your ordering process is unsuccessful.",neutral
127,"But if you want to look for it tomorrow, it will be on the shelf near the Wardah creams, across the shelves with the Citra lotions, sister.",neutral
340,"A resto with the concept of bungalows located within a residential complex. The dishes served vary from Sundanese, Western, etc. the air is pretty cold at night or when it's raining so it's advisable to bring a jacket. Stones are used to walk fromo bungalow to bungalow so sometimes ithey get slippery when it's raining.",neutral
207,"The place is so cozy, the food tastes great, and the coffee is amazing. Perfect place for hanging out with friends or dinner",positive
258,"If my quota isn't back by tomorrow, I'm gonna be so mad at Indosat",negative
701,"The place's comfy, and the food's great. If you wanna chat around for a long while, this is the place. There're lots of lesehan spots, and they're so cozy when coupled with the breezy air",positive
727,"The food is quite good. The location is ideal, near the mall's escalators. Overall, absolutely amazing",positive
496,"Hello, yes, you can pay your water bills through Bukalapak",neutral
197,"Enka Olshop, trusted, items are all good.",positive
301,"Originally, this meatballl resto was located in Karapitan Street as far as I know, now it's true that it's spread across several places in Bandung. The food served does not only consist of meatballs, but there are other side dishes in addition. For the flavour, it's nothing too special, For the price, considering the size and price of meatballs in Bandung, it's quite on the expensive side. Plus, the service is a bit lacking in Ciwalk.",negative
274,"You should still be able to receive a cashback of 5 million by subscribing to the 500k Iplan package for 24 months,. You can also get 0% instalment using BCA, BNI, Mandiri, or CIMB Niaga credit card",neutral
