id,text,label
732,Why are all the candidates' statements so boring? It's just like...I don't even know,negative
713,"My friend took me here when I was in college, heard that the sate was good...but after trying it, it wasn't to my liking... hehe ust my opinion though",negative
876,"The tiring and long distance of our travel from the city was immediately paid off with the great vibe and delicious food, made perfect with hospitable and swift service from the waiters. Don't forget to try the fresh strawberry dessert served with chocolate milk, you'll get addicted for sure",positive
637,"The car parking lot was actually spacious, but since there were many customers, we had to park on the side of the road. Thankfully the security officer was very helpful in directing us. It didn't feel that wide at first, just as wide as a standard old house, but the interior was deceptively vast. There were all kinds of seats and sofas, almost none of which were the same, and that made for a great vibe to hang out around.",positive
270,"The food here is pretty good, but I think it might be a little expensive for me. We picked the lodge near the ricefields, and when the food arrived, there were a lot of flies around it. We were kinda frustrated because we asked for candles and the response took a while. The waiter who brought our food was also kinda slow to respond, maybe they were still new.",negative
882,"This place is honestly pretty interesting because it has a variety of Indonesian cuisine. Ironically enough, its uniqueness is also its weakness, as they attract way more customers than the place can fit, so it feels suffocating.",negative
461,"It's always a pleasure to explore the cafes in Bandung. Including this place, the place is very good, the coffee latte also hits the spot. The price? It's worth it.",positive
451,"A pretty fun experience, eating without plate but instead with only leaves, even more delicious somehow. A little advice: don't get too carried away and greedy by ordering all the available food. I know it's hard to resist when you see this many food in front of you. Eat responsibly",positive
366,"Spectacular view from this cafe, providing a touch of fir and the exotic nature of Hutan Raya Bandung. Other than that, the food and beverages are very affordable. Cool!",positive
433,"When it first opened, the taste was fine. However, the quality has been gradually declining recently. The noodle is less tasty, and the broth is no different.",negative
458,"The roasted goat resto that I reccommend when visiting this city. The roasted goat is delicious, savory, and plus the goat doesn't smell and it's tender. The oxtail soup is also no less delicious. The place is also very fun, suitable for anyone who wants to spend time with family or friends",positive
4,"Reviews got me interested, so I took the time to go to Warung Sale. At first I was excited. Traffic jams? No big deal. But the road was a letdown. Aside from the long distance, the awful road conditions lowered my excitement a little. The building was unique, there was elevator music. Room capacity was kinda limited, though. The menu was pretty unique and creative. However, it wasn't good enough to make the trip worth it.",negative
985,Last week there was some 4G network in my village for a while.,neutral
706,"Better empty your stomach before you step inside because all-you-can-eat is the name of the game. Eating here is so satisfying, all worth the price. I especially love the fried rice, it's so good.",positive
460,You can also ask questions about Mandiri Finance Credit here.,neutral
331,Now the restaurant is a two-storey. Shame that it was stiflingly hot when I went there because the AC was dead. The one thing that baffled me was I was never given any receipts,negative
377,"We visited this restaurant at nighttime. Wow, the place is darn romantic. Candles, uphill path, and the concept of Lesehan surrounded by the sounds of a nearby waterfall make the atmosphere all the more enjoyable",positive
652,"This place served several food, but of course the one I tried was the batagor, place was clean too.",positive
513,"Very good. The Tyson sambal is definitely amazing! You can eat with anything off the menu, it's suitable. Prepare to get your mouth burned and gain weight if you eat here!",positive
530,"Please check out our store if you're looking for Advan, Xiaomi Redmi 4A, and Nokia 150 the other day.",neutral
917,Uni students nowadays complain too much while not creating enough.,negative
586,"Menu's pretty simple, a lot of pasta flavours, comfy place, also lots of options for drinks, there's even desserts. They should try scheduling a live music, that'll be awesome for sure.",positive
783,"My internet bill is insane, 250% more expensive, man! Need clarifications",negative
457,Very disappointed. I ordered and paid for an airplane ticket at half past 1 a.m. for a 6 a.m. flight. The e-ticket was not sent. And suddenly early in the morning I was contacted through an email saying that the ticket I had paid for was already out. If the ticket was already out why on Earth could I still book it?,negative
520,"Truly a pity and ironic, to have such a foul attitude! Unworthy of being the people's representative for 270 million population from Sabang to Merauke!",negative
17,The menu has a lot of variety but they used too much oil. The fried gourami wasn't good because it wasn't cooked crispy enough. The juice offered had too much water and was not that fresh.,negative
501,"May they always be loyal in looking after the Indonesian people from Sabang - Merauke, from the city all the way to remote areas",neutral
27,Toyota is ranked first as the most valuable automobile brand.,neutral
45,"You know what they say, thieves always got each other's backs. What we should focus on is the procedure and not the fact that a member of the council got caught red-handed while accepting a bribe.",negative
236,"The food tasted pretty okay. The sambal was also good, especially when you could choose from 3 different variations. To be honest, there were quite a lot of options here. you could have gouramis, snappers, pomfrets, clams, calamari, shrimps, they got it all. No mackarels, though, they didn't have that here.",positive
610,Now I know I've hated that foreign online shop too much,negative
94,"From my college years to this day I still love to eat in Kuis Butcher. Tasty, affordable, and has a nice place",positive
372,"Not a fan of eating oreos, makes my teeth black",negative
902,"My favorite menu is the beef soup and iced grass jelly drink for the drink. Tastes delish, highly recommended",positive
152,"The night view of Surabaya is extraordinary, the food tastes good and all but the cost is also extraordinary. The distance is not that far but the landscape is outstanding and the ambience is pleasing.",positive
790,"To minimize traffic jam, Menhub urges the public not to come back to Jakarta all at once on January 1st",neutral
32,"A restaurant with breathtaking views even though you need to go through a steep road to reach it. Still, the great place and flavor totally make up for it.",positive
302,... Truly perfect for a fun night visit with your partner or even your family. ...,positive
357,This is one of the locations where the food is good and the scenery is a refreshing sight for sore eyes. Appropriate spot to gather with the family or with friends.,positive
736,So annoying. Monday morning with heavy traffic and flood.,negative
953,"This restaurant that serves traditional Sundanese dish has nothing to write home about. The few dishes I ordered tasted just about the same as the other Sundanese restos. Didn't really offer a satisfying flavour nor leave any strong impreesion on me. The only saving grace for me was the smashed fried chicken with sambal, which was the closest to being great.",negative
763,"Why can't I just skip the YouTube ads, so annoying",negative
36,Our corporation's services are very satisfactory,positive
24,"First time to Eatalia, I was with a friend and one child. We didn't have to worry about what to order for the child because the place also had menus with children portions. We had a pizza with black bread. Overall, none of the menus I ordered were disappointing. ",positive
243,"Win cool prizes by entering the ""Baik untuk Men"" photo contest in Alfamart",neutral
969,"If you're going to Bukittingi, don't forget to pay Pasar Atas a visit. There's a smorgasbord of scrumptious food there. Don't forget to bring along a camera to take pics, either.",positive
362,"Here is the myth that turns the new year into something ceremonial and artificial, without any depth in meaning.",negative
53,India is making a high-speed electric superbike.,neutral
57,I've been dreaming of travelling abroad for a long time,neutral
230,"Suis Butcher's tenderloin steak is amazing - so juicy, and the sauce really hits the spot. Better yet, it's not that expensive. Because of that, you'll have to prepare to be standing in a long line if you're here on weekends, especially at lunchtime",positive
413,Lots of my friends also work in Bukalapak,neutral
65,"How much is the minimal if I may ask, I wanna buy Tiket Kami for Senen - Yogyakarta using the May promo",neutral
903,Not recommended to go there during dining hours cuz finding a seat might be difficult then.,neutral
161,Awful how an order from Bukalapak using Gosend was made yesterday and haven't arrived 'til now. What should I do? I really need the item urgently.,negative
899,The room reeks of cigarette smoke. The bedsheet isn't changed for new guests and there's still some cigarette ash left,negative
589,"A talks like empty vessels that make the most noises, says nothing of value.",negative
636,"You won't find this sambal anywhere else. The shrimp paste's flavour is very distinct, the sweetness and saltiness are just right. The venue may look pedestrian but don't be shocked when you see the resto-class price, and it's all worth it for the food quality.",positive
710,"I think the steak was quite good, my advice is just get the biggest one, it's more tender than the others. If you come here, you can share your photo on your social media and get a free ice cream, and it's good too. For the food, it's great, and the servers are friendly.",positive
250,"Watch what you eat, Gus, it's that kind of season, after all. And yeah, burnouts can make you sick",negative
719,"I'm about to pop a blood vessel dealing with these BPJS patients, demanding executive treatments and nagging all day even though they don't pay for crap. You want executive? Try a goddamn train.",negative
