id,text,label
219,Enjoy 0% instalment for up to 12 months when ordering an Air Asia plane ticket with BNI Credit Card!,neutral
209,The cakes give me massive nostalgia. Everything is old school. from the presentation to the taste. They're great and inexpensive,positive
436,Mom once worked for grab indonesia.,neutral
394,"I love having lunch here the most, thanks to their delicious chicken and sambal, also the price is dirt cheap. The taste of the chicken just seeps to the bone, and the iced aloe vera drink is also fresh, perfect to cool off my stomach after eating the spicy sambal. The servers are swift and kind, and what I like is that in the cashier there's a writing that says 10% of the profit will be donated to charity, making the meal feel even better to my stomach.",positive
592,The DAMRI Bus service is really good,positive
317,Wanna make some posts with contents that educate Gojek customers.,neutral
352,Hundreds of houses in Medan were submerged by the flood,neutral
751,"The item's pretty good, but I'm confused. Is the ON button on the Xiaomi Redmi Note 2 kinda broken? And does the battery really drain this fast, boss? ",negative
856,Really hard to trust people who had betrayed us before,negative
504,"Located in Gombel with Semarang scenery, come at night because you can see the city lights. The great steak and warm tea are a must-try here. Take the outdoor spot because the air is cool and breezy.",positive
13,"One time we went here and ordered the fried rice and french fries. Everyone loved the fried rice. The fries were also really good, not to mention its beautiful presentation. My family said the coffee was great. The great things about this place were how spacious it was and how it is possible to enjoy Dusun Bambu's scenery outside. However, the service was so slow that I needed to ask multiple times about my order. It was also a bit pricey, but the food was so delicious it made it all worth it in the end. You won't have to think twice to try this place out.",positive
978,"The 35-thousand Thailand-style fried rice is bland, with only shredded chicken sparsely sprinkled in. And there's no seafood.",negative
570,"As we know, the original American brownies are baked cake that indeed has a brown color. Toko Amanda tried to be creative and made brownies by steaming them. And I have to say, these steamed brownies didn't do it for me. The texture was just the same as a regular sponge cake. So to me, these aren't brownies.",negative
489,"If you want to visit this restaurant, be sure to go on afternoon or night time, bring your spouse to enjoy romantic dinner and amazing scenery.",positive
862,"The first impression was memorable because after ordering I was surprised to see one of the staff bringing out banana leaves to our tables instead of plates or spoons. So if you wanna eat here, get ready to experience the unique sensation of eating food on top of banana leaves using your bare hands ",positive
774,"One of the most delicious culinary areas around. However, that just makes it hard to choose what to eat. In the end, I got myself a kerak telor and mie kocok while waiting for the music show with nostalgic western songs. Pretty recommended",positive
950,"To clarify, you may come to the corresponding branch office of Mandiri Bank during working hours in workdays to make a cash exchange.",neutral
614,"Rode on the Jayabaya train from Malang to Jakarta, stopped in Gubeng, the ticket costed 35 thousand plus 6k insurance via Traveloka.",neutral
569,DPR shows appreciation towards women's participation in the 2018 Regional Elections,neutral
666,"I came to have dinner with my fam. It was our first time coming here. It wasn't too crowded. For the interior. it was rather filthy in my opinion. There were leftover morsles on the floor and table, seemed like it wasn't cleaned properly. For the food flavour, it was standard. Nothing to write home about.",negative
965,"Please remind the council not to forget revising the Perppu for Mass Organisations and if they don't revise it, then several factions from the public will not take this lying down.",neutral
486,Cassava chips are the most delicious and appropriate snack to accompany me during assignment time.,positive
545,"Batagor and Siomay Kingsley doesn't have any branches outside this one. The food's great, especially the batagor and siomay as well as the baso, also none of them contain any preservatives. And if you're looking for a gift, there's a package you can take home. Keep the good quality going.  ",positive
707,"Never order from this service, my friends. Utterly disappointing! The villa was dirty, and all the appliances were unusable",negative
514,"Registrations starts tomorrow, Ministry of Communication and Informatics offers Digital Training Scholarships for 1000 people. ",neutral
855,"As a netizen who went on a picnic to Toba just last April, I just wanna say that there are indeed a lot of disappointments coming from the tourism system there. Parapat was dirty, it was hard to find actually good accomodations, the transport agents were unprofessional, just don't bother, Parapat is not recommended at all.",negative
412,The place was so dirty and I was ignored by the servers. The service was so disappointing,negative
590,"The place is mediocre for me. Not that clean, the food is also nothing special.",negative
456,"For the effort it took to get to this place, the payoff was so-so. The disappointing part was the food quality. It was the barest minimum effort for making a meal. For the high standard of Bandung culinary, this was a letdown. Not to mention there was an entry ticket, 10.000 per person and 15.000 for cars",negative
467,"My family and I were looking for a place to eat after watching a movie. We were bored with eating in restaurant / cafe in the mall. Suddenly we saw a restaurant on the right side of the street. We hadn't eaten curry in a long time. We stopped by a considerably small resto, with only 9 tables. Turns put the place was comfortable and the food was delicious.",positive
852,How can the Starbucks coffee taste this good,positive
861,"I heard they'll build a Transmart there, next to that building",neutral
628,"Truly a unique experience, eating in the middle of the ricefields among the yellowing rice. With a variety of menu choices, the presentation is interesting and appetising.",positive
181,"Dined togetha with da sistahs a lil' bit ago, cosy place, nice to hang out, good service. Have gone ta this place multiple times.",positive
208,"The souvenir shop has pretty much everything and is pretty comfortable, the goods are easy to reach, affordable, and it has great service.",positive
122,"Hi Eviana, we are sorry for the inconvenience. You can contact Indosat by clicking the following link. We implore you to check it out. Thank you. Erf.",neutral
655,The menu's Indomie and toasts. The place is just the same as the other branches: comfortable for hanging out.,positive
182,"Sambal with basil leaves, tomato and cayenne pepper. The flavour of this Sambal made the city called Cibiuk in Garut famous. fried gourami or with fried chicken. It tastes absolutely divine. Aside from Lengkong Cibiuk, they also have many other branches.",positive
316,"""...Gramed's staff passed me...""",negative
216,"Good afternoon. If there's anything you'd like to ask, just mention us again. Thank you, Zan",neutral
865,"We think this place is ordinary, no fun attractions or views for a 10.000 / person ticket. Well duh, the view of the mountains is a no-brainer for highland locations like this. The culinary side doesn't offer much options compared to the other place.",negative
894,"I've been a Madtari regular since 2002. At the time this place was just a small tent that overflowed with customers at night. A few years ago, after they moved to a permanent building, I thought that was when the quality dropped slightly compared to the tent days. One thing's for sure, the price went up significantly, even more expensive when compared to similar stalls.",negative
329,"First comment is that the venue is a banger, very nice service, and as for the chosen menu, it has to be the grilled fish and oxtail soup that I'd give a 4 for but for that iced fruit cocktail, I'd give a 5, yes!",positive
169,"Terjemahan di sheet Translation sudah benar, tapi di sheet ini tidak lengkap",positive
374,I'm jealous of how you guys can find happiness,negative
558,After topping up my balance I wanna buy some internet package but it just keeps failing and tells me to try again in 363 and it still doesn't work.,negative
776,"The place is beautiful, especially at night with its decorative lights, so romantic. Perfect for couples. It's also far from the crowd. The air is so breezy, and we can see the town's beauty from above.",positive
56,"The food is great and eye-catching for pics, love 'em. Oh, but the drinks are also good and the place is super comfy for hanging out with friends.",positive
529,"This is my second visit. Every food I tasted was great, and the place is just as charming as I remember it back then. I've never had any regrets dining here.",positive
676,"The food are smoked chicken and cheese sandwich, while the drinks are juices. Tastes pretty good. The place is nice for those looking for peace and quiet away from noise.",positive
312,Medicines without a doctor's prescription are best avoided by nursing mothers.,neutral
568,"The more you know, the more jealous you get",neutral
454,"Why should we give a paid leave to a lazy employee? Business is doing bad, and they wanna waste money? Think!",negative
487,"This place, next to the flowing river and lush forest, with delicious food really makes me feel at home and perfect for resting. Many snacks are also availabel here, and the weather is cool.",positive
621,"Please, at the very least, I beg you, for the convinence of the customers, put a BNI ATM machine in Tigaraksa station.",neutral
820,"Kupat Tahu Gempol is one of the legendary Kupat Tahu restos. The place isn't that large but its red color is pretty eye-catching near the three-way junction at Pasar Gempol. The portion is just right to satisfy your hunger. The defining characteristics of this kupat tahu are their soft and chewy tofu as well as their creamy peanut sauce, which go really well with lontong, bean sprouts, and red crisps. Absolutely delicious",positive
44,"Oh I just had that too, man. My Freedom I package hasn't run out yet but I've been charged with internet fees. I need around 40 thousand credits to pay for that. What a robbery",negative
766,"This place is indeed inexpensive when compared to similar restos. But the food they serve is so-so and has nothing special about them. Most of the menus are just deep-fried fish or chickens. In other words, absolutely no food variations.",negative
401,"The bathroom is far from decent, no hand soap provided for washing hands.",negative
537,"The atmosphere is great for everyone, whether you're alone, with family, or sharing stories with close friends.",positive
733,"Our family's favorite bakso. It's so flavourful and delicious. Coupled with iced orange juice and white crisps,. Super yummy stuff! Price is really affordable.The location is kinda in an alleyway but it's easy to spot because a lot of people know about the place.",positive
717,"Eating in a resto is no fun, you can't ask for a little opor ayam broth like in a warteg",negative
298,The increasing percentage of ride sharing customers forces Toyota to boldly spend up to $1 billion to Grab in order to save its automotive business,neutral
124,"The wonderful scenery of Bandung can be witnessed from Sierra Cafe Lounge. There are two options for locations, indoors and outdoors. A romantic site fit for couples and also to hang out with friends while we unwind, since the air is also cool and fresh. The food served is also delectable with varying choices. There's Indonesian culinary, Asian, and even European/Western dishes.",positive
364,That house has a tall black fence,neutral
793,"A unique restaurant, where you use sheets of banana leaves instead of plates. The food is pretty good",positive
18,My dad is an employee in net.TV,neutral
622,Indomie is often found in the nearest roadside stalls.,neutral
224,It's so hard to understand people who think they're always right,negative
393,"I was asked to find chocolate by Gordon Ramsay in a dream, but it got mixed with an Indomie broth. ",neutral
158,"Yeah sure, Mi Sedap has more portion, but when it comes to taste, the others are just far better in comparison.",negative
741,"Wow the satay is amazing. Right spices, right seasonings, and fresh meat, all combined to make a damn good satay. The servers are also friendly.",positive
318,"When I came here, it wasn't strawberry season so they were tiny and bad. So I just took whatever's given. __sad__.",negative
51,"The inauguration of the airport train by the President of Indonesia is done symbolically by pushing a siren button that sounds the bell, accompanied by Minister of Transportation, Minister Of State-Owned Enterprises, Governor of Banten, Director General of Railway from the Ministry of Transportation, Director of AP2, Director of PT KAN, and the Director of Railink",neutral
817,Most of the food in this restaurant aren't good,negative
52,"Perfect for a romantic dinner with your partner in sharing a moment together, the food is also delicious and classy",positive
935,"The Batagor's good, the noodle's great. Lots of food to choose from in just one place, especially since the shop's been renovated for the better. There's a musala. Lots of variety in the souvenir area, too.",positive
607,"Just used it for a few days and it's already hanging, the power bank can't do a thing. Have to be taken into service",negative
572,"A restaurant with amazing view, if you're here at night, try to find an outdoor spot and you'll see that every single table has shining lights on them. The food we ordered were cream soup and hot chocolate drink, very delicious and perfect during with the cold weather.",positive
193,"Location's very romantic and snug. The atmosphere is very cosy and the service is great. The food is very appetising with a reasonable price. Would love to come back and enjoy its afternoon mood. Overall it's lovely, very wonderful! ",positive
41,Food court wth a lot of tenants and a lot of options. Fitting for young people who wanna hangout and eat lots of food and drinks tailored for each of their tastes. The parking lot is also huge. ,positive
977,"Thank you for the appreciation, brother. We hope he'll be able to meet our representative for the victims of Freeport's work termination soon.",positive
290,I've come here more or less over 5 times already. The dim sum tastes amazing while also being really affordable. The place is fun and comfortable. The waiters are friendly even though there're only two of us and we don't order much. Highly recommended if you wanna eat dim seum or shabu in Balikpapan,positive
123,"The place is fun, relaxing, and easy to spot, since it is right beside a Lotte Mart supermarket.",positive
404,KIPP received many reports of foul play in the 2018 Regional Elections,negative
483,"I've been here several times, the food is pretty delicious, the gazebos also makes the atmosphere cozy, especially with the sound of a small river, giving it a natural vibe. Recommended to come here at night because it's more beautiful.",positive
557,"Food here is amazing. Perfect for office meetings or dining with big family, affordable price too",positive
516,DHL opens job positions for Customer Service,neutral
571,I tried the one near the Mayor's office. I ordered the super complete Bakso Malang. It was great. Really filling. The price was also reasonable.,positive
825,"Big outdoor resto, serving a huge variety of food from traditional all the way to the modern cuisine. The price varies just as much as the menu. The attractive decor layout makes the place really comfortable",positive
838,"The must-try of this resto is the strawberry juice without milk or sugar. Trust me, it's amazing. Just 1 glass isn't nearly enough",positive
421,"Western style restaurant with street vendor price, with beautiful natural scenery and romantic atmosphere, provided that it's not raining because it's in open space. My family's favorite restaurant",positive
746,"The fried chicken is amazing here. Perfect after a long trip. I came here after returning out of town, so I was absolutely starving. My stomach was filled right back up. The food was good and servers were great. Not to mention, the cashiers were beautiful",positive
168,"My package, too, to this moment has yet to arrive, the status has been stuck in the delivery of the Jakarta courier since 5 days ago, JnE is horrible now.",negative
559,"You're selling Taliwang roasted chicken but the one I got was like rubber and not good at all, it was tasteless too, the sambal was just whatever. Overall, very disappointed and I won't be coming back for a second time.",negative
137,Some people like to litter on the side of Sukajadi Street at night. People like that should be obliterated.,negative
748,"My favorite in this resto is the 3-flavor-porridge. 1 huge bowl is enough for me and my husband. There's also a lot more than just porridges on the menu. The price fits the taste. And of course, you can't have porridge without a warm cup of tea. Hmmmm, tasty!",positive
494,Indosat is why I am angry every day.,negative
938,"This restaurant is perfect for dinner with your partner or family, with decent food and wonderful view. The mood's also great thanks to the classic decor adorning the corner all the way to the entrance.",positive
214,"The resto's concept is nothing special, but why do the drinks cost that much? I know it's a tourist trap, but tone it down a little, hehe. Gotta think twice over and over again before buying.",negative
698,"The milk is fresh with amazing vegetables and delicious soup flavour, complete with super nice service.",positive
339,"I regret ever telling ye anything, Farrel.",negative
687,"So irritating, lousy parking, just blocking the street even more. And when their car gets scratched, they'll go around swearing and blaming other people.",negative
992,"This resto is recommended for you if you wanna have a meal while admiring the sunset. Because it is located in the highlands, you can enjoy the beauty of the mountainsides and the city atmosphere. The menu itself comes in a variety of flavours, from local dishes, Indonesian cuisine, to international food.",positive
656,"Hella tiring, going back and forth from and to the campus at late afternoon on top of the endless group projects, the deadlines for the assignments are also hella tight.",negative
933,Bali has lots lots of islands to be visited,neutral
228,"I had breakfast in this restaurant on the 18th floor and I just so happened to get the outdoor seat or the balcony. The seat cushion had a lot of dirt in it. Not to mention the strong wind gave us a lousy breakfast experience. If you wanna eat in this resto, make sure to eat inside, it's a lot more comfortable that way.",negative
210,"The expansion of the oil refinery owned by Pertamina, Ltd. has employed over 20 thousand workers",neutral
253,"The restaurant in Padma Hotel is one of the comfiest places with breathtaking views of the hills, valleys, and green trees. Because of those, we can enjoy the meals in a different atmosphere. The food here is quite varied and has a lot of options, not unlike other restos in Bandung. But here, there's a selection of traditional menus that'll give you a unique taste as you enjoy nature's beauty.",positive
398,This ain't the time for promises anymore. We the people are tired aka sick of it,negative
279,My husband and I usually stay in Jimbaran when we visit Bali.,neutral
539,"I'm perplexed, I can't seem to join my hangouts because this place is just always this packed. Well it is what it is, seems like I better just drive-thru considering it's located in downtown I swear to God this McD is the most crowded.",negative
64,"Scaredy-pants trying to act tough, offered to watch a horror movie and went ""yeah, sure,"" then becomes not brave enough to go to the bathroom after watching.",negative
391,"The lounge's quality is very disappointing. Far from the escalator, and you;ll need to go through dirty alleys. The design's long and narrow.",negative
976,"Even though we never got the hut on the side of the ricefields, the other huts offer the same charming and comfortable experience that in no way deducts any points from this eatery. Lots of the huts are perfect places to dine in, the food quality is also super great. Try the leaf-wrapped grilled fish, it's aromatic, spicy, and hella flavourful.",positive
358,"When it comes to delectable food, it seems that this place is the king. Aside from the amazing food, the atmosphere is also warmer especially when together with families or friends. The songs are also very entertaining.",positive
403,"I've eaten several times here. It's a Sundanese menu, especially menu that is hardly found in other restaurants in Bandung. The food is so delicious.",positive
201,"The people have had enough of politican's ramblings. If it's good, just say it's good. Why can't the government do anything right?",negative
397,"If you're waiting for Istana Plaza Mall to open in the morning, you better try going to Mangkok Ayam in the courtyard of Istana Plaza's first floor. Lots of menus and options are available, including Indonesian and Chinese food. Mi Ayam Rica is highly recommended, really satisfying and goes well with your morning coffee.",positive
417,"Eating here is pretty enjoyable because of the varied menus, from Indonesian, Asian, and even Chinese menu. Because of that, we can try many tastes here, and all of them taste great. The place is pretty comfortable, and the service is also quick",positive
231,"Dining at the top of the mountain accompanied by the nighttime scenery of streetlights illuminating the city is so beautiful. The food is also great, and the price follows the standards of other cafes.",positive
889,"It's kinda funny honestly, going all the way to Bandung, only to eat at Pizza Hut. Just because I wanna eat some pizza. The taste is no different from the ones in Jakarta",neutral
299,"I used to like eating in this place a lot when I was in Jakarta. Just found out that they're also in Bandung. The place is amazing. Lots of atmosphere to choose from, whether outdoor, indoor, smoking or no-smoking, there's a place for all types of customer. The food is also good, too. You know, typical Indonesian pastas",positive
685,What good is your education when you can only talk like a barking dog?,negative
632,"Great and comfy place, highly recommended for dinner. Came with the partner and served by Mbak Dela, was explained to in detail and super kind. The menu is varied and delicious, when I came here with my partner to try its local and foreign menus, both are equally tasty. Just a word of advice. don't come to this place or else you will keep coming back for more, hehehehe. The scenery is breathtaking.",positive
887,"For you sweet tooths out there, try the rice with chicken and mushroom. If that's not your taste, try getting the rice with salted fish. The satay is the most popular, served on a hot plate. Another option that people love is the fried tofu.",neutral
955,I really like eating here. The price is not too expensive and the flavour is wondrous. What I enjoy here the most is the grilled mushrooms. Tender with lots of cheese. I order it every time I come here.,positive
669,"In that restaurant, lots of choices are available, from cheap ones to expensive ones.",neutral
355,A comfortable and natural place for family to relax in the rustic village atmosphere. Getting kids to know nature.,positive
484,It's been a week and the tap water in our region still isn't available. Do you run out of water? Please take care of this,negative
842,"You're just torturing yourself, working all day every day. When it comes to working, don't push yourself too hard",neutral
523,"The food's taste isn't as fancy as the cost. Overpriced for family visitors, friend groups, or business partners.",negative
551,"If you're visiting Sukabumi, don't forget to try Bubur Ayam Hamid. For real, it's so good, so unlike any other chicken porridge places. There's quite a lot of shredded chicken, the spices are spot on, especially when coupled with sate ampela or usus. You'll want more for sure! ",positive
683,"Please, anyone from Telkomsel, revise the prices of your internet plans, they're off the roof",negative
740,"Dear Sir/Madam, please respond to my message. Thank you",neutral
170,"Not only in name is this Swike Waled. The flavour has the same tastiness as the dishes in Waled Village, Cirebon. The Tauco Soup has the right amount of saltiness. The fried Swikee is delicious, too. It's just that the cost is  a bit on the expensive side, compared to the swike in Cirebon.",positive
297,Get a hardisk with a special promo price for each 1 TB of hardisk refilling service,neutral
277,"A unique restaurant with an equally unique fried rice menu. The fried rice also has different levels of spiciness. If you're a fan of spicy food, you must try the fried rice here. Moreover, there are a lot of toppings to be served with the rice, such as ebi, basil, sweet soy sauce, a secret spice, all the way to having aromatic ginger mixed in. Each portion is measured just right. The prices ranges from Rp 13.000 - Rp 21.000 per portion. The service is also delightful",positive
60,"Using Telkomsel really makes my blood boil. Just sharing a less-than-100-kb capture and it takes forever to load and then fails anyway. But when you reload it, it just says ""the network has no problems"".",negative
257,"Just wait for it, you'll get it. Usually it takes about a week max. ",neutral
