id,text,label
871,I don't regret eating at Solaria. The place's clean and perfect for family meals. The food also comes out quickly after ordering,positive
507,Just kick them out of the police already. Rather than giving the corp a bad name.,negative
845,I regret getting in that store. I ended up buying things I'll never use. It was really an impulsive buy from my part.,negative
905,"Ate on the roadside, unappetising food, bad service, too expensive",negative
111,"To request for a collaboration/sponsorship, Ms. Elsa can contact: the Corporate Secretary of Mandiri Bank, Ltd.",neutral
595,Please produce more Indomie Goreng Sate. Been looking for it everywhere but still nothing. The taste is so good and different from sate flavours from other brands.,positive
19,Early in the morning and Telkomsel's signal makes me wanna go mad.,negative
670,"Queue takes so long, food takes so long, too, and the taste is just average with a ridiculous price.",negative
284,"My God XL is so horrible now. Time to switch providers. High prices, low quality",negative
252,"The night Mutiara Timur train from Surabaya - Banyuwangi. It's executive but the seat is really gross and dirty. Not worth the luxurious price, absolutely disappointing",negative
117,"I chose this eatery in Saung with a ricefield view and ordered the complete Nasi Timbel, Surabi Oncom, and  Colenak. The order was served without waiting too long. Only disappointed with the Serabi. Below my expectations. Not delicious.",negative
684,Pos Indonesia's services are so pathetic nowadays.,negative
554,"My Indihome got some problems again. I was working when all of a sudden the connection was cut, my modem blinked red, the wifi had only been fine for a week, and then it got issues again. You've got a lot of problems lately huh, Indihome Telkom? Bill's always high, but still disappoints.",negative
337,"In my opinion, this Bebekk Garang has plenty of duck menu variants available. I like the combination between the duck and the Sambal, the flavour is just right. The price ranges from 20-30 thousand and I  believe it to be a reasonable price for the food here.",positive
837,"Perfect for meetings, weddings, and photoshoots. The atmosphere is calming, soothing, and cool",positive
967,"Every time I come here, I just wanna stay here for a long time and not go home. The service is hospitable and the place feels just like home.",positive
577,"This restaurant offered many highly modified Balinese cuisine that felt like they were more tailored towards the customers, most of which weren't native Balinese people. The three pictures we attached are of the food we ordered.",neutral
578,"Where most steakhouses would take quite a long time to serve the food, here the steak came out rather quickly, in my opinion and it was perfect, both for my palate and my wallet. One time I was waiting for my friend for 2 hours here, but I didn't feel that long because the food made me lose track of time. Hehe",positive
692,"If you wanna buy some meds, just go to Kimia Farma at the end of that street.",neutral
380,Elementary graders' math lessons are now really difficult,negative
755,This restaurant's always packed because of its ideal location near the mall's entrance. The porridge tastes nice. The ordering and serving process are also pretty fast.,positive
788,"I can't help it, I was feeling blue so I made that kind of story",negative
616,"For those going to Cirebon and looking for a nice parking spot and quick-service food, it's best to come here since the parking spot is spacious and the atmosphere is comfy.",positive
396,"Mm, kinda sad to have to wait every time I come here. The noodles are hella hot. Hehe, maybe add more seats in so we don't have to wait, y'know.",negative
259,"But the fact is, we do own lotsa land here, whatcha gonna do about it?! Just work hard if you wanna be rich like us, don't just mock us all the time ",negative
850,The Valley restaurant has the number 1 view of the town. Enjoying the night vibes with twinkling lights is amazing,positive
289,"When you're in Semarang, you gotta try this mie kocok. I think it's the best . Even though it's on the edge of the shop buildings and you gotta find your own seat, the taste is so worth it. They got a lot of cow gravel, and the tasty broth really goes well with the thin and wide noodles. It's also dirt cheap. For sure, he mie kocok is the best in semarang",positive
0,The thief that has already been confirmed to be someone named Lulung.,negative
647,"Bruh, maybe fate just doesn't let me have a good Indomie Goreng, even though it's just a simple act of boiling noodles. How could you make it too soft?",negative
643,Nike has released their newest shoe product.,neutral
532,"When I went to that restaurant, the waiter came up to me and asked me for how many people I wanted the table to be.",neutral
217,"Roti Bakar Duti has been around for a long time. Even though the bread is nothing special, there's a lot of variety. Pretty much everything is on the menu. Sometimes I don't even know what fillings to choose. They also have porridge. That's also pretty good",positive
901,"My quota is drained dry just to see photos that make me jelly, and delicious food that makes my mouth water.",negative
596,"I really love eating in this restaurant. Varied menu, awesome flavours, and not really that expensive.",positive
952,You haven't visited Bandung if you haven't tasted any Batagor. Batagor Burangrang is one of the best when it comes to tasty batagor and exceptional sauce.,positive
112,"Packed with customers eating and queuing. for the menu, its standard is just like home. Nothin' to write home about  as far as flavour is concerned. Quality of taste is not worth the cost.",negative
912,"I can confidently say that this resto is perfect for families. While my wife is buying souvenirs, I can enjoy my lunch in this resto. My children can also play around in the playground thanks to the affordable tickets.",positive
635,"What a crowded place, food's varied. Comfortable design and environment. Cool breeze, lots of children's playgrounds.",positive
386,"Alright, please wait for our team to respond to your issues regarding the Telkomsel provider.",neutral
38,"Poor Ungu personnels, can't find a gig after Pasha left",negative
471,"If I have a ton of phone credits, I will activate my hotspot so that everyone can access the internet.",positive
176,The Minister of Finance states that the weakness of Rupiah holds more influence towards the current account deficit.,neutral
392,Early in the morning ...,negative
934,"Regarding the account change for the BPJS autodebit payment, Mr. Luqman may come to the branch office of Bank Mandiri for the corresponding autodebit proposal. We will close the account first and foremost.",neutral
785,The car Jeje uses for her day-to-day activities is a cream-coloured Toyota,neutral
245,"Has a nice atmosphere, what with the ricefield and mountain, they even got a wine cellar. But the food was too expensive. The quality could've been a lot better especially since there're tons of deteriorating restaurants in Bandung right now.",negative
469,"My biggest pet peeve is when people are chatting while riding on their motorcycles, especially if the road is narrow.",negative
679,"The servers aren't very active and friendly, often times unable to explain the available menu, making the customers feel ignored and neglected.",negative
597,"Really good restaurant, with a view facing Bandar Lampung city, making for a breathtaking sight at night. The atmosphere is calming, and the decors look beautiful. I absolutely love this place.",positive
650,Aspiring applicants of the CPNS may only register for one institution and one position.,neutral
58,"Food was alright, I ordered a spring roll but it was kinda oily, and the main course costed a bit too much. The building was unique but the location wasn't really ideal, making the place always look empty. When you order, make sure that you say what you want clearly, because what happened to us was we got 3 items when we only ordered 2. The waiters were very friendly, but the cashier was acting a bit odd. I probably wouldn't be coming back.",negative
191,"The griled gourami and stir-fried water spinach served in Reds Dipo which I ordered at lunchtime in November 2012, tasted quite okay. It's just that the chilli in the sambal and veggies such as: cucumbers, tomatoes, and the water spinach, and also the orange in the iced orange juice don't feel very fresh.",positive
246,BCA Finance offers a job vacancy via the Karya Bakti programme for the relationship officer position in Pekanbaru,neutral
470,Ate bakso while chatting with friends. The place is cool for eating. The price is also not too expensive.,positive
450,"In the middle of legal proceedings, residents of Tamansari Bandung face the threat of eviction.",negative
930,Wanna shop in that store today so I can get that cool cooking utensil plus a chance to vacay in the Netherlands.,positive
420,"Forget 1 hour, I can't even play stories that takes about a couple seconds without loading forever. Just amazing, Indosat",negative
416,Never boring and always amazing. Every time I come to Congo Kafe. The place is calming. Cozy. You should try coming here at night. It's more romantic. Especially with your loved one,positive
863,The price is incredibly affordable and the menu is hip and cool. The resto's decor is arranged well and uniquely.,positive
946,The place is not too clean. Going there is a bit difficult due to frequent traffic jams. Gotta think twice before coming back here.,negative
136,"Terjemahan pada sheet translation sudah bagus, namun di sheet ini ini tidak terlihat lengkap.",negative
63,"I use the Type-9210 BB, got an info since yesterday, and then got charged for GPRS ",neutral
85,"I use a Lenovo phone. It fell into the sewer just 2 weeks after buying, fell onto the asphalt when I was speeding on my bike and its parts scattered everywhere, yet this phone still survives. You're awesome, Lenovo",positive
824,The batagor's huge and the meat is tasty. Simply amazing. The seasoning is spot on too. Perfect menu for an afternoon snack,positive
323,So tiring tonight.,negative
260,I've sent a complaint e-mail since my telephone call wouldn't go through.,neutral
7,The portion was plentiful. Crabs were around 100 thousand / portion. The grilled prawns are also great. The condiments were full of spice. Both the price and taste can rival Perahu Seafood in Sumatera Street.,positive
225,Rizal Ramli explains how the price of rice can be stablized.,neutral
75,"As a Jakartan, I'm ashamed of some irresponsible people who wanna sweep the Bobotoh, man",negative
812,Bali is one of the islands that becomes the destination of the tourists.,neutral
476,"Our current trip is to find a good place to recommend to our client. The distance from Bandung is pretty far, but it's all paid off once you see the beautifull night scenery while having great food and service",positive
724,"The location is kinda hidden in the corner of a housing area. The concept of this place is great, looks just like a house in a European village with wooden floors and walls. Aside from the interior, customers can enjoy their meal in the unique garden, utilizing old drums as seats.",positive
880,We sell premium one-meter HDMI cables. Buy 2 and get 1 for free in Rich Com Store vendor.,neutral
526,I don't care. I want my phone credits back. This is a robbery. Your telephone package is also a robbery. I just complained about it.,negative
680,Leaves come in a variety of shapes,neutral
55,"Me and my family tried eating in Karamba Resto because our rental car driver recommended it. We did arrive kinda late at 21:00. Although the resto wasn't closed or preparing to close yet, some of the menus were already out. My mom and husband even had to order nasi timbel without the sayur asem since it's out of stock. It was replaced with sup sayur by the resto's staff. We didn't have many options to choose from. Not recommended.",negative
234,"After getting officially acknowledged as a university, BSI held a seminar on motivation.",neutral
133,"A diner that has existed since a long time ago and yet the taste is just as delicious as it used to be, the chicken and krechek rice are very delicious. Sometimes I even would go out of my way to take some back home to enjoy later.",positive
765,"Needing to pass that street everyday is kinda irritating. The narrow, two-way street and its traffic jam have become an everyday occurrence at this point.",negative
546,My younger brother got accepted in ITB's Environmental Engineering Faculty.,neutral
265,"Please follow up my complaints ASAP, before there are more victims of GoPay hacking",neutral
798,"Their signature main dish is the betutu chicken, with flavour variations ranging from mild to really spicy. Aside from chicken, there's also betutu duck with the same flavour variations.",neutral
67,I never say rude things to my partner even for a joke / when I'm really angry because I respect him that much,positive
722,"Yesterday, they applied for the Djarum scholarship",neutral
232,"Kak Adit, I'll have one Indomie, please.",neutral
35,"By the way, the description said Note 3 Pro, but what I got was Note 3. What a letdown, man",negative
659,"A man ran over some people with a car in France, 2 injured.",neutral
25,"I was curious and wanna eat here. When I ordered, the owner's voice was so low, oh my God. I coudn't tell what he was saying, it just sounded like ""blubup blubup"" haha. I ordered chicken noodles with 2 extra meatballs while my partner ordered bakso urat soun. Not long after, the order for my partner was served and it was below our expectations.",negative
757,My friend works at Gojek,neutral
703,"Yes, I've called via Halo BCA. But my connections got cut off multiple times and my credits would run out if I kept calling over and over!",negative
957,"Cool atmosphere, green, refreshing, and perfect to unwind and escape from mundane routines. As for the expensive food, personally it's not really a big deal because the great location matters a lot more.",positive
330,Bored of this world so full of hypocrisy.,negative
609,People find it hard to appreciate others nowadays.,negative
332,"This place promised steaks and meat for a low price. But in reality, it wasn't really that low compared to the quality of the meat, which wasn't good at all. The meat was tough and had no flavur.",negative
869,Early morning and I'm already fuming at the Sanur bank branch's unprofessional and disappointing service. No wonder the customer reviews were all negative,negative
119,"Went to have luch with 6 family members consisting of adults and children. We got a grotto that was far up above. Could you imagine walking to the top? Of course it was very tiring. The place was good overall, yes, but the faraway location of the grotto and the exhausting trip up was just.... My advice is if you wanna go there, don't go during lunch cuz it's sure to be full. The price was quite high. But the view was breathtaking.",positive
634,"Steak's quite good. This eatery is perfect for students or uni kids hehehe cuz the price is affordable. For the food, it's okat, kay",positive
307,"In my opinion, eating here will grant you large portions for a cheap price, add to the fact that it's served quickly, too, and the place being clean and wide.",positive
264,"Indonesian needs a visionary leader, not an entertainer",neutral
565,"Tong Dji serves various food and drinks, not only tea. Recommended ones are: earthenware rock sugar tea and fried rice",positive
338,"I am not a huge fan of goats since I can't stand the smell, but while eating in this place, it's as if I wasn't eating goat at all! The meat's tender, tasty, and odourless. The resto's atmosphere, too, is nice and comfy.",positive
156,"I've been wanting to cancel my credit card for a few months now, y'see.",neutral
71,"The truly real ones, no set-ups",neutral
425,"Man, Indoesat is so disappointing. I was just about to register but they charged me per kb? My credits just got drained",negative
775,I ordered a mountain jacket from Eiger,neutral
431,"The service was indeed quick, but the food was served carelessly, like they just wanted to push them out without care. I ordered shrimp with oyster sauce, and it was just the same crab as the one with padang sauce. The pliers for the crab was also not given unless we asked.",negative
576,"A restaurant with the concept of beautiful dining experience, especially at nighttime with its lovely atmosphere thanks to their night lights. The food is just as good. Perfect for family gatherings.",positive
759,"First tried this because of other people's reviews, but turns out the taste was nothing special. 30 thousand for a plate. Seat was hard to find",negative
359,"I was told to just wait for the SMS, it's been a day and I still got nothing!",negative
473,Time to make your own 360 degrees visual work with Samsung! Follow the easy steps in this video.,neutral
242,"The description said chamomile aroma, but why does it stink so bad?",negative
92,I'm very satisfied with the specs of Asus' laptop.,positive
104,Fun weekend with the family in a place with satisfactory facilities and affordable price. Our vacation became more fun with the strawberry grove where we can pick strawberries straight from the field.,positive
849,"Please hear us, Admin. The connection quality in Celeungsi Bogor is really bad. Even though we've paid a lot for this",negative
615,"The food's yummy: fried chicken, sauteed eggplant, fish soup, fried tempeh, sambal. The services are lovely, too.",positive
848,"First time to this place, I had reserved and got number 3. I asked for a spot on the lower ground so we didn't have to take the stairs because one of my mates had sore knees. Made to wait almost 40 minutes without any certainty. I ended up cancelling. At first I didn't want to give a 1-star rating because maybe it was just that crowded and my special request was too much to ask for. But, the waitress' rude attitude was the last straw.",negative
131,The results of the Simultaneus Regional Elections quick count is full of surprises,neutral
605,Nice landscape to relax together in the afternoon and at nighttime. enough.,positive
286,"Me and my wife's relative were spending time in Palembang. I looked for a place to eat and found Bakmi Jogya. When we got in, we were surprised, because we spent 35 minutes stranded while looking for an empty seat. After we ordered a mi godok, we had to wait for another hour and by then I've lost my appetite completely. I even asked the cook about my food.",negative
897,"The bed's filthy, the pillows all stink...makes your body itchy like there's a lot of animals, can't sleep well at all",negative
907,This night trip's really exhausting.,negative
564,"I came here with some friends to have lunch. The access road to the cafe's location was so narrow and steep, some parts were even damaged. We ordered a few things. After waiting for a long time the food arrived and the taste as well as the presentation were disappointing. Turns out the taste wasn't up to par.",negative
441,"Just like its name, Creative Space Cafe, there are several artworks that we can enjoy and several sculptures downstairs. Upstairs is a cafe with interesting design that is perfect to visit in the afternoon. It's located on a higher ground, making for a breathtaking scenery",positive
481,Good afternoon poor people. I hope you die soon or get even poorer and suffer more,negative
360,Gojek will start offering their services in a few SEA countries.,neutral
20,Do Indonesians believe the story of this oh-so-esteemed police officer? That claims to have met the biker? You be the judge of his make-believe story. Does he pass with flying colors?,negative
475,There are traffic in Bandung everywhere. Jatinangor feels like the Brexit toll. I might faint in my car because I'm waiting too long,negative
144,"When we arrived, we were put in the waiting list, even though there were many empty seats, maybe some were not used, but the staff stayed kind despite some unhappy customers who didn't wanna wait because they saw those empty seats. Food can be ordered in the back of the restaurant, and the menu was quite tasty for us. This was our second visit, and the one thing we remembered from this place was the balloon seller.",positive
186,"The fried Kwetiaw and Teh Tarik is my go-to choice of meal here, though there are plenty of people who order the Mie Yamin here as well, you may also try their fried rice.",neutral
524,This month my bank account balance is zero,neutral
542,Hotel Ibis Tamarkan Wahid Hasyim has a very disappointing service. Especially when it comes to reservantion! Really lousy!,negative
238,The employees at Graha Indosat is so rude,negative
914,I never regret loving you.,positive
387,"The food here was great. Way tastier than other similar restos in Balikpapan. But, well, the price was bound to a bit expensive. Hhe it would cost about 100 thousand per person. But because the food was so good it I was satisfied. The Tom Yum soup, tho, mmm. tasty.",positive
840,"Even though the portion's huge, the taste is pretty standard. Guess the price doesn't match the portion. The plating is also kinda messy, that's all, I guess.",negative
709,"This was our first visit in the resto's main branch. We've ordered from the other branches before. We thought that the atmosphere would be better and the food would have more variety. But I was unpleasantly surprised with the servers' unfriendly attidue. We would pick the outdoor spot with a sofa,as per a waitress' recommendation. But the male waiter didn't let us because he didn't wanna have to clean it.",negative
906,This particular goverment agency needs to be abolished because they've done absolutely nothing of value so far.,negative
883,This meatbun has been known since ancient times but it's still enjoyed by many to this very day because of its distinct taste.,positive
267,"The waiter and owner in the cashier were not communicative and couldn't give us a recommendation for which portion of the menu should be ordered. The food was so-so, and the parking was difficult.",negative
114,"When I was searching for a place to eat with a variety of choices, I got recommended by a friend to dine here, aside from the cheap price, the food is delicious as well. It's just that it might take a bit long to  wait for our orders.",positive
927,"Ain't no one's gonna vote no more, ya think the people now can still be fooled?",negative
878,"Really bummed out that the Champions League isn't broadcasted in any channel, local or sports ones. They should've fought harder for the broadcasting rights because the customers already paid big money",negative
734,Uni kids should stay out of politics. Just go hit the books,negative
43,There are a lot of city parks in Malang,neutral
566,The denizens found 2.910 KTP-el cards in the bushes.,neutral
743,"I'm satisfied with the Gojek app, really makes my activites a lot easier",positive
829,"I installed Traveloka at one point, but I never used it so I uninstalled it.",neutral
199,"Great, photogenic place to take pics in, and the breeze is cool, too, but don't even try to eat there, the price has gone off the roof, it's no longer tasteful, regrets all-round.",negative
410,"Unfortunately, 16 GB is not nearly enough for any Xiaomi phone because their default software takes way too much space",negative
204,There is an ulterior motive here to make his son elected as the vice president,negative
893,"Really loving the baked potato menu. For the price, it's standard for a steakhouse. The taste matches the price. I think the atmosphere is comfortable enough and there's even a garden in the middle. Would definitely go here again if I ever come back to Bandung.",positive
809,Cafe Rindang with its rural atmosphere and surrounding woods really goes well with the small but beautiful waterfall. The food is also quite good and the price isn't too high. Recommended for everyone.,positive
826,Turns out your brain is the size of a marble,negative
639,So bored. I've watched all the films and now I'm drawing a blank,negative
681,That man with a thick moustache crossed the street using the zebra cross,neutral
26,"Lots of comments in Tripadvisor made me curious With just an empty stomach, I came here to have my usual favorite lontong padang and was left utterly disappointed. In the end, I just took my orders home because my appetite was spoiled so hard. The lontong padang in ITB was leagues better, the taste just couldn't compete.",negative
167,"Such effort, taking selfies for the sake of this Samsung Galaxy. Well, gotta keep working hard and keep singing",neutral
395,"Food's tasty, the atmosphere is beautiful and breezy thanks to the trees along with the sound of flowing rivers, making it more comfortable and calming. The quick service means we don't have to wait long. There's also a homey salat room. Great food with affordable price.",positive
671,"Never gets old! Since 1996 when I first learned about Ayam Goreng Suharti, I immediately declared it the best chicken I had ever ever eaten. The secret recipe and the sauce for the crisps add a unique flavor on this legendary Indonesian fried chicken.",positive
239,"Is the promo real or not? I've checked that you could get a 30 GB quota for 77 thousand, 40% less than the original price. When I bought 80 thousand credits, my balance got slashed for 5 thousand and I haven't even done aything yet. Why did that happen? So disappointing.",negative
922,"An alternative to cleaning services in Jakarta. I've tried it. So far, it's better than the others.",positive
428,"My wife bought several products from the same store, and the weight hadn't reached 1 kilogram. But when they sent it using Gosend Delivery, we had to pay twice the shipping cost, goddammit!",negative
