id,lang,source,target
699,ngaju,"Kesan pertama menginap di sini, check in tidak bisa jam 2 siang karena yang menginap sebelumnya terlambat check out, tidak ada apa pun yang ditawarkan pihak staf saat kami harus selama satu jam menunggu kamar dibersihkan. Kemudian kami juga diberitahukan bahwa restoran tutup jam 5 sore sehingga jika ingin memesan makanan untuk makan malam harus sebelum jam 5 sore. Cukup menyebalkan.","Kesan pertama bemalem hetuh, check in diak tahu jam due bentuk andau awi ji bemalem sehindai tuh sayup check out, jatunti sama sinde ji nawar ewen staf pas ikei harus menunggu lakau ije jam menunggu kamar rasih helu. Limbah te ikei kea sanan ewen kareh restoran nutup jam lime halemei jadi amun handal meteh penginan akan kuman hamalem harus sehindai jam lime halemei. Sukup mawi rahas."
227,ngaju,"Menikmati kota bandung tanpa kuliner, kurang seru, kafe halaman, menyajikan makanan indonesia, gado gadonya enak, pisang goreng kejunya juga enak serta secangkir kopi sambil menunggu teman datang sangatlah menarik","Mengkeme kota bandung jatun panginan, kurang rami, kafe halaman, nyadia panginan indonesia, gado gado ah mangat, pisang goreng keju te mangat kea, tuntang ije cangkir kupi sambil nunggu kawal dumah menarik tutu."
612,ngaju,"Setuju makin naik fase wajar kalau tiket naik. Tapi, harga dasar di saat fase penyisihan sudah kemahalan. Coba bandingkan harga menonton di malaysia, thailand.","Satuju mahin mendai fase wajar amun tiket mendai. Baya rega dasar pas fase penyisihan jadi lalau kelarang. Ayuk banding te rega menonton hong malaysia, thailand."
6,ngaju,"Saya dan isteri tergoda untuk mengunjungi restoran ini saat kami sekeluarga berkunjung ke pontianak minggu lalu, karena berdasarkan penilaian trip advisor abang kepiting merupakan restoran terpopuler di pontianak. Malam sekitar jam 7 saya dan isteri sudah sampai dan mendapati suasana restoran yang tidak terlalu ramai terisi sekitar 4 meja saja, karena kami hanya berdua ingin berbincang.",Je bahalap te mun batiruh paling isut lime jam
562,ngaju,"Saya tiba di rumah makan ini pada saat menjelang jam makan siang. Awal saya tiba rumah makan ini hanya ada beberapa pengunjung yang sedang bersantap. Namun, ketika tiba jam makan siang rumah makan ini penuh dengan para warga kota makassar. Banyaknya warga kota makassar yang tiba untuk makan siang menggambarkan bahwa tempat ini merupakan rumah makan favorit di kota makassar.","Aku pas sampai huma kuman tuh pas tukep jam kuman bentuk andau. Nampara aku sampai huma kuman tuh baya tege beberapa pengunjung lagi kuman. Namun, metuh jam kuman bentuk andau jadi kuntep dengan warga kota makassar. Are warga kota makassar je dumah akan kuman bentuk andau menggambarkan bahwa eka tuh iyete huma kuman favorit hung kota makassar"
378,ngaju,Tiket waterboom PIK jakarta dikabarkan naik,Karcis waterboom PIK jakarta tege kabar mendai
381,ngaju,Lokasi agak jauh dari kota bandung dan sekarang ada 2 gerbang pembayaran untuk bisa ke the peak dengan total 5000 rupiah. Ini seperti pemaksaan untuk pungutan liar karena anda tidak akan bisa ke the peak tanpa melewati kedua gerbang ini.,Eka sadang kekejau bara kota bandung dengan wayah tuh tege due gerbang pembayaran mangat tau kan the peak dengan total lime ribu rupiah. Jituh kilau pemaksaan akan pungutan liar awi ikau diak tau kan the peak amun diak mehalau kedue gerbang tuh.
211,ngaju,"Data lengkap, jangan percaya kpk ini bohong. Kasus ini di audit 10 tahun lalu dan sudah lengkap. Karena habis itu ada audit aliran dana dengan tujuan khusus. Kalau mau kan minta audit lagi. Sudahlah. Kasus century itu skandal melindungi elit tertentu.","Data  jadi lengkap,ela percaya kpk tuh nanjaru. Kasus jituh jadi audit 10 nyelu huran tuntang jadi lengkap. awi libas te tege audit aliran dana dengan tujuan khusus. Mun handak kah balaku audit hindai. Jadi ih. kasus century te skandal je melindungi ewen elit tertentu."
418,ngaju,"Sangat dianjurkan, masakan enak banget benar-benar! Kita duduk di tempat saung yang di bagian atas pas jam-jam matahari terbenam, makan malam ditemani sunset deh! Dan itu baguus banget.","Tutu inyaran, pekasak nah mangat tutu bujur-bujur! Itah munduk hung eka pasah ji bagian hunjun pas jam-jam mata andau tenggelem, kuman hamalem dengan kawal mata andau tenggelem has! Dengae te bahalap bujur."
438,ngaju,"Rcti terlalu banyak iklan tidak jelas, sangat menggangu","Rcti lalau are iklan diak jelas, mengganggu bujur"
78,ngaju,"Baik, selain wisata wahana saya juga suka wisata kuliner. Sejak saya di bandung kuliner yang paling saya buru adalah siomay dan batagor. Mungkin kalau batagor saya sudah akrab dengan batagor kingsley yang rasanya melegenda. Untuk urusan siomay, rasanya tidak salah kalau traveler memanjakan perutnya di saung siomay ini. Seperti judulnya. Teksturnya lembut, bumbunya juga pas kena banget.","Bujur, tege eka wisata akan busik aku gin rajin wisata penginan. Bara aku hong bandung penginan ji nyangit aku menggau te siomay dengan batagor. Amun kilau batagor aku jadi patuh dengan batagor kingsley ji angat ah melegenda. Tagal soal somay, angat te diak sala amun ewen ji penanjung madu belai kenai hong pasah somay jituh. Kilau judul te. Angat isi diak beliat , bumbu gin pas angat ah buah tutu."
830,ngaju,"Penyajian cukup cepat, pelayanan baik dan pastinya masakan enak. Untuk harga relatif sesuai dengan rasa masakannya.","Penyajian sukup capat, pelayanan bahalap tuntang ji pasti pekasak mangat. Akan rega relatif sesuai dengan angat pekasak te."
854,ngaju,"Mau marah sama indosat, sudah dua hari sinyal begini banget","Handak besingi dengan indosat, jadi due andau sinyal baya kulutuh tutu"
150,ngaju,"Sudah indosat bangkrut saja, di tmpt ku saja sinyal tb2 kdg hilang muncul hilang muncul, padahal daerah kota semarang","Jadi ih indosat bangkrut ja, hong ekaku gin sinyal salengak tau leteng lembut leteng lembut, maka daerah kota semarang"
437,ngaju,Transaksi beli pulsa PLN pra bayar melalui mandiri mobile menjadi tidak efisien karena harus telepon 14000 untuk dapat tidak tokennya / tidak otomatis.,Transaksi mili pulsa PLN pra bayar mahapan mandiri mobile menjadi dia efisien awi harus telepon epat welas ribu akan dinun token te atau diak otomatis.
334,ngaju,"Tidak mesti di ruang tertutup buat pertemuan, pertemuan di resto ini juga asik. Jangan lupa memesan nasi goreng dendeng sama teh tarik.","Diak harus hung bilik ji tertutup akan pumpung,  hasundau huang resto jituh gin asyik kea. Ela kelapean memeteh bari besangak sehei dengan teh tarik."
867,ngaju,Samsung galaxy s sudah diluncurkan semalam. Saya kecewa desainnya standar banget. Harapan saya cuma terwujud 70%. Percuma terbawa sampai mimpi.,Samsung galaxy s jadi belua hamalem ndau. Aku kecewa desain te standar tutu. Kenahuangku baya terwujud uju puluh prosen. Ngahus ih teimbit sampai nupi.
665,ngaju,Sayang restorannya kotor. Lihat kecoa kecil di dekat piring-piring sayur bersih yang dipakai untuk menyajikan makanan. Dan ada kecoa kecil juga di tempat duduknya. Berharap kebersihan tempat diperbaiki.,Sayang restoran te diak barasih. Mite garinang kurik tukep piring-piring sayur berasih ji hapan akan menyerungan penginan. Dengan tege garinang kurik kea hong eka munduk te. Beharap kerasihan eka ingembuah.
689,ngaju,Iya harganya 120 ribu. Saya juga sudah cek tokopedia.,Yuh rega te saratus due puluh ribu. Aku gin jadi cek tokopedia.
213,ngaju,"Senang rasanya dapat mengakhiri perjalanan kita di bandung dengan kunjungan terakhir kita berhenti di the valley pada tanggal 2 november. Hari itu adalah acara dalam menrayakan hari perpisahan bersama teman kita yang baru akan pindah ke kantor baru. Menunya sangat bervariatif tetapi ribs langsung menjadi pilihan saya. Menurut saya, harganya sebanding dengan rasa makanan. Top.","Kahanjak angat ah tau manyelesai tanjungan itah hung bandung dengan kunjungan terakhir itah tende hang the valley tanggal due November. Andau te acara meraya andau perpisahan dengan kawal itah ji akan pindah ka kantor taheta. Menu ah are macam tapi aku langsung mintih ribs. menurut aku, rega sebanding dengan angat panginan. Top."
139,ngaju,"Kapal km fungka permata v terbakar, sedikitnya 13 tewas","Kapal km fungka intan berlian v bekehu, paling isut  telu walas matei"
84,ngaju,"Somasi yang dilayangkan rohayani, seorang pecandu rokok, kepada pt gudang garam, tbk dan pt djarum belakangan memunculkan isu lain.","Tuntutan hukum ji bara rohayani, uluh pecandu ruku, kan pt gudang garam tbk dengan pt jarum andau harian kareh mempelembut soal ji beken."
702,ngaju,Pakai kartu kredit bca tidak untung malah rugi besar,Hapan kartu kredit bca dia untung malah rugi ha'i
424,ngaju,"Restoran ini bukan sekadar tempat makan biasa, tapi juga bisa dijadikan tempat wisata. Lokasinya sangat dingin, tempatnya juga bagus, nyaman, dengan pemandangan yang eye catching. Menu yang disediakan juga beragam dengan rasa yang enak. Tidak perlu menunggu lama dalam penyajian makanannya. Harga juga relatif terjangkau. Untuk tempat berfoto juga bagus.","Restoran jituh beken baya eka kuman biasa, tapi tau kea jadi eka wisata. Eka te sedingen tutu, eka bahalap kea, taduh, dengan tempayah ji bahalap akan mata. Penginan ji nyedia are kea macam ah dengan angat ji mangat. Diak perlu menunggu tahi huang nyerungan penginan te. Rega kea relatif terjangkau. Akan eka bekodak bahalap kea."
498,ngaju,"Lokasi mudah dijangkau, penataan restoran average, menu makanan lumayan variatif dan rasa masakannya enak, harga terjangkau","Eka mudah guang, penataan restoran biasa ih, daftar penginan sadang are macam dengan angat pekasak te mangat, rega terjangkau"
777,ngaju,"Ya serba salah memang, macet mengeluh, tidak macet heran.","Ye saraba sala puna, macet mengeluh, dia macet hengan."
948,ngaju,"Rumah makan ini terletak di jalan abdurahman saleh, tempatnya nyaman dan bersih, menu masakannya banyak pilihannya. Rasanya cukup enak dan harganya juga sepadan dengan rasa masakannya.","Huma penginan tuh eka hong jalan abdurahman saleh, eka te nyaman tuntang barasih, menu pekasak te are intihan nah. Angat nah sukup mangat tuntang rega te kea sepadan dengan angat pekasak te."
808,ngaju,Kadang mikir gimana ya rasanya jadi perempuan di gym. Banyak mas mas dan om om melihat. Pasti risih dan tidak nyaman.,Kinjap mikir kilenlah angat te jadi bawi hung gym. Are hatue-hatue dengan amang-amang ji mite. Pasti risek dengan diak mangat.
846,ngaju,"Kami datang makan ke restoran itu, mengajak keluarga kakak saya. Mereka semua sangat menyukai kualitas masakan di sini. Kami pesan udang goreng telor asin dan rasanya sangat enak dan melebihi kualitas resto di hotel bintang lima. Sangat direkomendasikan.","Ikei dumah kuman kan restoran tuh, mimbit keluarga kakakku. Ewen uras tutu rajin mutu pekasak hetuh. Ikei meteh undang nyangak tenteluh kahing dengan angat te bujur mangat dengan malabihi mutu resto hong hotel bintang lime. Bujur direkomendasikan."
363,ngaju,Pelayanan solaria sungguh tidak memuaskan hampir di seluruh cabang yang ada di Jakarta. Tidak rekomendasi banget.,Pelayanan solaria bujur diak hong uras cabang ji tege hong Jakarta. Diak tau tutu akan rekomendasi.
544,ngaju,Temanku melamar pekerjaan di tokopedia,Kawalkuh melamar gawian hung tokopedia
153,ngaju,Bukan cuma bisnis keluarga. Tetapi menjaga kepentingan negara dan masyarakat tanpa membenturkannya dengan kepentingan global.,Beken baya bisnis uluh ije kehuma.Akan menjaga kepentingan negara dengan warga tanpa membenturkannya dengan kepentingan global.
752,ngaju,"Terletak di daerah perbukitan sehingga udara dan pemandangannya sangat nyaman, di samping itu terdapat berbagai pilihan menu makanan nusantara, steak maupun pasta juga ada.","Tege huang daerah perbukitan sehingga riwut tuntang pemandangan sangat mangat, samping jite tege are intihan menu penginan nusantara, steak atau pasta gin tege kea."
662,ngaju,"Baik, terima kasih atas jawaban yang begitu lengkap dan jelas ya","Bahalap, tarima kasih akan baleh tumbah ji sukup lengkap kute dengan jelaslah"
255,ngaju,"Ayam gorengnya enak, terong gorengnya juga. Sayang mau coba jengkol gorengnya sudah habis. Oh ya jus kefonfongnya juga segar.","Manuk basanga mangat, terung basanga mangat kea, sayang pas handak inyoba jaring basanga jadi lepah. Yoh jus kedondong segar kea"
780,ngaju,"Senin pagi memang selalu tidak bersahabat, mulai dari pakai jilbab berantakan, jalanan macet, transjakarta arah senayan ramainya astaghfirullah, absen telat lewat jam 8, ga ikut doa pagi.","Senin hanjewu memang dia puji bersahabat. Nampara bara mahapan jilbab berantakan, jalanan macet, trans jakarta arah senayan rami te astagafirulah, absen sayup bara jam hanya, dia umba doa hanjewu."
896,ngaju,"Cemburu itu rasanya tidak enak. Cemburu itu makan hati. Cemburu itu sakit, kalau tidak diungkapkan","Ngebehu te angat ah diak mangat. Ngebehu te kuman atei. Ngebehu te pehe, amun diak mempelua"
90,ngaju,"Keunggulan holycow dibanding resto steak lain adalah wagyunya yang mantap. Favorit saya adalah wagyu sirloin steak yang dinikmati dengan mushroom sauce. Rasanya mantap. Dagingnya tebal dan dinikmati dengan butiran jagung rebus, sayur bayam dan masih potatto. Enak dan mantap.","Keunggulan holycow imbanding resto steak ji beken te wagyunya ji menyak. Kerajinku te wagyu sirloin steak ji kinan dengan kulat saus. Angat ah manis enyak. Isi nah bekapal tau kinan hayak bawak jagung luntuh, juhu bayam dengan kantang tumbuk. Mangat dengan mias."
999,ngaju,"Hai ditha, kami informasikan bahwa pembayaran kamu telah masuk ke akun rekening kami namun pemesanan tidak berhasil.","Uy ditha, ikei informasikan te bahwa pembayaran ayum jadi tame kan akun rekening ikei baya pemetehan diak berhasil."
127,ngaju,"Cuma kalau besok mau mencari, dia ada di rak yang dekat cream krim wardah bersebrangan sama rak lotion citra, sister.","Baya amun jewu handak menggau, iye tege hong rak ji tukep cream krim wardah bedimpahan dengan rak lotion citra, pahari bawi."
340,ngaju,"Resto dengan konsep saung2 yang terletak di dalam komplek perumahan. Makanan yang disajikan beragam mulai dari sundanese, makanan barat, dll. udara cukup dingin di malam hari atau ketika hujan jadi disarankan membawa jaket. Jalan antar saung menggunakan batu-batu sehingga kadang-kadang licin ketika hujan","Resto dengan tema pasah-pasah ji eka huang kompleks perumahan. Penginan ji nyerungan are macam tempara bara sundanese, penginan barat, dengan ji beken-beken.Udara sukup sedingen mun hamalem atau katika hujan jadi sanan imbit jaket. Jalan helat pasah mehapan batu-batu jadi tau dumah melisen katika hujan."
207,ngaju,"Tempatnya nyaman banget, makanannya enak, kopinya enak. Pas buat nongkrong bareng teman-teman atau makan malam.","Eka mangat tuu, panginan mangat, kopi mangat kea. pas akan santai dengan kare kawal atau kuman hamalem."
258,ngaju,"Kalau kuota saya besok tidak balik, saya mau marah-marah ke indosat","Mun kuotakuh sampai jewu dia babulie, aku handak basingi dengan indosat"
701,ngaju,"Tempatnya nyaman, makanan lumayan enak. Buat yang mau ngobrol lama-lama cocok sekali ada banyak tempat lesehan nyaman banget plus udara yang sejuk.","Eka te mangat, panginan lumayan mangat. Akan je handak bapander katahi cocok tutu tege are eka munduk mangat tutu tambah riwut je sadingen."
727,ngaju,Rasa makanan cukup enak. Lokasi cukup strategis dekat eskalator turun dan naik mal. Secara keseluruhan baik mantap.,Angat panginan cukup mangat. Lokasi cukup strategis tukep eskalator  muhun dengan mendai mal. Amun secara keseluruhan bahalap mantap. 
496,ngaju,"Hai, ya, silakan kamu dapat mencoba lakukan pembayaran pdam di bukalapak.","Uy, yuh, takan ikau tau menguji mawi pembayaran pdam hong bukalapak."
197,ngaju,"Enkaolshop, terpercaya, barangnya bagus bagus","Enkaolshop, tau percaya, ramu te bahalap halap"
301,ngaju,"Aslinya ini basa berada di jalan karapitan setahu saya, sekarang memenag sudah tersebar di beberapa tempat di bandung. Makanannya juga tidak hanya bakso, tetapi ada beberapa makanan tambahan yang lain. Untuk rasa juga tidak terlalu spesial. Untuk harga dengan ukuran harga bakso di bandung cukup mahal. Ditambah pelayannannya yang kurang bagus di ciwalk.","Asli te jituh tau eka hung jalan karapitan ji sepengetawanku, wayah tuh puna jadi tersebar hung pire pire eka hong bandung. Penginan te diak baya bakso, maka tege pire pire penginan pendahang ji beken. Akan angat kea diak lalau special. Akan rega dengan ukuran regan bakso hung bandung sukup larang. Dahang pelayanan te ji kurang bahalap hung ciwalk.
"
274,ngaju,"Seharusnya masih berhak mendapatkan cahsback 5 j uta dengan cara berlangganan paket iplan 500k selama 24 bulan kak. Dan bisa juga cicilan 0% menggunakan cc bca, bni, mandiri, cimb niaga.","Seharus te masih berhak dinun duit bulie lime  juta dengan cara balangganan paket iplan lime ratusk katahi due puluh epat bulan kak. Tuntang tau kea cicilan 0% hampan cc bca, bni, mandiri, cimb niaga."
871,ngaju,Tidak menyesal juga makan di solaria tempatnya bersih dan cocok buat keluarga juga. Makanan cepat keluar setelah dipesan.,Diak menyasal kea kuman hong solaria eka te barasih dengan cocok akan keluarga kea. Penginan capat belua limbah memeteh.
507,ngaju,Copot dari keanggotaan polisi saja. Daripada jadi perusak nama baik korp.,Lapas bara keanggotaan polisi ih. Daripada ye parusak aran bahalap korp.
845,ngaju,Menyesal tadi ke toko itu. Malah beli hal-hal yang tidak akan terpakai. Cuma karena lapar mata jadi beli:,Menyasal endau kan toko te. Palus memili taloh hal ji diak  akan tehapan. Tagal awi belauk mata jadi memili.
905,ngaju,"Makan di pinggir jalan, makanannya tidak enak, pelayanan tidak bagus, harga mahal.","Kuman hung saran jalan, penginan te diak mangat, pelayanan diak bahalap, rega larang."
111,ngaju,Untuk mengajukan kerjasama / sponsorship ibu elsa dpt menghubungi: Pt. Bank mandiri persero tbk corporate secretary,"Bara segi eka atau eka mudah gau. Betang dengan isi huang ah puna bahalap, dahang hindai tege taman kurik huang te dengan tege kea belanai huang te ji danum ah mehasur tarus.Mawi angat ah  mendahang romantis dengan sanang. Daftar penginan ji perahan sadang kekare dengan bara segi angat sadang kamangat ah."
595,ngaju,Produksi lagi dong indomi goreng sate. Dicari-cari sudah tidak ada. Rasanya enak beda dngan rasa sate merk lain,Produksi hindai nah indomie goreng sate. Manggau ka kanih ka hete jatun. Angat ah mangat beda dengan rasa sate merek beken.
19,ngaju,Pagi pagi ingin marah dengan sinyal telkomsel.,Hanjewu handak sangit dengan sinyal telkomsel
670,ngaju,"Antriannya lama, makanannya juga lama dan rasa makanannya biasa saja dan mahal","Giliran te tahi, penginan te tahi kea dengan angat penginan biasa ih tuntang larang"
284,ngaju,"Parah banget xl deh sekarang sepertinya, harus ganti provider lain cuma mahal doang kualitas jelek","Parah tutu xl wayah tuh lah, harus ganti provider beken  baya larang pang kualitas dia bahalap"
252,ngaju,"Kereta mutiara timur malam, sby - bnywangi eksekutif tetapi kursi jorok dan kotor sekali. Tidak sesuai dengan harga yang sangat mahal, sangat mengecewakan","Kereta mutiara timur malam, sby - bnywangi eksekutif baya kursi bajilek dan jatunti kerasih tutu. Dia sesuai dengan rega je larang tutu,  mawi pehe atei tutu"
117,ngaju,"Saya memilih tempat makan di saung dengan pemandangan sawah memesan nasi timbel komplit, surabi oncom dan colenak pesanan datang tidak harus menunggu lama. Hanya saja saya kecewa dengan serabinya. Di luar ekspektasi saya. Tidak enak.","Akan penginan are macam ah baya tuh lalau kekare enyak, lauk gurame goreng diak mangat amun diak goreng keang. Bua ji hamis nah ji nawar ewen lalau kekare danum dengan diak haru."
684,ngaju,Payah sekali pelayanan pos indonesia saat ini,Papa tutu pelayanan pos indonesia wayah tuh
554,ngaju,"Ini indihome saya gangguan lagi ini. Saya lagi ada kerjaan tiba-tiba terputus, merah kedip-kedip, baru seminggu baik wifinya, sudah gangguan lagi. Indihome telkom sekarang banyak gangguan ya, bayar selalu mahal, mengecewakan sekali.","Tuh Indihome ayungkuh gangguan hindai. Aku lagi tege gawian basalenga putus, bahandang pitep pitep, haru ije minggu bahalap wifi ah, jadi gangguan hindai. Indihome telkom wayah tuh are gangguan lah, bayar selalu larang, nampa bajilek tutu."
337,ngaju,"Menurut saya bebek garang ini punya varian menu bebek yang cukup banyak. Saya suka perpaduan antara bebek dan sambalnya, rasanya pas. Untuk harga berkisar 20 - 30 ribu dan menurut saya cukup sepadan dengan rasa dari makanan di sini.","Tumunku itik garang tuh tege macam menu itik ji sukup are. Aku rajin campuran angat itik dengan sambal te, angat te pas. Akan rega sekitar duapuluh sampai telupuluh ribu dengan tumunku sukup imbang dengan angat bara penginan hetuh."
837,ngaju,"Cocok buat pertemuan, acara pernikahan, pemotretan. Suasananya tenang, santai, adem.","Cocok akan pertemuan, acara pernikahan, pemotretan. Suasana te taduh, santai, adem."
967,ngaju,Setiap kali ke sini saya ingin berlama-lama dan tidak mau pulang cepat. Pelayanan yang ramah dan tempat yang nyaman.,Genep kali kan hetuh aku handak tahi-tahi dengan diak maku buli capat. Pelayanan ji bejenta tuntang eka ji nyaman.
577,ngaju,Restoran ini menyajikan masakan bali yang sarat modifikasi sehingga terkesan disesuaikan dengan lidah konsumen yang nota bene bukan orang bali. Tiga photo yang saya lampirkan itu adalah makanan yang kami pesan.,Restoran jituh nyadia penginan pekasak bali je are modifikasi jadi terkesan disesuaikan dengan belai konsumen je notabene beken uluh bali. Telu photo je aku lampirkan te iyete panginan je ikei peteh.
578,ngaju,"Kalau di banyak tempat steak membutuhkan waktu lama sebelum penyajiannya, di tempat ini menurut saya cenderung cepat dan sesuai dengan lidah maupun dengan dompet saya. Saya pernah menunggu teman sampai 2 jam di sini, tapi tidak berasa karena makanannya membuat saya lupa waktu. Hehe","Amun hung are eka steak belaku waktu tahi sahindai nyerungan, hung eka tuh tumun aku cenderung capat tuntang sesuai dengan jela tuntang dompetkuh. Aku puji menunggu kawal sampai due(2) jam hetuh, tapi dia terasa angat ah awi panginan te nampae aku dia mingat waktu."
692,ngaju,Kalau mau beli obat pergi saja ke kimia farma yang berada di ujung jalan itu,Amun handak mili tetamba haguet ih kan kimia farma ji tege hong ujung jalan hete
380,ngaju,Pelajaran matematika anak sd sekarang sulit sulit,Pelajaran anak  sd wayah tuh bahali-hali
755,ngaju,Restoran di sini selalu penuh karena letaknya yang strategis di pintu masuk mal. Rasa bubur cukup enak. Proses penyajian dari order sampai penghidangan juga cukup cepat.,Restoran hetuh selalu penuh  awi eka te strategis melai pintu tame mal. Angat kangkuyaw cukup mangat. Proses inyadia bara order sampai nyadia cukup capat kea.
788,ngaju,Habisnya aku lagi galau kak maka dari itu bikin story kayak begitu,"Awi aku lagi galau kak, makanya nampae story kilau jite."
616,ngaju,"Untuk yang sedang ke cirebon dan cari tempat yang enak parkirnya dan makanannya butuh cepat, lebih baik ke sini karena parkiran luas dan suasana nyaman","Akan ji jalanan kan cirebon dengan gau eka ji mangat parkir te tuntang penginan te handak capat, labih bahalap kan hetuh awi parkiran lapang dengan suasana taduh"
396,ngaju,Mm sedih deh kalau ke sini selalu menunggu: Mienya pedas banget. Hehe bangkunya juga tambahkan dong biar tidak menunggu,Mm nyerenan angat ah amun kan hetuh rancak menunggu. Mie te bahari tutu. Tetawe hehe bangku te kea pendahang nah mangat diak menunggu
259,ngaju,"Memang faktanya kami punya banyak tanah di sini, mau apa lo?! maka dari itu kerja biar bisa banyak duit kayak kami-kami, jangan cuma bisanya menghujat saja","Memang fakta ah ikei baisi are petak hetuh, handak narai ikau?! maka te bagawi biar are duit kilau ikei, ela baya tau nampa pander dia bahalap ih"
850,ngaju,Restoran The Valley ini pemandangan ke kota nya nomor 1. Menikmati suasana malam hari dengan lampu kedap-kedip indah sekali.,Restoran The Valley jituh tempayah te kan kota nah nomor ije. Mengkeme suasana andau malem dengan lampu kedap kedip bahalap tutu.
289,ngaju,"Kalau ke semarang wajib makan mie kocok ini, menurut saya paling enak. Walaupun tempatnya dipinggiran ruko, dan untuk makannya mesti berusaha untuk dapatkan bangku, tapi layak banget kalau dibandingkan rasanya. Kikilnya banyak, kuahnya gurih banget dan mienya lebar dan tipis. Harganya juga terjangkau. Teh terbaik mie kocok di semarang.","Mun kan semarang wajib inyoba mie kocok tuh, menurut aku paling mangat. Walaupun eka pinggiran ruko, dan untuk panginan harus berusaha mandinun bangku, tapi layak tutu mun imbanding dengan angat ah, kikil ah are, kuah gurih tutu, mie ah lebar tuntang tipis. Rega terjangkau kea, Teh terbaik mie kocok hung semarang"
0,ngaju,Maling yang sebenarnya sudah di pastikan bernama lulung,"Maling ji bujur te jadi tawa ih, Iulung ara ah"
647,ngaju,"Memang ya sepertinya aku tidak ditakdirkan nikmatin indomie goreng, padahal cuma merebus minya lho. Bisa-bisanya terlalu lembek. ","Puna yuh kilau te aku jatunti nasib mengkeme indomie goreng, maka baya marabus mi ih te. Ketau-tau lalau belemu."
643,ngaju,Nike mengeluarkan produk sepatu terbarunya,Nike mampalua produk ewen je paling taheta.
532,ngaju,"Waktu saya ke restoran itu, pelayannya mendatangi saya dan bertanya untuk berapa orang.","Metuh aku kan restoran tuh, pelayan dumah akan kuh tuntang misek akan pire biti?"
217,ngaju,Roti bakar duti ini sudah ada sejak dulu di sini. Rotinya biasa saja sih. Hanya menu pilihannya buanyak banget. Apa saja ada. Sampe kadang bingung mau pilih yang isi apa. Ada jual bubur juga. Oke jugalah.,"Roti mapui duti tuh jadi tege bara huran hung hetuh. Roti biasa ih. tapi pilihan te are tutu, uras tege. sampai kadang bingung kea handak mintih je kueh. Tege kangkuyaw kea injual. oke kea lah."
901,ngaju,"Kuota jadi habis terkuras buat melihat foto-foto yang cuma bikin saya iri, makanan enak-enak yang bikin ngiler","Kuota maka lepah uras akan mite poto-poto ji mahin mawi aku behiri, penginan mangat-mangat ji mawi mipen"
