id,lang,source,target
506,ngaju,"Ingin bantu kasih hubungan infonya, tapi kuota internet saya terbatas.","Handak mandihop nenga hubungan info ah, tapi kouta internetkuh terbatas"
663,ngaju,"Saya sependapat, acara tersebut harus dihilangkan, banyak acara yang tidak berguna. Orang-orang dalam acaranya pun bertingkah seperti orang tidak sekolah saja.","Aku sependapat, acara tersewut harus penihau, are acara ji jatunti rima. Uluh are huang acara te gin mawi gawi kilau uluh jatunti sekula ih."
505,ngaju,"Resto nostalgia yang wajib dikunjungi, tempat yang nyaman buat keluarga, parkir yang luas. Hidangannya hampir semua enak, terutama steak, saslick dan es krim.","Resto nostalgia je wajib dumah aka, eka je mangat akan keluarga, parkit je hai. Panginan te uras mangat, je utama te steak, saslick tuntang es krim"
187,ngaju,"Ajak keluarga, kawan satu kantor, kawan jalan, pacar, kawan pacar, atau bahkan mantan pacar, buat suara award ini.","Imbit uluh ije kehuma, kawal ije eka begawi, kawal nanjung, pacar, kawal pacar, atau bahkan awan pacar, akan auh award jituh."
184,ngaju,"Tempatnya menarik, dengan konsep yang sangat pabrik. Sayangnya hampir seluruh menunya non halal.","Eka menarik, dengan gambaran ji tutu pabrik. Baya sayang handak uras penginan te dia halal."
534,ngaju,Untuk orang jogja sih malas kembali ke sana 2 kali. Cukup sekali. Masuk harus bayar. Makanan mahal.,Akan uluh jogya tuh bakulas kakanih hindai due kali. cukup sinde. Tame harus bayar. Panginan larang.
327,ngaju,Banyak keluarga saya yang bekerja sebagai pegawai negeri,Are keluarga aku ji begawi jadi pegawai negri
14,ngaju,"Kami makan malam di restoran itu dan pelayanannya cukup memuaskan. Tempatnya luas, ada yang berada di dalam ruangan, ada yang diteras. Makanan langsung dipilih dari meja saji di dalam restoran. Ada pilihan menu segar yang baru digoreng pada saat dipesan dan sebagian besar menu tradisional. Waktu tunggu tidak lama. Penyajian unik karena tidak menggunakan piring melainkan memakai daun.","Wayah aku mipen menggau penginan ji are macam intihan, aku gin nengak rekomendasi awi kawal akan kuman hetuh, selain murah kea mangat penginan ah. Baya pang isut tahi akan itah menunggu petehan."
961,ngaju,Kiriman agak terlambat 1 hari pakai kurir itu. Lebih responsif dong,Kiriman agak sayup ije andau hapan kurir te. Labih responsiflah.
916,ngaju,"Ketika ingin menyantap variasi makanan, pilihannya selalu Hanamasa. Lokasi tempatnya cukup enak. Pilihan makanannya banyak, dari mulai makanan ringan, bakar-bakaran, rebusan hingga makanan penutup. Sangat tidak mengecewakan.","Katika handak mengkeme are macam penginan, intihan te selalu hanamasa ih. Awang eka te sukup mangat. Intihan penginan te are, bara tempara penginan mehian, mapuy papuy, luntuhan sampai penginan penutp. Bujur diak mawi pehe atei."
574,ngaju,"Dapatkan voucher pulsa rp 25.000, - untuk dua orang yang beruntung setiap harinya hanya dengan retweet bniquotes",Yuk dinun voucher pulsa rp due puluh lime ribu ( 25.000) akan due biti je beruntung genep andau baya dengan retweet bni quotes.
888,ngaju,"Makan di resto mewah, harga tentu saja mahal, tapi rasanya payah, sungguh menjengkelkan.","Kuman hung resto mewah, rega pasti ih larang, tapi angat te uyuh, tutu mawi bajilek."
157,ngaju,Gunanya shazam: Biar tahu lagu-lagu ajaib yang diputer sopir gocar,guna bara shazam : Mangat tawa lagu lagu ajaib ji mutar awi sopir gocar
382,ngaju,"Enaknya makan di redsdifo, baru kali ini dah saya suka banget makan ikan. Ikannya segar, enak, dan tidak ada bau amis lagi. Pokoknya ikan bawal enak. Dan kopi robusta susu mantap. Pokok. A ketagihan dah. Redsdipo jadi tempat favorit saya. Enak pokoknya mah.","Mangat te kuman hong redsdifo, haru sinde kali tuh aku rajin tutu kuman lauk. Lauk te segar, mangat, dengan diak tege ewau anyer kea. Pokok te lauk bawal mangat. Dengan kupi robusta susu mantap. Pokok. A ketagihan bah. Redsdipo jadi eka kerajinku. Mangat pokok te nah."
769,ngaju,Ini kenapa sih astaga telkomsel maupun indihome dua-duanya sering bermasalah! Mahal doang woy!,InJituh buhen lah  astaga telkomsel tuntang  indihome due due ah rancak bamasalah!  Larang bewei  woy!
521,ngaju,Saya pergi ke sini hanya untuk mencari sedikit hiburan di kala berlibur bersama keluarga. Saya hanya minum dan makan makanan kecil. Minuman di sini harganya murah banget dibandingkan dengan jakarta. ,Aku dumah hetuh  baya handak manggau hiburan isut pas berlibur hayak keluarga. Aku baya mihup tuntang kuman panginan kurik. Minuman hetuh murah tutu dibandingkan dengan jakarta
202,ngaju,Tagihan indihome saya bulan oktober ini beda dengan bulan september. Jatuhnya lebih mahal. Kenapa bisa begitu? Janjinya waktu awal pasang tidak ada biaya lain dan biaya flat. Ini kok naik turun bagaimana? Konsisten dong,"Tagihan indihome kuh bulan  oktober tuh pina beken dengan je  bulan september. Manjatu teh lebih larang. Buhen tau kute lah? Janji ewen pas nampara masang te jatun kare biaya je dahang, biaya tatap ih. Jituh muhun mandai kenampi? Ayo konsisten"
149,ngaju,"Ini menyesal sekali makan indomie salted egg. Makannya tadi pagi jam 8, sampai sekarang after tastenya masih ada! Gaenak banget lagi ya allah",Jituh menyasal tutu kuman indomie tenteluh bekahing. Kuman te hanjewu endau jam hanya sampai tuh limbah angat ah masih tege! Diak mangat tutu ya hatalla
99,ngaju,"Bakso yang unik. Bakso dengan jenis jenis isian yang berbeda. Ada yang isi keju, daging cincang pedas dan urat. Saya memilih cincang daging pedas ehmmmm rasanya sesuai dengan namanya. Harganya murah, tempat bersih.","Bakso ji unik. Bakso dengan are macam isi huang ah ji berbeda. Tege ji isi keju,  isi cincang bahari dengan uhat. Aku mintih cincang daging bahari ehmmmm angat ah sesuai dengan ara ah. Rega murah, eka berasih."
929,ngaju,Bikin macet jalan saja nih orang,Mawi macet jalan bewei ih uluh tuh
269,ngaju,Bni tingkatkan branding melalui stasiun bni city,Bni tingkatkan branding melalui stasiun bni city
778,ngaju,"Sensasi makan dengan alas daun pisang, dengan enaknya cumi bakar dan tempe tepung yang gurih, serta sambal yang menggugah selera. Memang mantap","ensasi kuman hapan alas dawen pisang, dengan mangat cumi bapapui sambal je menggugah belai. Puna mantap."
762,ngaju,"Mie mewek terletak di jalan pajajaran. Dekat dengan area BEC, pusat penjualan gadget. Di sini kita bisa menikmati kuliner khas berupa makanan dengan cita rasa pedas. Mie nangis akan membuat kita sebagai penikmatnya benar-benar menangis, karena kepedesan sekaligus ketagihan untuk datang dan makan lagi. Mienya tebal dan kenyal. Enak.","Mie melek melai jalan pajajaran. Tukep dengan area BEC, pusat penjualan gadget. Hetuh itah tau menikmati kuliner khas berupa panginan dengan cita rasa bahari. Mie nangis tau nampae itah sebagai penikmat bujur bujur menangis, awi kahariean sekaligus ketagihan handak dumah tuntang kuman hindai. Mie te tabal tuntang kenyal. Mangat."
272,ngaju,Dia memakan susu indomilk di dalam kulkas,Iye kuman susu indomilk huang kulkas
354,ngaju,Kesal banget dari tadi jualan yakult tidak untung terus,Rise tutu bara endau jualan yakult jatunti hujung tarus
105,ngaju,Ramayana kembali membuka cabangnya di samarinda,"Penginan ah mangat, dengan bahalap bujur taluh tempayah ah. Baya bentuk andau ih tau kan lawang wangi te, isut uluh ah awi diak uras uluh ketawa tege lawang wangi huang hete baya uluh ji mehalau ih."
109,ngaju,Tempat ini terkenal banget di kalangan mahasiswa. Karena selain enak harganya juga termasuk murah kalau menurut saya. Top deh.,"Aku dengan uluh ije kehuma kuman hamalem huang eka tuh awi penginan utama batagor tege hindai penginan ji beken. Aku baya memeteh due penginan ji jadi dumah sampai epat puluh lime menit ketahi, jite gin sampai pire kali aku memisek. Bara angat are penginan ji puji aku mengkeme puna sadang ih kamangat ah. Petehku sehindai memeteh labih bahalap misek helu pire ketahi pekasak penginan te ji jadi meteh."
833,ngaju,"Beragam macam karya seni yang ditampilkan di lantai dasar dan kedua sungguh menarik perhatian. Selain itu di halaman luar juga banyak karya seni yang bisa diamati. Pemandangan yang menyerukan mata, serta cuaca yang adem membuat tempat ini sangat disukai banyak orang.",Are macam karya seni ji perahan hong laseh dasar denga kedue bujur menarik perhatian. Ji beken hong halaman luar kea are karya seni ji tau diamati. Taloh tempayah ji pehanjak mata dengan cuaca ji sedingen mawi eka tuh tutu rajin uluh are.
951,ngaju,"Gue enggak suka sama pelatih yang sekarang, strategi yang dibikinnya tidak bisa dipakai buat mengalahkan lawan.","Aku diak rajin dengan pelatih ji wayah tuh, strategi ji iye mawi diak tau hapan akan mempekalah musuh."
229,ngaju,Ini adalah tempat makan untuk orang yang menunggu keluarganya yang sedang asyik berbelanja. Tetapi tidak untuk orang orang yang senang makanan yang enak. Di jakarta banyak sekali tempat makan yang jauh lebih enak dan harganya jauh lebih murah.,Jituh eka kuman akan uluh ji manunggu keluarga asyik belanja. Tapi beken akan uluh je rajin panginan je mangat. Hung Jakarta are tutu eka kuman kejau kamangat ah dan rega kejau murah ah.
492,ngaju,"Bila kamu selesai transaksi mengirim, pastikan cek kembali alamat di resi sebelum meninggalkan counter jne pondok timur ya","Amun ikau jadi selesai transaksi mengirim, masti ih cek haluli alamat hong resi sehindai melihi counter jne pondok timurlah"
212,ngaju,"Tendang sana tendang sini hajar sana hajar sini, ternyata masing-masing punya agenda tersembunyi! Menyebalkan!","Nyepak kanih nyepak hete natal kanih natal hete, ternyata uras tege agenda tersembunyi, nampa bajilek!"
388,ngaju,Kesal bukan karena mu. Tetapi persis dikalahkan pssm. Tidak enak hati tidak enak tidur tidak enak makan. Semua gara-gara pssm!,persis dikalahkan pssm. Diak mangat atei diak mangat betiruh diak mangat kuman. Uras badin pssm.
954,ngaju,"Isi pulsa via atm bca tadi jam 17.48 sampai sekarang belum masuk, boleh tolong dicek? Terima kasih","Isi pulsa via atm bca endau pukul ujuh welas epat puluh hanya sampai tuh hindai tame, tau belaku duhup mecek? Tarima kasihlah."
37,ngaju,"Senin pagi gue diisi dengan kegiatan wawancara, sebelum jalan ke lokasi gue harus memesan gojek dan suasana masih hujan.","Senayan hanjewu aku tege gawian misek tumbah, sehindai menanjung kan eka gawian te aku harus memeteh gojek maka andau masih hujan."
561,ngaju,"Tempat yang paling cocok untuk mencari makanan kalau budget terbatas tetapi memuaskan, di sini banyak sekali pilihannya dari mulai masakan khas dari daerah di indonesia sampai masakan modern.","Eka je paling cocok akan manggau panginan mun anggaran isut tapi memuaskan, hetuh are tutu pilihan ah mulai bara pekasak bara daerah  Indonesia sampai pekasak modern."
980,ngaju,"Saya lihat banyak pengguna indosat terkena pemotongan pulsa, kasihan.","Aku mite are ji mehapan indosat buah kana motong pulsa, masie ah."
807,ngaju,"Tempat yang sangat alami, dengan menu yang variatif, dengan rasa yang pas. Saya suka dengan bandrek jagungnya,  jagung yang manis disajikan sangat hangat. Ada aneka jajanan tradisional yang sudah jarang ditemui.","Eka ji bujur alami, dengan penginan ji are macam, dengan angat ji pas. Aku rajin dengan bandrek jagung te, jagung ji manis nyerungan masih belasut tutu. Tege are macam jajanan tradisional ji jarang supa."
982,ngaju,Bapak ini ngomongnya tidak masuk akal! Orang diculik kok malah memikirkan penculiknya. Teori dari mana itu?,Apang tuh pander ah diak tame akal. Uluh nyulik bah malahan memikir ji pelaku te. Teori bara kueh te?
66,ngaju,"Tempatnya besar. Open 24 hari. Cocok buat ngemil. Tempat duduk sofanya nyaman. Sayang banyak mahasiswa yang mengerjakan tugas di sana, jadi jarang kosong tempatnya kalau malam. Hehehe","Eka hai. Buka due puluh epat andau. Pas akan kuman penginan kurik.Eka munduk te sofa mangat. Sayang pang are mahasiswa ji mawi tugas hong kanih, jadi diak puji kosong eka amun hamalem. Tetawe hehehe"
479,ngaju,Tidak untung saya ikut rombongan untuk pergi ke bali sangat membosankan,Diak batuah aku umba rombongan handak tulak kan bali jadi peda belai tutu
172,ngaju,"Walaupun cukup berliku untuk sampai ke tempat ini tapi terbayarkan dengan suasana sepi, tenang dan juga suasana udara dataran tingginya, yang kebetulan saya biasanya kalau makan di luar pasti pas hari kerja karena biar tidak terlalu ramai tapi ya minusnya tidak ada lift musik. Untuk makanannya cukup enak dan keluarga saya pun cukup menikmatinya.","Amun pang sukup beliku akan sampai kan eka jituh jadi tebayar dengan suasana suni, taduh dengan kea suasana dataran gantung te, ji kebujuran aku patuh amun kuman hong luar musti pas andau begawi karana mangat diak lalau rami baya yuh tege kurang ah jatunti musik belum. Akan penginan te sukup mangat dengan uluh ji kehumaku gin sukup mengkeme ah."
519,ngaju,Sangat cocok untuk bersantap bersama keluarga menikmati hidangan yang lezat sambil mengobrol melepas penat setelah seharian beraktivitas pokoknya terbaik deh,Cocok tutu akan kuman bersama keluarga menikmati panginan je mangat sambil bapander malapas uyuh libas bagawi ije andau pokoknya paling bahalap te
715,ngaju,"Datang ke restoran ini tidak ada bosannya, apalagi di malam minggu kami sekeluarga sangat menyukai tempat ini karena ada live musiknya. Suasananya tidak berubah dari tahun ke tahun. Menu yang disajikan pun masih tetap sama, dari mulai menu eropa sampai menu khas indonesia tetap memikat. Porsinya juga tak kalah banyak.","Dumah akan retoran tuh dia puji peda, apalagi mun malem minggu ikei sekeluarga rajin tutu akan eka jituh awi tege live music. Suasana ah dia berubah bara nyelu akan nyelu. Menu je inyedia tatap sama ih, mulai bara menu eropa sampai menu khas Indonesia tetap memikat, porsi te dia kalah are."
641,ngaju,Kalau melihat muka orang ini bawaan emosi tingkat dewa,Amun mite baun uluh jituh angat ah besingik tingkat nayu.
348,ngaju,Masakan india menurut ku tidak enak. Terlalu banyak rempah,Pekasak india tumunku diak mangat. Lalau are bumbu
22,ngaju,"Kami sekeluarga ke tempat ini karena hari sudah larut malam dan tidak ada resto lain yang buka. Ternyata jam 10 malam pun tempat ini masih macet, parkir penuh dan tempat duduk di dalam resto penuh. Petugas yang tampak kelelahan melayani dengan masam. Ampun. Akhirnya makanan kami bawa ke hotel.","Ikei sekeluarga kan eka jetuh awi jadi gantung alem dengan jatunti hindai resto ji beken buka. Sekalinya jadi jam sepuluh hamalem gin eka hetuh masih macet, parkir kuntep dengan eka munduk huang resto kuntep kia. Petugas ji jadi uyuh begawi menyerungan hayak baun mata masem. Hakayah. Belalu penginan ikei mimbit kan hotel."
620,ngaju,Oh iya saya mau fitur cetak resi otomatis diperbaiki.,Oh yuh aku handak fitur cetak resi otomatis ingembuah.
126,ngaju,Awal tahun ini bakti budaya djarum foundation bekerjasama dengan dan garin workshop,Tempara nyelu tuh bakti budaya djarum foundation hayak mawi gawi dengan garin workshop
83,ngaju,"Dengan membeli morinaga chil kid dan chil school senilai rp 500. 000, bunda akan mendapatkan voucher gopay rp 50. 000.",Dengan memili morinaga chil anak dengan chil sekula serega lime ratus ribu rupiah indung akan mendinun voucher gopay lime puluh ribu rupiah
966,ngaju,Saat ini para wisatawan pecinta diving sangat kecewa dengan kondisi teluk ambon yang nampak indah namun sangat kotor,Wayah tuh ewen wisatawan rajin manyelem bajilek awi kondisi teluk ambon ji tempayah bahalap tapipapa tutu.
493,ngaju,"Rekomendasi untuk makan siang ala indonesia, pilihan makanannya banyak sekali tinggal tunjuk saja. Terbanyak yang bentuk gorengan, misalnya empal, ayam goreng, tahu goreng dll. peralatan makan yang dipakai yang ala model zaman dulu, seperti piring seng, gelas seng, mengingatkan makan di zaman dahulu. Pelayanan cepat. Mantap","Rekomendasi akan kuman bentuk andau ala indonesia, intihan penginan te are tutu baya nunjuk ih. Tepeare ji macam gorengan, kilau empal, manuk goreng, tahu goreng denga ji beken-beken. kare ramu kuman ji hapan tege ji ala model jaman huran, kilau piring blek, gelas blek, mempingat kuman hong jaman huran. Pelayanan capat. Lamus"
466,ngaju,"Tempatnya nyaman, sangat windy tapi sejuk juga. Konsep tempatnya bagus, vip roomnya keren sekali. Instagramable banget deh tempatnya. Cocok untuk nongkrong-nongkrong bareng teman, keluarga, pacar. Makanannya juga not bad, dan harganya juga terjangkau. Mbak kasirnya waktu itu ramah sekali.","Eka te taduh, riwut daras tagal sejuk kea. Konsep eka te bahalap, vip roomnya bahalap bujur. Instagramable tutu tuh eka te. Pas akan munduk hakumpul hayak kawal, keluarga, pacar. Penginan te sadang mangat ah, dengan rega te gin terjangkau. Bawie kasir ah wayah te bejenta bajurah."
672,ngaju,Ini tua bangka sudah bau tanah kok tidak sadar-sadar ya. manusia terburuk yang paling busuk.,Jituh uluh bakas tutu jadi bahewau petak tuh dia berendeng-rendenglah. Kelunen je papa ji nyangit buruk.
581,ngaju,"Tak ada sunlight dan mama lemon, garnier men turbo oil control pun jadi buat cuci tangan setelah masak alias licin cuy setelah kena minyak.","Jatun sunlight tuntang mama lemon, garnier men turbo oil control pin gin tau akan menyau lenge limbah berapi alias melisen cuy limbah buah undus."
379,ngaju,"Batagor kingsley sangat lezat dan disukai oleh keluarga dan warga jakarta. Setiap kali pergi ke bandung, keluarga dan teman-teman selalu minta dibelikan batagor kingsley.","Batagor kingsley ji tutu mangat dengan kerajin ewen keluarga dengan warga jakarta. Genep kinjap haguet kan bandung, keluarga dengan kekawalan rancak belaku peteh mili batagor kingsley."
858,ngaju,"Kopi yang paling enak di sini adalah kopi alpukat dan kopi pisang. Kopi bercampur alpukat tidak membuat rasa kopi ini memudar, sangat cocok di lidah saya sebagai pecinta kopi campuran. Jenis makanan yang disajikan pun lumayan enak, favorit saya adalah kentang gorengnya untuk harga terjangkau.","Kupi ji paling mangat hetuh te kupi alpukat dengan kupi pisang. Kupi becampur alpukat diak mawi angat kupi tuh nihau, puna cocok dengan belaiku sebagai penyinta kupi campuran. Jenis penginan ji nyerungan gin sadang kamangat, kasananganku te kantang goreng dengan rega terjangkau."
311,ngaju,Dia ketahuan bikin indomie goreng jumbo padahal kan kalau 1 itu tidak kenyang.,Iye te gitan ih pekasak indomie goreng bungkus hai amun baya ije te diak besuh
261,ngaju,"Saat mengunjungi rumah makan ini karena diajak rekan bisnis saya. Saat saya menikmati mie ini terasa memiliki citarasa yang nikmat sekali. Sayang saat itu, mi saya terlalu asin. Sehingga mi yang seharusnya sangat nikmat tidak bisa saya rasakan. Untuk suasana tempat tergolong biasa-biasa saja. Untuk harga tergolong sangat mahal. 2 mangkok mie harganya rp. 95.000.","Pas dumah huma kuman tuh awi imbit kawal bisnisku. Pas aku mengkeme mie jituh tege angat belai ji mangat tutu. Sayang ih pas te, mi aku lalau bekahing. Jadi nah mi ji seharus te manga tutu jadi diak kuketawa angat ah. Akan suasana eka tame je biasa-biasa ih. Akan rega tame ji larang tutu due mangkok mie rega te rp. tien puluh lime ribu."
582,ngaju,Driver ini tidak mau pickup barang dari tadi siang. Mohon ditindaklanjuti.,Sopir jituh dia hakun manduan bawang bara bentuk andau. Balaku ditindaklanjuti.
414,ngaju,Pagi yang melelahkan rasanya ingin diam saja,Hanjewu ji uyuh angat ah handak benyem ih
155,ngaju,Bidang lo bukan di dunia politik oon!,Bidangmuh beken hong dunia politik mameh!
351,ngaju,"Penasaran ingin dicoba ayam yang cukup terkenal itu. Siang itu sepi, pesan ayam bakar. Ternyata ayam bakarnya pedas. Anak-anak tidak bisa makan. Harusnya pelayan menanyakan mau pedas atau tidak karena ada 2 pilihan. Kemudian saya minta 2 ayam bakar yang tidak pedas. Ampun! Ayamnya cuma seperti digoreng terus dilumuri kecap. Kami sudah hilang napsu makan.","Handak katawan handak mencoba manuk je terkenal te. Bentuk andau te benyem, meteh manuk bapapui. Ternyata manuk ah padas. Anak anak dia ulih kuman. harus te pelayan misek helu en handak padas atau dia awi tege due pilihan. Limbas te aku balaku 2 manuk bapapui dia padas. Ampun, manuk ah kilau basanga lalu inenga kecap. Ikei jadi nihau selera kuman."
857,ngaju,"Awalnya ragu dengan kecepatan pelayanan di sini tapi lumayan lah, tepat waktu kok. aku lupa pesan jus apa sepertinya jus campuran begitu, oke sih. Dan makanannya juga ok. Ohya ini mereka kasi gratis es krim. Bisa dicoba tanya dengan pelayannya. Suka.","Sulak te ragu dengan kecapatan pelayanan hetuh tapi malar ih lah, tepat waktu ih, Aku kelapean meteh jus narai ampi te jus campuran kute, oke ih. Tuntang penginan te ok kea. Oh yuh lah jituh ewen nengak gratis es krim. Tau inyoba misek dengan pelayan te. Rajin."
248,ngaju,"Saya ke bandung baru kemarin baru kesampaian makan di sini. Kami makan di the valley suki. Kenyang, enak, pelayan ramah, dan pemandangannya keren kalau kita duduk dekat jendela. Ya dengan harga rp. 190.000, - / orang sudah termasuk pajak kita bisa makan sepuasnya, sistemnya seperti hanamasa tapi lebih asyik tempatnya.","Aku kan bandung haru male sampet kuman hetuh. Ikei kuman hong the valley suki . Besuh, mangat, pelayan bejenta, dengan tempayah ah bahalap tutu amun itah munduk tukep jendela. Yuh dengan rega Rp. seratus tien puluh ribu per biti jadi tame pajak itah tau kuman sepuasnya, sistem kilau hanamasa baya eka labih asyik."
280,ngaju,"Bingung mau makan ke mana yang tempatnya asik, makanan enak dan harga terjangkau? Ke sini saja. Saya dan pasangan sangat menikmati. Pengunjung kebanyakan anak muda jadi ikutan merasa muda lagi.","Bingung handak kuman kakueh je eka asyik, panginan mangat, tuntang rega terjangkau? hetuh ih. Aku dengan pasangan menikmati tutu. Kebanyakan are uluh tabela jadi angat kilau tabela kea."
11,ngaju,"Dari segi letak / lokasi cukup mudah dicari. Bangunan dan isi bagian di dalamnya menarik, apalagi ada taman kecil di dalamnya yang diisi juga dengan gentong yang airnya dibiatkan mengalir terus. Membuat suasananya jadi tambah romantis dan menyenangkan. Menu yang disajikan lumayan variatif dan dari segi rasa lumayan enak.",Akan belaku gawi hayak / belaku duhup dana indu elsa tau menghubungi : Pt. Bank mandiri persero tbk corporate secretary
739,ngaju,"Menu sushi kurang banyak, kalau bisa ada menu sushi dengan porsi kecil 2 potong. Harusnya ada pelengkap, wasabi, cabe bubuk. Jadi sebenarnya kurang istimewa.","Menu sushi kurang are, amun tau tege menu sushi dengan porsi kurik due katetek. Haru te tege pelengkap, wasabi, lombok bubuk. Jadi sebenar ah kurang istimewa."
881,ngaju,Baru pertama kali saya makan di warung ini. Bukan konsep kafe atau resto tapi tampil dengan warung makan yang menyajikan makanan tradisional.,Haru sinde kali aku kuman hong warung tuh. Beken konsep kafe atau resto tapi nyedia dengan warung kuman ji nyerungan penginan tradisional.
54,ngaju,"Saya datang ke maxi s resto bersama keluarga, ternyata di sana ada pesta pernikahan pesta ulang tahun sehingga tempat jadi penuh sekali. Pelayanannya jadi tidak baik. Seharusnya kalau tempat memang penuh, pihak resto memberitahukan kepada tamu sebelum tamu memarkirkan kendaraan saat itu hujan deras, jadi jarak tempat parkir ke resto lumayan jauh. Kalau perlu ditutup sementara selama pesta berlangsung.","Aku dumah kan maxi s resto hayak ije kehuma, sekalinya hong kanih tege parawei perkawinan parawei ulang nyelu mawi eka kuntep tutu. Uluh je begawi nyerungan jadi diak bahalap. Sepuna amun eka puna kuntep, ewen uluh resto mensanan akan tamu sehindai tamu memarkir kendaraan pas te hujan daras, jadi jarak eka parkir kan resto sadang kejau ah. Amun perlu inutup ih pendehan parawei masih tege."
660,ngaju,Telkom hackathon merupakan sebuah program besutan telkom indonesia yang bertujuan untuk mewadahi para generasi muda yang memiliki keahlian di bidang teknologi informasi maupun pemrograman untuk mengembangkan perusahaan rintisan yang mereka miliki.,Telkom hackaton merupakan ije buah program besutan telkom indonesia ji betujuan akan eka ewen uluh tebela ji tempu keahlian hong bidang teknologi informasi dengan pemrograman akan mawi pengembangan perusahaan rintisan ji ewen tempu.
704,ngaju,Minumannya saya tidak ada yang suka. Ayam gorengnya biasa saja. Ada saus keju tapi saya tidak suka saus keju di sini. Tidak enak.,Minuman aku jatun je rajin. Manuk basanga biasa ih. Tege saus keju tapi aku dia rajin dengan keju hetuh. Dia mangat.
805,ngaju,"Resto keluarga yang sangat direkomendasikan, pemandangan sekeliling resto yang sangat bagus, pondok-pondok yang nyaman, makanan yang disajikan juga lumayan enak, apalagi jika malam hari ini pemandangan resto sangat bagus","Resto keluarga ji bujur tau rekomendasi, taloh tempayah hakaliling resto ji tutu bahalap, pasah-pasah ji nyaman, penginan ji nyedia sadang kea kamangat amun jadi bentuk alem tepayah resto bahalap bujur"
444,ngaju,Saya mampir ke restoran ini untuk makan malam karena kebetulan lewat dalam perjalanan menuju hotel saya menginap dan karena sudah kelaperan dan saya dan teman akhirnya memilih untuk mampir di restoran ini. Rasa makanannya biasa saja bahkan kami diharuskan membayar terlebih dahulu meskipun kami belum selesai makan hanya karena jam sudah mendekati waktu tutup.,Aku tende kan restoran tuh akan kuman hamalem awi kebujuran mehalau huang jalanan kan hotel aku bemalem dengan awi jadi belauk kenaingku kute kea kawal ji kejarian mintih tau tende hong restoran tuh. Angat penginan te biasa ih maka ikei harus bayar helu hindai lepah ikei kuman awi jam jadi handak tukep wayah tutup.
