id,lang,source,target
596,ngaju,"Saya suka sekali makan di restoran ini, menu masakannya beragam, rasanya enak, harganya tidak terlalu mahal. ","AKu rajin tutu kuman hung restoran jituh, menu panginan are macam, angat ah mangat, reha dia lalu larang."
952,ngaju,Kurang pas apabila berkunjung ke bandung tanpa mencicipi batagor. Batagor burangrang adalah salah satu yang rasanya enak dan sausnya pun gurih.,Kurang pas amun betanjungan kan bandung diak mengkeme batagor. Batagor burangrang te buah ije ji angat nah mangat tuntang saus te gin gurih.
112,ngaju,"Yang makan ramai, antre, menu masakan, masakan standar seperti di rumah. Rasa biasa saja. Harga tidak sesuai kualitas rasa.",Aku jadi mendaftar tapi dia dinun sms bara 5111.
912,ngaju,"Saya bisa bilang ini adalah resto yang cocok untuk keluarga. Sambil istri saya belanja oleh-oleh, saya bisa menikmati makan siang di resto ini. Anak anak saya bisa bermain di tempat bermain dengan tiket yang murah. ","Aku jadi sanan jituh te resto ji pas akan keluarga. Halajur sawangku belanja oleh-oleh, aku tau mengkeme kuman bentuk andau hung resto tuh. Ewen hanakku tau busik hung eka busik dengan karcis ji murah."
635,ngaju,"Tempatnya ramai sekali, makanan bervariasi. Desain dan lingkungan nyaman. Udara sejuk, banyak tempat bermain anak.","Eka te rami tutu, penginan sukup genep. Desain dengan lingkungan taduh. Udara sajuh, are eka anak tau busik."
386,ngaju,"Baik kak, berkenan menunggu untuk kendala pada provider telkomsel akan direspon oleh rekan kami.","Bahalap kas, amun handak menunggu akan penghalang eka provider telkomsel mangat tege tanggapan bara kula ikei."
38,ngaju,Kasihan personil ungu sekarang sepi job gara-gara ditinggal pasha,Pasi peronil ungu wayah tuh sunyi tutu job awi ilihi Pasha
471,ngaju,"Kalau ada pulsa segudang, akan mengaktifkan wifi buat semua orang biar bisa internetan","Amun tege pulsa segudang, handak mawi aktif wifi akan uluh uras mangat tau beinternetan"
176,ngaju,Menkeu menyampaikan bahwa lemahnya rupiah lebih berpengaruh pada defisit transaksi berjalan,Menkeu menyampaikan awi lemahnya rupiah labih berpengaruh akan defisit transaksi berjalan
392,ngaju,"Pagi pagi di tol cipali sudah macet parah, bikin jengkel saja ini","Susung hanjewu hong tol cipali jadi sabak kuntep, mawi risek rahas ih jituh"
934,ngaju,"Perihal pergantian rekening untuk pembayaran autodebet BPJS, Bapak Luqman bisa datang ke kantor cabang Bank Mandiri pengajuan autodebet tersebut ya. Untuk dapat dilakukan tutup rekening terlebih dahulu.","Perihal pergantian rekening akan pembayaran autodebet BPJS, Bapa Luqman tau dumah kan kantor cabang Bank Mandiri pengajuan autodebet tersewutlah. Akan tau mawi nutup rekening terlebih helu."
785,ngaju,Mobil yang sehari-hari dipakai jeje adalah merk toyota dan berwarna krem.,Mobil je jandau jandai ha[an awi jeje iyete merk toyota tuntang berwarna krem.
245,ngaju,"Suasana sawah dan pegunungan, ada wine cellarnya. Tapi makanannya mahal, mestinya kualitas bisa lebih baik karena banyak restoran serupa di bandung sekarang sudah menjamur","Suasana sawah tuntang pegunungan, ada wine cellarnya. Tapi panginan larang,harus te kualitas tau labih bahalap hindai awi are restoran je serupa lagi kilau kulat."
469,ngaju,Paling kesal kalau ada orang mengobrol di jalan sambil motoran apalagi kalau jalannya sempit,Paling bajilek  amun tege uluh bekisah hong jalan dengan motor ji miar tuntang amun jalan te kurik
679,ngaju,"Pelayanan kurang aktif dan tidak ramah serta kurang dapat menjelaskan menu makanan yang ada, sehingga tamu merasa tidak diacuhkan dan didiamkan saja.","Pelayanan kurang aktif dengan diak bejenta kurang tau menjelaskan penginan ji tege, jadi mawi tamu angat diak nelua dengan mawi benyem bewei"
597,ngaju,"Restoran sangat bagus, pemandangan menghadap ke kota Bandar Lampung, sehingga sangat indah pada malam hari. Suasana sangat tenang, dekorasi ruangan sangat cantik. Saya sangat suka tempat ini.","Restoran bahalap tutu, pemandangan menghadap kota bandar Lampung, sehingga sangat bahalap huang malem andau. Suasana sangat tenang, dekorasi ruangan bahalap tutu. Aku rajin tutu dengan eka jituh"
650,ngaju,Calon pelamar cpns hanya dapat mendaftar di 1 instansi dan 1 formasi jabatan,Calon pelamar cpns baya ulih  mendaftar huang ije instansi dengan ije formasi jabatan
58,ngaju,"Makanan lumayan, saya order spring roll agak oily, harga hidangan utama cukup mahal. Bangunan unik tapi lokasi tidak terlalu bagus sehingga tempatnya selalu terlihat sepi. Saat order sebaiknya menyampaikannya lebih jelas, sebab yang terjadi pada kami, kami order 2 tapi menerima 3 item. Pelayan sangat ramah, tapi sikap kasirnya sedikit aneh. Mungkin saya tidak akan kembali lagi.","Penginan sadang, aku meteh spring roll isut bemenyak , rega penginan pokok sukup larang. Betang unik baya eka diak lalau bahalap tuntang eka rancak gitan suni. Wayah meteh ji bahalap sanan labih tarang, awi ji buah ikei, ikei meteh due tapi nerima telu petehan. Ewen ji menyerungan bejenta bujur,  baya sifat kasir ah nyalangking isut. Mungkin aku diak haluli hindai."
191,ngaju,"Ikan gurame bakar dan cah kangkung yang disajikan di red s dipo yang saya beli pada saat makan siang pada bulan november 2012, rasanya lumayan oke, hanya saja cabe pada sambalnya dan sayurannya seperti: Timun, tomat dan kangkungnya juga jeruk pada es jeruknya terasa kurang segar.","Lauk gurame panggang dengan tumis sayur kangkung ji nyerungan hong red s dipo je aku mili pas handak kuman bentuk andau hong bulan nopember nyelu due ribu due walas, angat ah sadang kemangat, baya pang lombok hung sambal te dengan sayuran te kilau : Tentimun, tomat dengan kangkung te kea bua jeruk ji hong es jeruk te angat kurang segar."
246,ngaju,Karya bakti bca finance posisi relationship officer membuka lowongan untuk penempatan pekanbaru,Karya bakti bca finance posisi relationship officer membuka lowongan akan  penempatan pekanbaru
470,ngaju,Makan bakso sambil ngobrol sama teman teman. Tempatnya asik buat makan. Harganya tidak terlalu mahal.,Kuman bakso hayak bekisah dengan kekawalan. Eka te mangat akan kuman. Rega diak lalau larang.
450,ngaju,"Di tengah proses hukum, warga tamansari bandung hadapi tekanan penggusuran","Hong bentuk proses hukum, uluh warga tamansari bandung meneharep tekanan penggusuran"
930,ngaju,Hari ini mau belanja di toko itu supaya bisa dapatkan peralatan masak keren plus kesempatan liburan ke Belanda.,Andau tuh handak belanja hong toko te mangat tau dinun ramu pekasak keren plus kesempatan liburan kan Belanda.
420,ngaju,"Jangankan 1 jam, ngeplay stories yang cuma beberapa detik saja loadingnya lama sekali, indosat luar biasa.","Ela gin ije jam, ngeplay stories ji baya pire-pire detik ih loading te tahi bujur, indosat luar biasa."
416,ngaju,Tidak bosan dan terkesima. Setiap datang ke congo kafe. Tempatnya tenang. Nyaman. Coba deh datang malam hari. Lebih romantis. Kalau bawa pasangan,Diak peda dengan terkesima. Genep dumah kan congo cafe. Eka ji taduh. Mangat. Kemelah dumah hamalem. Labih romantis. Amun imbit pasangan
863,ngaju,Harganya sangat terjangkau dan menu makanannya cukup kekinian. Tempat makannya didekor dengan baik dan unik.,Rega te terjangkau tutu dengan menu panginan cukup jaman wayah tuh. Eka kuman indekor bahalap tuntang unik
946,ngaju,Tempatnya kurang bersih. Untuk pergi ke sana agak susah karena rawan macet. Jadi berpikir dua kali kalau mau kembali lagi.,Eka te kurang barasih. Akan haguet kanih agak bahali awi rawan macet. Jadi bepikir due kali amun handak haluli hindai.
136,ngaju,"Tim saya akan mengadakan makan malam tema di burgundy. Daripada tersesat, saya dan sekretaris saya mencoba mengecek tempatnya dahulu sehari sebelumnya. Sekalian juga tes makanan. Perjalanannya jauh sekali dan naik turun bukit. Diperparah ketika kami ke sana itu hari minggu sore sehingga macet. Sesampainya di sana sih pemandangannya oke. Tapi layout restorannya biasa saja.","Timkuh handak nampae acara kuman hamalem tema hung burgundy. Daripada nihau hung jalan, aku dengan sekretaris menguji mengecek eka helu ije andau sehindai te. Memalus kea menguji penginan. Jalanan nah kejau tutu dengan mendai muhun bukit. Dahang tinai katika ikei kan kanih te andau minggu halemei takana macet. Jadi sampai kanih te taluh tempayah bahalap. Baya ujud restoran te bara baun biasa ih."
63,ngaju,"Saya gunaka bb tipe 9210, saya mendapat info sejak kemarin, dikenakan biaya gprs.","Aku mehapan bb tipe jalatien ribu due ratus sepuluh, aku dinun kabar bara male, buah biaya gprs.."
85,ngaju,"Handphone saya lenovo, kecemplung di comberan pas 2 minggu baru beli, jatuh di aspal pas ngebut naik motor sampai isinya ke mana-mana, telepon genggam saya masih bertahan, mantap memang lenovo.","Handphoneku lenovo, menjatu tame kan danum peciren pas due minggu haru mili, menjatu hong aspal pas gancang mendai motor sampai isi te tehambur kanih kate, telpun ganggamku masih ulih ih betahan, puna mias ketahan lenovo."
824,ngaju,Batagornya besar-besar dan dagingnya terasa banget. Mantap deh. Bumbunya rasanya enak. Cocok kalau dijadikan menu untuk makanan ringan sore hari.,Batagor te hai-hai dengan isi daging te puna kemeyan tutu. Mantap bah. Bumbu te angat nah mangat. Cocok amun dijadikan menu akan penginan mehiyan halemei.
323,ngaju,Sangat melelahkan malam ini.,Tutu nampae uyuh  alem tuh.
260,ngaju,Saya sudah kirim email complaint karena telepon tidak masuk terus.,"
Aku jadi ngirim email komplain awi telpon dia tau tame tarus"
7,ngaju,Porsinya banyak kepiting kisaran 100 ribu / porsi. Udang bakarnya enak. Enak bumbunya penuh rempah. Harga dan rasanya bersaing dengan perahu seafood jalan sumatera.,"Seratus ije asu dalmasian : Kisah beseri ije buah seri animasi televisi ji mawi ewen disney television animation, hayak gawi dengan jumbo pictures. "
225,ngaju,Rizal ramli beberkan cara stabilkan harga beras,Rizal ramli mamander kenampi cara stabilkan rega behas
75,ngaju,Saya sebagai warga jakarta malu kang sama oknum yang tidak bertanggung jawab yang mau sweeping bobotoh,Aku sebagai uluh warga jakarta mahamen le dengan oknum ji jatun tanggung jawab ji handak memapas bobotoh.
812,ngaju,Bali adalah salah satu pulau yang menjadi tujuan destinasi para turis.,Bali te puna ije pulau ji menjadi tujuan wisata ji guang ewen turis.
476,ngaju,"Perjalanan kali ini dalam rangka urusan mencari tempat yang rekomendasi untuk klien kami. Jarak tempuh dari bandung kota cukup jauh memang, tetapi hal tersebut bisa terbayar dengan pemandangan yang yang cantik di waktu malam dan makan malam dengan makanan dan pelayanan okay.","Tanjung kali tuh huang rangka gawian menggau eka ji rekomendasi akan klien ikei. Ketahi guang eka bara bandung kota puna sukup kejau , baya soal jite tau tebayar dengan tempayah ji bahalap kea."
724,ngaju,"Lokasinya memang sedikit tersembunyi di sudut sebuah perumahan. Konsep tempatnya bagus, seperti rumah di pedesaan eropa dengan lantai dan dinding kayu. Selain di dalam, pengunjung bisa menikmati makanannya di kursi-kursi di area taman yang unik menggunakan drum bekas.","Lokasi te memang isut nyehukan hung ujung sebuah perumahan. Konsep eka bahalap, kilau huma hung lewu eropa dengan laseh tuntang dinding kayu. Beken bara huang, pengunjung tau menikmati panginan hung kursi kursi area taman je unik hapan drum bekas."
880,ngaju,Kami menjual kabel hdmi premium 1 meter beli 2 gratis 1 di lapak Rich Com Store.,Ikei menjual kabel hdmi premium ije meter mili due gratis ije hong lapak Rich Com Sore.
526,ngaju,Tidak mau tahu. Balikin pulsa saya. Ini namanya perampokan. Paket nelp kalian juga perampokan. Baru ini saya komplain.,Dia handak katawa. Tambulie pulsakuh. Jituh perampokan ara. Paket nelpon ketun gin perampokan kea. Haru ih aku komplain.
680,ngaju,Daun memiliki berbagai jenis bentuk.,Dawen tege are  macam sukup genep ampi.
55,ngaju,"Saya dan keluarga mencoba bersantap di karamba resto karena sopir mobil sewa kami merekomendasikannya. Kami memang tiba di tempat agak malam sekitar pakai. 21 meskipun restoran belum tutup atau bersiap-siap akan tutup, namun beberapa menu telah habis. Bahkan ibu dan suami saya memesan nasi timbel yang sayur asemnya sudah habis dan diganti sup sayur oleh pihak resto. Tidak banyak pilihan yang bisa kami pilih. Kurang rekomendasi.",Aku dengan uluh ije kehuma menguji kuman hong karamba resto badin sopir oto ji nyewa ikei mensanan ah. Ikei puna sampai kan eka jadi hamalem handak jam jalatien aluh restoran hindai nutup atau menatap  handak nutup maka pire-pire penginan jadi lepah. Nyamah indu dengan bananku jadi memeteh bari timbel ji juhu asem ah jadi lepah dengan nengkiri sup juhu bara uluh resto. Diak are intihan ji tau ikei mintih ah. Tapas sanan.
234,ngaju,"Berubah status jadi universitas, bsi gelar seminar motivasi","Berubah status jadi universitas, tau nyelengara  seminar motivasi"
133,ngaju,"Rumah makan zaman dahulu namun rasa tetap sama enaknya, ayam dan nasi kreceknya enak sekali, kadang saya sengaja beli untuk bungkus ke rumah","Huma penginan jaman huran amun angat tatap sama kemangat ah, manuk dengan bari krecek ah mangat tutu,  kadang aku sengaja mili akan behata kan huma."
765,ngaju,"Agak kesal juga kalau tiap hari lewat sana melulu. Sempit, dua arah, macet sudah jadi makanan sehari-hari","Agak bajilek kea mun tiap andau halului kanih tarus. Seke, due arah, macet jadi panginan jandau jandau"
546,ngaju,Adikku diterima di teknik lingkungan ITB,Andikuh jadi inarima hung teknik lingkungan ITB
265,ngaju,"Tolong cepat tindaklanjuti pengaduan saya, sebelum korban meretas gopay jadi bertambah.","Dohop capat tindak lanjut laporankuh, sahindai korban merentas gopay batambah"
798,ngaju,Menu utama andalan mereka adalah ayam betutu yang dapat dipilih variasi rasanya mulai dari tidak pedas hingga sangat pedas. Selain ayam juga ada bebek betutu dengan variasi rasa yang sama.,Menu utama adalah ewen iyete manuk betutu je tau dipilih variasi angat ah bara je dia padas sampai padas tutu. Beken bara manuk tege kea itik betutu dengan variasia angat je sama.
67,ngaju,Tidak pernah bisa bicara kata-kata kasar ke pasangan walau tujuannya bercanda / memang lagi marah banget karena saking respeknya saya ke dia,Diak puji tau pander ji kutak ngir ngar dengan kebalinku aluh tujuan te hureh atau puna bujur sangit tutu awi tagal hormatku dengae.
722,ngaju,Kemarin mereka mendaftar beasiswa djarum,Male ewen mendaftar beasiswa djarum
232,ngaju,Kak adit aku pesan indominya satu,Kak adit aku meteh indomie ah ije
35,ngaju,"Oh iya diketerangan kan note 3 pro, kok yang dikirim note 3 ya, kecewa juragan","Oh yuh hong keterangan kan note telu pro, tapi ji ngirim note telu ih, pehe atei juragan."
659,ngaju,"Pria tabrak warga dengan mobil di prancis, 2 terluka","Hatue nabrak uluh  hete dengan oto hong prancis, due behimang"
25,ngaju,"Saya penasaran pingin makan di sini. Ketika pesan, suara mas-masnya kecil sekali ampun deh tidak jelas bicara apa blubup blubup begitu haha. Saya memesan mi ayam 2baso ekstra, pacar saya memesan bakso urat soun. Tidak lama datang pesanan pacar saya dan ternyata tidak sesuai ekspektasi.","Aku handak ketawa mipen kuman hetuh. Katika meteh, auh hatue te kurik tutu akay ah diak jelas pander narai blubup blubup kute tetawe haha. Aku memeteh mi manuk due bakso labih ah,  pacarku memeteh bakso uhat soun.Diak tahi dumah petehan pacarku en diak kilau kahandak belai ah."
757,ngaju,Teman saya bekerja di gojek,Kawalkuh bagawi melai gojek
703,ngaju,"Ya, saya sudah hubungi via halo bca. Namun terputus terus dan pulsa saya kepotong banyak kalau telepon berulang-ulang!","Yuh, aku jadi mahubung mahalau halo bca. Namun pina putus tarus, tuntang pulsakuh tatetek are mun nelpon papire kali."
957,ngaju,"Suasana sejuk, hijau, menyegarkan dan sangat cocok untuk refreshing saat kabur dari rutinitas. Untuk makanan yang mahal menurut saya bukan masalah karena lokasi yang bagus lebih penting.","Suasana sejuk, hijau, menyegarkan dengan cocok tutu akan refreshing wayah hadari bara rutinitas. Akan penginan ji larang menumunku diak masalah awi lokasi ji bahalap labih penting."
330,ngaju,Bosan dengan dunia ini yang penuh dengan kemunafikan,Peda belai dengan dunia tuh ji kuntep dengan kemunafikan
609,ngaju,Orang sekarang kebanyakan sulit menghargai orang lain,Uluh metuh tuh tepeare bahali merega uluh beken.
332,ngaju,Tempat ini mengimingi makan steak dan daging dengan harga murah. Namun kenyataannya tidak murah jika dibandingkan dengan kualitas dagingnya yang tidak enak. Dagingnya keras dan rasanya hambar.,Eka jituh promosi kuman steak  dengan isin rega murah. Baya kejarian te diak murah amun imbanding dengan mutu isin te ji diak mangat. Isi te baliat dengan angat te betawah sebeau.
869,ngaju,Pagi sudah marah-marah karena pelayanan di bank cabang sanur yang tidak professional dan mengecewakan! Tidak salah banyak penilaian customer jelek.,Hanjewu jadi singi-singik awi pelayanan hong bank cabang sanur ji diak profesional dengan mengecewakan. Diak sala are penilaian pelanggan diak bahalap.
119,ngaju,Pergi untuk makan siang bersama 6 keluarga yang terdiri dari orang dewasa dan anak anak. Kami mendapatkan saung yang jauh di atas. Kebayang dong jalan ke atas yang sangat melelahkan. Tempatnya memang bagus tapi lokasi saung yang sangat jauh dan melelahkan menuju ke atas. Saran saya kalau mau ke situ jangan pas makan siang karena pasti penuh. Harga makanan lumayan misil. Tapi pemandangannya bagus sekali.,Susung hanjewu handak basingi ih dengan sinyal telkomsel.
634,ngaju,Steiknya lumayanlah enak. Warung ini cocok buat pelajar atau mahasiswa hehehe karena harganya terjangkau. Untuk makanannya oke kok.,Steak te sadang ih kamangat. Warung tuh pas akan pelajar atau mahasiswa hehehe awi rega te tejangkau. Akan penginan te pas ih.
307,ngaju,"Menurut saya makan di sini porsinya banyak dan harganya murah, terus makannya cepat datangnya lagi dan tempatnya juga bersih dan luas","Numun aku kuman hetuh porsi te are dengan rega te murah, palus penginan te capat dumah kea tuntang eka barasih kea dengan lumbah."
264,ngaju,"Orang indonesia itu butuh pemimpin visioner bukan penghibur,",Uluh Indonesia tuh perlu pemimpin visioner beken penghibur
565,ngaju,"Tong dji menyajikan aneka makan dan minuman, tidak hanya teh. Yang direkomendasikan: Teh poci gula batunya dan nasi goreng","Tong dji nyadia are macam panginan tuntang mihup, dia baya teh. Je tedirekomendasikan : Teh Poci gula batu tuntang bari basanga"
338,ngaju,"Saya bukanlah penggemar berat kambing karena tidak tahan dengan baunya, tapi makan di tempat ini, saya seperti tidak sedang makan kambing! Dagingnya empuk, enak dan tidak berbau. Suasana restonya pun enak dan nyaman","Aku beken penggemar behat kambing karana diak ulih dengan ewau te, baya kuman uka hetuh, aku kilau diak sadang kuman kambing! Isi te hapuk, mangat dengan diak behewau. Suasana resto te gin mangat dengan sanang jatunti tandingan"
156,ngaju,"Saya mau tutup kartu kredit dari beberapa bulan lalu, nih.","Aku handak nutup kartu kredit bara pire pire bulan ji halau, tuh."
71,ngaju,Yang benar-benar real tidak ada settingan,Ji bujur bujur nyata jatunti tege ji matur ah.
425,ngaju,Duh indosat mengecewakan. Aku mau daftar baru kok malah kena tarif per kb? Pulsa berkurang drastis,Akay indosat mawi kecewa. Aku handak daftar haru boh buah tarif per kb? Pulsa daras kekurang
775,ngaju,Aku memesan jaket gunung eiger,Aku mameteh jaket gunug eiger
431,ngaju,"Pelayanan sih memang cepat tapi masakannya asal asalan saja, asal jadi asal matang saja, pesan udang saos tiram, sama saja dengan masakan kepiting saos padang, tang untuk kepiting tidak diberikan jika tidak diminta.","Pelayanan te puna capat baya pekasak te berangai -rangai ih, berangai ampi berangai matang ih, meteh undang saus tudai, sama ampi dengan kepiting saus padang, tang akan kepiting diak nengak amun diak belaku."
576,ngaju,"Restoran dengan konsep tempat makan yang sangat asri, apalagi kalau malam suasananya sangat indah dengan lampu lampunya, makanannya pun enak rasanya. Cocok untuk tempat kumpul keluarga.","Restoran dengan konsep eka kuman asri tutu, apalagi mun hamalem suasana te bahalap tutu dengan lampu lampu, panginan te mangat angat ah. Cocok akan eka kumpul keluarga."
759,ngaju,Pertama coba karena ulasan beberapa orang tapi ternyata rasanya biasa saja. Sepiring 30 ribu. Sulit cari tempat duduk.,Pertama nyuba awi pander papire uluh baya angat ah biasa ih. Ije piring telu puluh ribu. Bahali gau eka munduk.
359,ngaju,"Tadi katanya suruh tunggu saja sampai sms diterima, sudah seharian tidak ada juga!","Endau kuan ye suhu tunggu ih sampai sms jadi tame, jadi ji jandau jatunti kea!"
473,ngaju,Saatnya membuat karya visual 360 derajat dengan samsung! Ikuti langkah mudah di video ini.,Pas wayah tuh mawi gawian visual telu ratus jahawen puluh derajat hapan samsung! Numunlah langkah mudah hong video tuh.
242,ngaju,"Katanya detil aroma chamomile, tapi kok baunya tidak enak begini sih","Kua detil hewau chamomile, tapi hewau ah dia mangat kilau tuh."
92,ngaju,Saya sangat puas dengan spesifikasi laptop asus,Aku tuh puas tutu dengan spesifikasi laptop asus
104,ngaju,Wekkend yang menyenangkan bersama keluarga di tempat yang fasilitasnya memadai dan harga terjangkau. Liburan makin menyenangkan dengan adanya kebun stroberi yang bisa memetik langsung dari kebunnya.,"Handak ketawan dengan kuan uluh, menyampet wayah kusus menggau kan warung jual te. Tempara ah kur hambaruan. Sampai tembus kare macet. Akai. Palus bele dengan jalan ah. Mias ji lalau kekejau, dahang hindai jalan ah ji diak bahalap mawi semangat nempara muhun ndai. Biti huma betang bahalap, tege musik belum. Ampi isut ih uluh tau tame diak lalau tau are uluh huang ruangan te. Daftar penginan sukup mias dengan pehias. Tapi diak sukup berega menentamba kebelek huang perjalanan."
849,ngaju,Mohon perhatiannya admin. Jaringan di cileungsi bogor sangat buruk kualitasnya. Padahal bayarnya mahal.,Belaku perhatian admin nah. Jaringan hong cileungsi bogor diak bahalap bujur mutu te. Padahal bayar te larang.
615,ngaju,"Makanannya lezat: ayam goreng, tumis terong, sup ikan, tempe goreng, sambal. Pelayanannya juga bagus.","Penginan je mangat : manuk basanga, tumis tarung, sup lauk, tempe basanga, sambal. Pelayanan te kea bahalap."
848,ngaju,"Pertama kali ke tempat ini, reservasi dan dapat nomor 3. Minta tempat di lantai bawah sehingga tidak perlu naik tangga karena ada yang lututnya sedang sakit. Menunggu hampir 40 menit tanpa kepastian. Saya batalkan. Tadinya tidak mau beri rating 1 karena memang mungkin ramai dan permintaan saya khusus, jadi sulit. Eh mbaknya malah ketus.","Haru sinde kali kan eka tuh, reservasi dengan dinun nomor telu. Belaku eka hong laseh penda jadi diak perlu mendai tangga awi tege ji utut nah sadang nengak rating ije awi puna mungkin rami dengan belaku ayungku khusus, jadi bahali. Eh, mbak te malah merangut."
131,ngaju,Hasil quick count pilkada serentak 2018 diwarnai banyak kejutan.,Hasil hitung capat pilkada ji hayak uras due ribu hanya belas ampi are mawi tekejet. 
605,ngaju,Pemandangan bagus untuk santai bersama di sore hari dan malam hari. Makanan cukup variatif dan enak.,Pemandangan bahalap akan santai hayak hayak pas halemei atau hamalem andau. Panginan cukup are masam tuntang mangat.
286,ngaju,Saya dan sodara istri saya sedang menghabiskan waktu di palembang. Saya mencari tempat makan dan bertemulah bakmi jogya. Setelah masuk terkejutlah karena saya harus mencari tempat duduk dan mencari tempat yang kosong saya terlantar selama 35 menit. Setelah memesan dengan menu mi godok. Lagi saya menunggunya sejam dan ini membuat saya hilang selera makan itu pun ditanyakan ke tukang masak.,"Aku dengan pahari sawangkuh pas lagi mampalepah waktu hung palembang. Aku manggau eka kuman lalu ikei hasupa bakmi jogya. Pas tame pina takejet aku awi harus manggau eka munduk tuntang manggau eka je kosong aku terlantar katahi telu puluh lime menit. Libas te meteh menu mie godok.aku nunggu ije jam hindai, te je nampae aku nihau belai kuman jite gin harus misek helu dengan uluh ji pekasak."
897,ngaju,"Tempat tidurnya kotor, bantalnya bau semua... buat badan jadi gatal kayak banyak hewannya, jadi tidak bisa tidur dengan nyenyak.","Eka betiruh te papa, bantal nah behewau uras...akan biti mawi gatel ampi are lilih ah, mawi diak tau betiruh dengan lilap."
907,ngaju,Perjalanan malam ini sungguh melelahkan.,Miar tanjung hamalem tuh puna heka tutu.
564,ngaju,"Saya ke sini bersama beberapa teman untuk makan siang. Akses jalan menuju lokasi kafe ini sangat sempit dan terjal, bahkan beberapa bagian rusak. Kami memesan beberapa menu makanan. Setelah menunggu cukup lama, ketika makanan datang rasa dan tampilannya mengecewakan. Ternyata rasanya juga mengecewakan.","Aku ka hetuh hayak dengan paire kawal akan kuman bentuk andau. Akses jalan menuju lokasi cape tuh kurik tuntang terjal, bahkan papire bagian ah rusak. Ikei mamateh papire menu panginan. Libas manunggu cukup katahi, pas panginan dumah angat tuntang penampilan mengecewakan. Ternyata angat ah mengecewakan keya."
441,ngaju,Sesuai namanya creative space kafe sehingga banyak karya seni yang bisa dinikmati di dalamnya dan beberapa patung di bawah. Sedangkan di atas ada kafe dengan desain yang menarik dan cocok dikunjungi di sore hari. Tempatnya yang berada di lokasi tinggi membuat tempat ini punya pemandangan yang bagus.,Sesuai aran te creative space kafe jadi are karya seni ji tau mite merega hung huang te dengan pire-pire patung hong penda. Sedangkan hung hunjun tege kafe dengan gambar ji menarik dengan pas guang hung halemei. Eka te gin tege hong eka ji gantung mawi uka tuh tempu tempayahan ji bahalap.
481,ngaju,Selamat siang orang miskin. Semoga kalian cepat mati atau makin miskin dan sengsara.,Selamat bentuk andau uluh miskin. Semoga ketun capat matei atau dahang miskin dengan menana sare.
360,ngaju,Gojek akan mulai membuka layanan mereka di beberapa negara asia tenggara.,Gojek handak nempara membuka layanan ewen hung kekare negara asia tenggara.
